,id,conversation_id,created_at,date,time,user_id,tweet,language,hashtags,reply_to,translated_text,tokenized_text
0,1601359649575690241,1601359649575690240,2022-12-10 07:34:26 Malay Peninsula Standard Time,2022-12-10,07:34:26,1597746025489367042,Has anyone recently noticed signs #chatGPT is scaling back it's abilities? I used to be able to search and aggregate tweets on any theme or search top/ best most whatever in *. Now it refuses prompts more n' more. Hope the woke minority are not wielding influence. #gpt3 @OpenAI,en,"['chatgpt', 'gpt3']",[],Has anyone recently noticed signs #chatGPT is scaling back it's abilities? I used to be able to search and aggregate tweets on any theme or search top/ best most whatever in *. Now it refuses prompts more n' more. Hope the woke minority are not wielding influence. #gpt3 @OpenAI,"['Has', 'anyone', 'recently', 'noticed', 'signs', '#chatGPT', 'is', 'scaling', 'back', ""it's"", 'abilities', '?', 'I', 'used', 'to', 'be', 'able', 'to', 'search', 'and', 'aggregate', 'tweets', 'on', 'any', 'theme', 'or', 'search', 'top', '/', 'best', 'most', 'whatever', 'in', '*', '.', 'Now', 'it', 'refuses', 'prompts', 'more', 'n', ""'"", 'more', '.', 'Hope', 'the', 'woke', 'minority', 'are', 'not', 'wielding', 'influence', '.', '#gpt3']"
1,1601359547469156352,1601359536513724416,2022-12-10 07:34:02 Malay Peninsula Standard Time,2022-12-10,07:34:02,1215382142575837184,"But the capabilities of a good developer or researcher don't lie in the code, it's the thought that goes behind that code. Here it is in #chatGPT's own words:  https://t.co/TePm3HsTFq",en,['chatgpt'],[],"But the capabilities of a good developer or researcher don't lie in the code, it's the thought that goes behind that code. Here it is in #chatGPT's own words:  https://t.co/TePm3HsTFq","['But', 'the', 'capabilities', 'of', 'a', 'good', 'developer', 'or', 'researcher', ""don't"", 'lie', 'in', 'the', 'code', ',', ""it's"", 'the', 'thought', 'that', 'goes', 'behind', 'that', 'code', '.', 'Here', 'it', 'is', 'in', ""#chatGPT's"", 'own', 'words', ':', 'https://t.co/TePm3HsTFq']"
2,1601359536513724417,1601359536513724416,2022-12-10 07:33:59 Malay Peninsula Standard Time,2022-12-10,07:33:59,1215382142575837184,I really like #chatGPT and all other models that produce text or code and no I don't think they will replace anyone. And people should start to think of their applications. We want to advance our work and to do so we need everything to be more efficient.,en,['chatgpt'],[],I really like #chatGPT and all other models that produce text or code and no I don't think they will replace anyone. And people should start to think of their applications. We want to advance our work and to do so we need everything to be more efficient.,"['I', 'really', 'like', '#chatGPT', 'and', 'all', 'other', 'models', 'that', 'produce', 'text', 'or', 'code', 'and', 'no', 'I', ""don't"", 'think', 'they', 'will', 'replace', 'anyone', '.', 'And', 'people', 'should', 'start', 'to', 'think', 'of', 'their', 'applications', '.', 'We', 'want', 'to', 'advance', 'our', 'work', 'and', 'to', 'do', 'so', 'we', 'need', 'everything', 'to', 'be', 'more', 'efficient', '.']"
3,1601359523683651584,1601359523683651584,2022-12-10 07:33:56 Malay Peninsula Standard Time,2022-12-10,07:33:56,1519786375771348993,"Thread on #ChatGPT, and why I think that, yes, it will become a massively influential functionality that will turbo charge productive capacity in dozens of sectors, it won't just replace jobs, it'll make new ones and let us do more than we can now; but, we need some time. /1  https://t.co/QFRtESlh37",en,['chatgpt'],[],"Thread on #ChatGPT, and why I think that, yes, it will become a massively influential functionality that will turbo charge productive capacity in dozens of sectors, it won't just replace jobs, it'll make new ones and let us do more than we can now; but, we need some time. /1  https://t.co/QFRtESlh37","['Thread', 'on', '#ChatGPT', ',', 'and', 'why', 'I', 'think', 'that', ',', 'yes', ',', 'it', 'will', 'become', 'a', 'massively', 'influential', 'functionality', 'that', 'will', 'turbo', 'charge', 'productive', 'capacity', 'in', 'dozens', 'of', 'sectors', ',', 'it', ""won't"", 'just', 'replace', 'jobs', ',', ""it'll"", 'make', 'new', 'ones', 'and', 'let', 'us', 'do', 'more', 'than', 'we', 'can', 'now', ';', 'but', ',', 'we', 'need', 'some', 'time', '.', '/', '1', 'https://t.co/QFRtESlh37']"
4,1601359411347615744,1601359411347615744,2022-12-10 07:33:30 Malay Peninsula Standard Time,2022-12-10,07:33:30,2522931816,#chatGPT is a surefire way to future life  https://t.co/epypVYZl28,en,['chatgpt'],[],#chatGPT is a surefire way to future life  https://t.co/epypVYZl28,"['#chatGPT', 'is', 'a', 'surefire', 'way', 'to', 'future', 'life', 'https://t.co/epypVYZl28']"
5,1601359298621509632,1601359298621509632,2022-12-10 07:33:03 Malay Peninsula Standard Time,2022-12-10,07:33:03,82753,Bitcoin explained as HP Lovecraft #ChatGPT 😂  https://t.co/dqjvAh5VB1,en,['chatgpt'],[],Bitcoin explained as HP Lovecraft #ChatGPT 😂  https://t.co/dqjvAh5VB1,"['Bitcoin', 'explained', 'as', 'HP', 'Lovecraft', '#ChatGPT', '😂', 'https://t.co/dqjvAh5VB1']"
6,1601359235094573056,1601359235094573056,2022-12-10 07:32:48 Malay Peninsula Standard Time,2022-12-10,07:32:48,17063978,These started showing up in my #chatGPT responses. Looks like it's typing some markdown code but is it trying to pull training data or spontaneously pulling up random IDs?  https://t.co/O0bKM32IjL,en,['chatgpt'],[],These started showing up in my #chatGPT responses. Looks like it's typing some markdown code but is it trying to pull training data or spontaneously pulling up random IDs?  https://t.co/O0bKM32IjL,"['These', 'started', 'showing', 'up', 'in', 'my', '#chatGPT', 'responses', '.', 'Looks', 'like', ""it's"", 'typing', 'some', 'markdown', 'code', 'but', 'is', 'it', 'trying', 'to', 'pull', 'training', 'data', 'or', 'spontaneously', 'pulling', 'up', 'random', 'IDs', '?', 'https://t.co/O0bKM32IjL']"
7,1601359033440825344,1601359033440825344,2022-12-10 07:32:00 Malay Peninsula Standard Time,2022-12-10,07:32:00,16053116,Not just LinkedIn but Twitter too  #chatgpt  https://t.co/y1ezXSKDa9,en,['chatgpt'],[],Not just LinkedIn but Twitter too  #chatgpt  https://t.co/y1ezXSKDa9,"['Not', 'just', 'LinkedIn', 'but', 'Twitter', 'too', '#chatgpt', 'https://t.co/y1ezXSKDa9']"
8,1601358969607720961,1601358969607720960,2022-12-10 07:31:44 Malay Peninsula Standard Time,2022-12-10,07:31:44,256388453,#ChatGPT  https://t.co/pUltwg29ed,qme,['chatgpt'],[],#ChatGPT  https://t.co/pUltwg29ed,"['#ChatGPT', 'https://t.co/pUltwg29ed']"
9,1601358966130634753,1601358966130634752,2022-12-10 07:31:43 Malay Peninsula Standard Time,2022-12-10,07:31:43,334897238,"También, hace nada, en pleno 2020, me planteaba una poralidad semántica matemática creativa imposible: Enseñar ilógica a las AIs,  programarlas para lo irracional.  @javilop #TouchData #ChatGPT #Adnerd",es,"['touchdata', 'chatgpt', 'adnerd']",[],"Also, not long ago, in the middle of 2020, I proposed an impossible creative mathematical semantic porality: Teaching illogic to AIs, programming them for the irrational.  @javilop #TouchData #ChatGPT #Adnerd","['Also', ',', 'not', 'long', 'ago', ',', 'in', 'the', 'middle', 'of', '2020', ',', 'I', 'proposed', 'an', 'impossible', 'creative', 'mathematical', 'semantic', 'porality', ':', 'Teaching', 'illogic', 'to', 'AIs', ',', 'programming', 'them', 'for', 'the', 'irrational', '.', '#TouchData', '#ChatGPT', '#Adnerd']"
10,1601358791521767425,1601358791521767424,2022-12-10 07:31:02 Malay Peninsula Standard Time,2022-12-10,07:31:02,758017134593204224,All right! We’ve got our supercharged virtual cohost Nancy hooked into #ChatGPT to talk about the future of learning in an episode of #trendingined - don’t miss it!  #podcast #technology #innovation #futureofeducation #futureoflearning @madintangibles   https://t.co/GpVdfS2hc6,en,"['chatgpt', 'trendingined', 'podcast', 'technology', 'innovation', 'futureofeducation', 'futureoflearning']",[],All right! We’ve got our supercharged virtual cohost Nancy hooked into #ChatGPT to talk about the future of learning in an episode of #trendingined - don’t miss it!  #podcast #technology #innovation #futureofeducation #futureoflearning @madintangibles   https://t.co/GpVdfS2hc6,"['All', 'right', '!', 'We', '’', 've', 'got', 'our', 'supercharged', 'virtual', 'cohost', 'Nancy', 'hooked', 'into', '#ChatGPT', 'to', 'talk', 'about', 'the', 'future', 'of', 'learning', 'in', 'an', 'episode', 'of', '#trendingined', '-', 'don', '’', 't', 'miss', 'it', '!', '#podcast', '#technology', '#innovation', '#futureofeducation', '#futureoflearning', 'https://t.co/GpVdfS2hc6']"
11,1601358784877600769,1601358784877600768,2022-12-10 07:31:00 Malay Peninsula Standard Time,2022-12-10,07:31:00,4508606368,"Platform #ChatGPT dan #AlphaCode membuka spekulasi bahwa perkembangan artificial general intelligence (AGI) yg mampu meniru manusia akan terjadi. Tenang saja kawan-kawan, adanya 'skynet' seperti film 'terminator' gak akan terjadi in our lifetime 😉🙂😉  https://t.co/PF4TKCYHov",in,"['chatgpt', 'alphacode']",[],"#ChatGPT and #AlphaCode platforms open speculation that the development of artificial general intelligence (AGI) capable of imitating humans will occur. Take it easy, guys, the existence of 'skynet' like the movie 'terminator' will not happen in our lifetime 😉🙂😉 https://t.co/PF4TKCYHov","['#ChatGPT', 'and', '#AlphaCode', 'platforms', 'open', 'speculation', 'that', 'the', 'development', 'of', 'artificial', 'general', 'intelligence', '(', 'AGI', ')', 'capable', 'of', 'imitating', 'humans', 'will', 'occur', '.', 'Take', 'it', 'easy', ',', 'guys', ',', 'the', 'existence', 'of', ""'"", 'skynet', ""'"", 'like', 'the', 'movie', ""'"", 'terminator', ""'"", 'will', 'not', 'happen', 'in', 'our', 'lifetime', '😉', '🙂', '😉', 'https://t.co/PF4TKCYHov']"
12,1601358765629980672,1601357150110253056,2022-12-10 07:30:56 Malay Peninsula Standard Time,2022-12-10,07:30:56,1345501484042096640,Here's how Google translate handled all 3 translations and #ChatGPT giving Google another lesson:  https://t.co/PGp11x3xUi,en,['chatgpt'],[],Here's how Google translate handled all 3 translations and #ChatGPT giving Google another lesson:  https://t.co/PGp11x3xUi,"[""Here's"", 'how', 'Google', 'translate', 'handled', 'all', '3', 'translations', 'and', '#ChatGPT', 'giving', 'Google', 'another', 'lesson', ':', 'https://t.co/PGp11x3xUi']"
13,1601358759032672256,1601358759032672256,2022-12-10 07:30:54 Malay Peninsula Standard Time,2022-12-10,07:30:54,714196520388562944,#ChatGPT is seriously impressive. Writer's block will become a thing of the past.  https://t.co/X3x2EOg7su,en,['chatgpt'],[],#ChatGPT is seriously impressive. Writer's block will become a thing of the past.  https://t.co/X3x2EOg7su,"['#ChatGPT', 'is', 'seriously', 'impressive', '.', ""Writer's"", 'block', 'will', 'become', 'a', 'thing', 'of', 'the', 'past', '.', 'https://t.co/X3x2EOg7su']"
14,1601358750295552000,1601358750295552000,2022-12-10 07:30:52 Malay Peninsula Standard Time,2022-12-10,07:30:52,22426910,"An answer for everything and everyone: ""My main function is to assist with tasks and answer questions to the best of my ability within the bounds of my training and knowledge."" #ChatGPT",en,['chatgpt'],[],"An answer for everything and everyone: ""My main function is to assist with tasks and answer questions to the best of my ability within the bounds of my training and knowledge."" #ChatGPT","['An', 'answer', 'for', 'everything', 'and', 'everyone', ':', '""', 'My', 'main', 'function', 'is', 'to', 'assist', 'with', 'tasks', 'and', 'answer', 'questions', 'to', 'the', 'best', 'of', 'my', 'ability', 'within', 'the', 'bounds', 'of', 'my', 'training', 'and', 'knowledge', '.', '""', '#ChatGPT']"
15,1601358733799407617,1601358733799407616,2022-12-10 07:30:48 Malay Peninsula Standard Time,2022-12-10,07:30:48,1162174104818130944,Another amazing example of #ChatGPT (found in @bentossell's awesome AI newsletter)  SumUp - create bite-sized summaries of news articles 👇  https://t.co/QzYvBYmSPa,en,['chatgpt'],[],Another amazing example of #ChatGPT (found in @bentossell's awesome AI newsletter)  SumUp - create bite-sized summaries of news articles 👇  https://t.co/QzYvBYmSPa,"['Another', 'amazing', 'example', 'of', '#ChatGPT', '(', 'found', 'in', ""'"", 's', 'awesome', 'AI', 'newsletter', ')', 'SumUp', '-', 'create', 'bite-sized', 'summaries', 'of', 'news', 'articles', '👇', 'https://t.co/QzYvBYmSPa']"
16,1601358660005146624,1601358660005146624,2022-12-10 07:30:31 Malay Peninsula Standard Time,2022-12-10,07:30:31,1597642566236766211,I was impressed when I asked this morning ChatGPT to tell me how to create a modal in Angular. Very clear steps and explanation.   What have you done with #ChatGPT so far? 👇,en,['chatgpt'],[],I was impressed when I asked this morning ChatGPT to tell me how to create a modal in Angular. Very clear steps and explanation.   What have you done with #ChatGPT so far? 👇,"['I', 'was', 'impressed', 'when', 'I', 'asked', 'this', 'morning', 'ChatGPT', 'to', 'tell', 'me', 'how', 'to', 'create', 'a', 'modal', 'in', 'Angular', '.', 'Very', 'clear', 'steps', 'and', 'explanation', '.', 'What', 'have', 'you', 'done', 'with', '#ChatGPT', 'so', 'far', '?', '👇']"
17,1601358545718546438,1601358545718546432,2022-12-10 07:30:03 Malay Peninsula Standard Time,2022-12-10,07:30:03,57272635,Inquietud a OpenAI en vez de  búscalo en Google como ChatGPT puede cambiar (o  #ChatGPT #Google #OpenAI  https://t.co/V3eApSMorU #followme,es,"['chatgpt', 'google', 'openai', 'followme']",[],Concern to OpenAI instead of Google it as ChatGPT may change (or #ChatGPT #Google #OpenAI https://t.co/V3eApSMorU #followme,"['Concern', 'to', 'OpenAI', 'instead', 'of', 'Google', 'it', 'as', 'ChatGPT', 'may', 'change', '(', 'or', '#ChatGPT', '#Google', '#OpenAI', 'https://t.co/V3eApSMorU', '#followme']"
18,1603902518752432133,1603902518752432128,2022-12-17 07:58:54 Malay Peninsula Standard Time,2022-12-17,07:58:54,46005848,"#ChatGPT might be good at fiction and well known facts, but try it on anything slightly obscure. It sounds confident spewing inaccurate junk. Just sayin’",en,['chatgpt'],[],"#ChatGPT might be good at fiction and well known facts, but try it on anything slightly obscure. It sounds confident spewing inaccurate junk. Just sayin’","['#ChatGPT', 'might', 'be', 'good', 'at', 'fiction', 'and', 'well', 'known', 'facts', ',', 'but', 'try', 'it', 'on', 'anything', 'slightly', 'obscure', '.', 'It', 'sounds', 'confident', 'spewing', 'inaccurate', 'junk', '.', 'Just', 'sayin', '’']"
19,1603902311360651264,1603902311360651264,2022-12-17 07:58:04 Malay Peninsula Standard Time,2022-12-17,07:58:04,2193071,"""What can they make, then? It depends what you can ask, and what you can explain to them and show to them, and how explanation they need."" via @benedictevans  https://t.co/u99q7FWEYQ #AI #ChatGPT",en,"['ai', 'chatgpt']",[],"""What can they make, then? It depends what you can ask, and what you can explain to them and show to them, and how explanation they need."" via @benedictevans  https://t.co/u99q7FWEYQ #AI #ChatGPT","['""', 'What', 'can', 'they', 'make', ',', 'then', '?', 'It', 'depends', 'what', 'you', 'can', 'ask', ',', 'and', 'what', 'you', 'can', 'explain', 'to', 'them', 'and', 'show', 'to', 'them', ',', 'and', 'how', 'explanation', 'they', 'need', '.', '""', 'via', 'https://t.co/u99q7FWEYQ', '#AI', '#ChatGPT']"
20,1603902014165065728,1603902014165065728,2022-12-17 07:56:53 Malay Peninsula Standard Time,2022-12-17,07:56:53,200596079,Cute #ChatGPT  https://t.co/wuQuuptkCG,en,['chatgpt'],[],Cute #ChatGPT  https://t.co/wuQuuptkCG,"['Cute', '#ChatGPT', 'https://t.co/wuQuuptkCG']"
21,1603901892752560128,1603901892752560128,2022-12-17 07:56:24 Malay Peninsula Standard Time,2022-12-17,07:56:24,243789085,"Hey @CosmicSkeptic, @vegan_logic, @PlantBasedNews, @itsdavidramms, @JoeyCarbstrong and @DrNealBarnard have you conversed with @openaicommunity by @OpenAI about veganism?  It could be interesting to watch you interact with it and see what comes out 🌱  #vegan #plantbased #ChatGPT",en,"['vegan', 'plantbased', 'chatgpt']",[],"Hey @CosmicSkeptic, @vegan_logic, @PlantBasedNews, @itsdavidramms, @JoeyCarbstrong and @DrNealBarnard have you conversed with @openaicommunity by @OpenAI about veganism?  It could be interesting to watch you interact with it and see what comes out 🌱  #vegan #plantbased #ChatGPT","['Hey', ',', ',', ',', ',', 'and', 'have', 'you', 'conversed', 'with', 'by', 'about', 'veganism', '?', 'It', 'could', 'be', 'interesting', 'to', 'watch', 'you', 'interact', 'with', 'it', 'and', 'see', 'what', 'comes', 'out', '🌱', '#vegan', '#plantbased', '#ChatGPT']"
22,1603901861077065729,1603900037012021248,2022-12-17 07:56:17 Malay Peninsula Standard Time,2022-12-17,07:56:17,1470448735,"@TesterFromLeic Nah, #ChatGPT has your back. 🤣🤣🤣🤣🤣🤣🤣🤣🤣",en,['chatgpt'],"[{'screen_name': 'TesterFromLeic', 'name': 'Vernon Richards | Quality Coach 🚢', 'id': '62780899'}]","@TesterFromLeic Nah, #ChatGPT has your back. 🤣🤣🤣🤣🤣🤣🤣🤣🤣","['Nah', ',', '#ChatGPT', 'has', 'your', 'back', '.', '🤣', '🤣', '🤣']"
23,1603901699030413312,1603901699030413312,2022-12-17 07:55:38 Malay Peninsula Standard Time,2022-12-17,07:55:38,2540264855,"Why’d the computer get cold?  Because it left its Windows open!  Yeah, I laugh at #ChatGPT jokes…",en,['chatgpt'],[],"Why’d the computer get cold?  Because it left its Windows open!  Yeah, I laugh at #ChatGPT jokes…","['Why', '’', 'd', 'the', 'computer', 'get', 'cold', '?', 'Because', 'it', 'left', 'its', 'Windows', 'open', '!', 'Yeah', ',', 'I', 'laugh', 'at', '#ChatGPT', 'jokes', '…']"
24,1603901637403480064,1603901637403480064,2022-12-17 07:55:24 Malay Peninsula Standard Time,2022-12-17,07:55:24,963910847960510464,"If Purdue Northwest is still not sure how to act properly after such an awful incident, please consult #ChatGPT from OpenAI 👇  https://t.co/TLEaSe5UD1",en,['chatgpt'],[],"If Purdue Northwest is still not sure how to act properly after such an awful incident, please consult #ChatGPT from OpenAI 👇  https://t.co/TLEaSe5UD1","['If', 'Purdue', 'Northwest', 'is', 'still', 'not', 'sure', 'how', 'to', 'act', 'properly', 'after', 'such', 'an', 'awful', 'incident', ',', 'please', 'consult', '#ChatGPT', 'from', 'OpenAI', '👇', 'https://t.co/TLEaSe5UD1']"
25,1603901429004935168,1603901429004935168,2022-12-17 07:54:34 Malay Peninsula Standard Time,2022-12-17,07:54:34,544204931,#ChatGPT しばらく使って特に便利そうなのは *知らない分野の概観をつかむ *考えの壁打ちと整理 *組み合わせの提示 *例の提示　あたりかな...　まだまだ掘りたりない。,ja,['chatgpt'],[],#ChatGPT What seems to be especially useful after using it for a while is * Get an overview of unknown fields * Wall and organize thoughts * Presentation of combinations * Presentation of examples I wonder if ...　I haven't dug yet.,"['#ChatGPT', 'What', 'seems', 'to', 'be', 'especially', 'useful', 'after', 'using', 'it', 'for', 'a', 'while', 'is', '*', 'Get', 'an', 'overview', 'of', 'unknown', 'fields', '*', 'Wall', 'and', 'organize', 'thoughts', '*', 'Presentation', 'of', 'combinations', '*', 'Presentation', 'of', 'examples', 'I', 'wonder', 'if', '...', 'I', ""haven't"", 'dug', 'yet', '.']"
26,1603901310088142854,1603901310088142848,2022-12-17 07:54:06 Malay Peninsula Standard Time,2022-12-17,07:54:06,1022460409,Cómo una #InteligenciaArtificial #IA del tipo #ChatGPT puede ayudar a la #Web30  https://t.co/rN1WJdpRAJ,es,"['inteligenciaartificial', 'ia', 'chatgpt', 'web30']",[],How a #ChatGPT type #InteligenciaArtificial #IA can help #Web30 https://t.co/rN1WJdpRAJ,"['How', 'a', '#ChatGPT', 'type', '#InteligenciaArtificial', '#IA', 'can', 'help', '#Web30', 'https://t.co/rN1WJdpRAJ']"
27,1603901258460528641,1603901258460528640,2022-12-17 07:53:53 Malay Peninsula Standard Time,2022-12-17,07:53:53,35187450,Cómo una #InteligenciaArtificial #IA del tipo #ChatGPT puede ayudar a la #Web30  https://t.co/EdoDZe9Fbs,es,"['inteligenciaartificial', 'ia', 'chatgpt', 'web30']",[],How a #ChatGPT type #InteligenciaArtificial #IA can help #Web30 https://t.co/EdoDZe9Fbs,"['How', 'a', '#ChatGPT', 'type', '#InteligenciaArtificial', '#IA', 'can', 'help', '#Web30', 'https://t.co/EdoDZe9Fbs']"
28,1603901174414860288,1603901174414860288,2022-12-17 07:53:33 Malay Peninsula Standard Time,2022-12-17,07:53:33,896384784,"Passing the Turing Test is boring. This is not ""moving the goal posts.""  Thoughtful critics have been saying all along that ""fooling humans from behind a keyboard"" was a bad test –– because humans are easy to fool.  This is also not a criticism of #ChatGPT, which is very good.",en,['chatgpt'],[],"Passing the Turing Test is boring. This is not ""moving the goal posts.""  Thoughtful critics have been saying all along that ""fooling humans from behind a keyboard"" was a bad test –– because humans are easy to fool.  This is also not a criticism of #ChatGPT, which is very good.","['Passing', 'the', 'Turing', 'Test', 'is', 'boring', '.', 'This', 'is', 'not', '""', 'moving', 'the', 'goal', 'posts', '.', '""', 'Thoughtful', 'critics', 'have', 'been', 'saying', 'all', 'along', 'that', '""', 'fooling', 'humans', 'from', 'behind', 'a', 'keyboard', '""', 'was', 'a', 'bad', 'test', '–', '–', 'because', 'humans', 'are', 'easy', 'to', 'fool', '.', 'This', 'is', 'also', 'not', 'a', 'criticism', 'of', '#ChatGPT', ',', 'which', 'is', 'very', 'good', '.']"
29,1603901160456617984,1603901160456617984,2022-12-17 07:53:30 Malay Peninsula Standard Time,2022-12-17,07:53:30,795922430351044608,Job Applicants have started leveraging #ChatGPT to crack their interview and that would blew Interviewer mind indeed 😅,en,['chatgpt'],[],Job Applicants have started leveraging #ChatGPT to crack their interview and that would blew Interviewer mind indeed 😅,"['Job', 'Applicants', 'have', 'started', 'leveraging', '#ChatGPT', 'to', 'crack', 'their', 'interview', 'and', 'that', 'would', 'blew', 'Interviewer', 'mind', 'indeed', '😅']"
30,1603901090558255112,1603901090558255104,2022-12-17 07:53:13 Malay Peninsula Standard Time,2022-12-17,07:53:13,135278897,"I'm chatting with clients and office peers about the AI research and product company OpenAI. It's inspirational learning how colleagues use ChatGPT, the generative chatbot from OpenAI. I'm excited to test ChatGTI in the research preview. #OpenAI #ChatGPT   https://t.co/7q01ledUWE  https://t.co/lBWvH4SPjj",en,"['openai', 'chatgpt']",[],"I'm chatting with clients and office peers about the AI research and product company OpenAI. It's inspirational learning how colleagues use ChatGPT, the generative chatbot from OpenAI. I'm excited to test ChatGTI in the research preview. #OpenAI #ChatGPT   https://t.co/7q01ledUWE  https://t.co/lBWvH4SPjj","[""I'm"", 'chatting', 'with', 'clients', 'and', 'office', 'peers', 'about', 'the', 'AI', 'research', 'and', 'product', 'company', 'OpenAI', '.', ""It's"", 'inspirational', 'learning', 'how', 'colleagues', 'use', 'ChatGPT', ',', 'the', 'generative', 'chatbot', 'from', 'OpenAI', '.', ""I'm"", 'excited', 'to', 'test', 'ChatGTI', 'in', 'the', 'research', 'preview', '.', '#OpenAI', '#ChatGPT', 'https://t.co/7q01ledUWE', 'https://t.co/lBWvH4SPjj']"
31,1603901033989693441,1603901033989693440,2022-12-17 07:53:00 Malay Peninsula Standard Time,2022-12-17,07:53:00,1374841081293021188,For any fans of the Alien movies and #ChatGPT and #stablediffusion  https://t.co/fFSSTZagzg,en,"['chatgpt', 'stablediffusion']",[],For any fans of the Alien movies and #ChatGPT and #stablediffusion  https://t.co/fFSSTZagzg,"['For', 'any', 'fans', 'of', 'the', 'Alien', 'movies', 'and', '#ChatGPT', 'and', '#stablediffusion', 'https://t.co/fFSSTZagzg']"
32,1603900902997311488,1603900902997311488,2022-12-17 07:52:28 Malay Peninsula Standard Time,2022-12-17,07:52:28,1146781730977779712,I remember when tamagotchis first burst onto the scene in the late 90s. To see how far we have come with cell phones and AI like #ChatGPT is pretty amazing,en,['chatgpt'],[],I remember when tamagotchis first burst onto the scene in the late 90s. To see how far we have come with cell phones and AI like #ChatGPT is pretty amazing,"['I', 'remember', 'when', 'tamagotchis', 'first', 'burst', 'onto', 'the', 'scene', 'in', 'the', 'late', '90s', '.', 'To', 'see', 'how', 'far', 'we', 'have', 'come', 'with', 'cell', 'phones', 'and', 'AI', 'like', '#ChatGPT', 'is', 'pretty', 'amazing']"
33,1603900787784138752,1603900787784138752,2022-12-17 07:52:01 Malay Peninsula Standard Time,2022-12-17,07:52:01,876567755885088770,"""Transhumanist art highlights the potential for technology to transcend and enhance our humanity. It encourages us to question the boundaries of what it means to be human and to imagine a future where we can thrive in harmony with technology."" #transhumanism #art #ChatGPT",en,"['transhumanism', 'art', 'chatgpt']",[],"""Transhumanist art highlights the potential for technology to transcend and enhance our humanity. It encourages us to question the boundaries of what it means to be human and to imagine a future where we can thrive in harmony with technology."" #transhumanism #art #ChatGPT","['""', 'Transhumanist', 'art', 'highlights', 'the', 'potential', 'for', 'technology', 'to', 'transcend', 'and', 'enhance', 'our', 'humanity', '.', 'It', 'encourages', 'us', 'to', 'question', 'the', 'boundaries', 'of', 'what', 'it', 'means', 'to', 'be', 'human', 'and', 'to', 'imagine', 'a', 'future', 'where', 'we', 'can', 'thrive', 'in', 'harmony', 'with', 'technology', '.', '""', '#transhumanism', '#art', '#ChatGPT']"
