id,conversation_id,created_at,date,time,user_id,tweet,language,hashtags,reply_to,translated_text,tokenized_text
1634290681060675584,1634290681060675584,2023-03-11 04:30:36 Malay Peninsula Standard Time,2023-03-11,04:30:36,1159799683293704194,ChatGPT がこれまでに私に提供した最も不快で有害な誤報:  https://t.co/grICaYG3p5  #chatgpt   https://t.co/YbUFypibzL,ja,['chatgpt'],[],The most offensive and harmful misinformation ChatGPT has ever provided me: https://t.co/grICaYG3p5 #chatgpt https://t.co/YbUFypibzL,"['The', 'most', 'offensive', 'and', 'harmful', 'misinformation', 'ChatGPT', 'has', 'ever', 'provided', 'me', ':', 'https://t.co/grICaYG3p5', '#chatgpt', 'https://t.co/YbUFypibzL']"
1634290632511594496,1634290632511594496,2023-03-11 04:30:25 Malay Peninsula Standard Time,2023-03-11,04:30:25,320836948,"Where are we on the exponential AI technology curve? If the beginning was 1954, are we near the upward curve, the middle of the curve, or near the vertical? #AI #ExponentialTech #curious #ChatGPT #midjourney @DrJimFan",en,"['ai', 'exponentialtech', 'curious', 'chatgpt', 'midjourney']",[],"Where are we on the exponential AI technology curve? If the beginning was 1954, are we near the upward curve, the middle of the curve, or near the vertical? #AI #ExponentialTech #curious #ChatGPT #midjourney @DrJimFan","['Where', 'are', 'we', 'on', 'the', 'exponential', 'AI', 'technology', 'curve', '?', 'If', 'the', 'beginning', 'was', '1954', ',', 'are', 'we', 'near', 'the', 'upward', 'curve', ',', 'the', 'middle', 'of', 'the', 'curve', ',', 'or', 'near', 'the', 'vertical', '?', '#AI', '#ExponentialTech', '#curious', '#ChatGPT', '#midjourney']"
1634290605106040833,1634290605106040832,2023-03-11 04:30:18 Malay Peninsula Standard Time,2023-03-11,04:30:18,1159799683293704194,chatgpt ズボンを降ろす  #chatgpt   https://t.co/eNrC8s0ldz,ja,['chatgpt'],[],chatgpt pulls down your pants #chatgpt https://t.co/eNrC8s0ldz,"['chatgpt', 'pulls', 'down', 'your', 'pants', '#chatgpt', 'https://t.co/eNrC8s0ldz']"
1634290569286483968,1634290569286483968,2023-03-11 04:30:10 Malay Peninsula Standard Time,2023-03-11,04:30:10,278666824,"yeah, this we have been training (and rewarding) #chatgpt-like responses from humans in #education for way too long, it is embedded in the learning design, most predictable responses rather than creative thought   #edtechchat #edchat #k12",en,"['chatgpt', 'education', 'edtechchat', 'edchat', 'k12']",[],"yeah, this we have been training (and rewarding) #chatgpt-like responses from humans in #education for way too long, it is embedded in the learning design, most predictable responses rather than creative thought   #edtechchat #edchat #k12","['yeah', ',', 'this', 'we', 'have', 'been', 'training', '(', 'and', 'rewarding', ')', '#chatgpt-like', 'responses', 'from', 'humans', 'in', '#education', 'for', 'way', 'too', 'long', ',', 'it', 'is', 'embedded', 'in', 'the', 'learning', 'design', ',', 'most', 'predictable', 'responses', 'rather', 'than', 'creative', 'thought', '#edtechchat', '#edchat', '#k12']"
1634290558574231552,1634290558574231552,2023-03-11 04:30:07 Malay Peninsula Standard Time,2023-03-11,04:30:07,1311734330302124036,Researchers from the #Wrocław University of Technology “broke” the #ChatGPT @PWr_Wroclaw @kawecki_maciej   Read more ⤵️   https://t.co/i36QdCg1BE przez @PolandDaily24.com,en,"['wrocław', 'chatgpt']",[],Researchers from the #Wrocław University of Technology “broke” the #ChatGPT @PWr_Wroclaw @kawecki_maciej   Read more ⤵️   https://t.co/i36QdCg1BE przez @PolandDaily24.com,"['Researchers', 'from', 'the', '#Wrocław', 'University', 'of', 'Technology', '“', 'broke', '”', 'the', '#ChatGPT', 'Read', 'more', '⤵', '️', 'https://t.co/i36QdCg1BE', 'przez', '.', 'com']"
1634290528769515520,1634290528769515520,2023-03-11 04:30:00 Malay Peninsula Standard Time,2023-03-11,04:30:00,80935591,Por que o ChatGPT tem “alucinações”?  #ChatGPT #IA    https://t.co/yxZvl0fwdl,pt,"['chatgpt', 'ia']",[],"Why does ChatGPT have ""hallucinations""?  #ChatGPT #IA https://t.co/yxZvl0fwdl","['Why', 'does', 'ChatGPT', 'have', '""', 'hallucinations', '""', '?', '#ChatGPT', '#IA', 'https://t.co/yxZvl0fwdl']"
1634290528304111616,1634290528304111616,2023-03-11 04:30:00 Malay Peninsula Standard Time,2023-03-11,04:30:00,6832532,ChatGPT is now available in Azure OpenAI Service by Eric Boyd.  #cloud #azure #ChatGPT #openai #AzureOpenAI #webdev   https://t.co/uWFiImcMRg,en,"['cloud', 'azure', 'chatgpt', 'openai', 'azureopenai', 'webdev']",[],ChatGPT is now available in Azure OpenAI Service by Eric Boyd.  #cloud #azure #ChatGPT #openai #AzureOpenAI #webdev   https://t.co/uWFiImcMRg,"['ChatGPT', 'is', 'now', 'available', 'in', 'Azure', 'OpenAI', 'Service', 'by', 'Eric', 'Boyd', '.', '#cloud', '#azure', '#ChatGPT', '#openai', '#AzureOpenAI', '#webdev', 'https://t.co/uWFiImcMRg']"
1634290518560522245,1634290518560522240,2023-03-11 04:29:57 Malay Peninsula Standard Time,2023-03-11,04:29:57,15076583,"Have you tried #ChatGPT yet?   If so, what did you use it for?   I created a timeline for my #genealogy research &amp; book outline for that research.  #FridayFeeling #AI  https://t.co/Dpq9dxJgHU",en,"['chatgpt', 'genealogy', 'fridayfeeling', 'ai']",[],"Have you tried #ChatGPT yet?   If so, what did you use it for?   I created a timeline for my #genealogy research &amp; book outline for that research.  #FridayFeeling #AI  https://t.co/Dpq9dxJgHU","['Have', 'you', 'tried', '#ChatGPT', 'yet', '?', 'If', 'so', ',', 'what', 'did', 'you', 'use', 'it', 'for', '?', 'I', 'created', 'a', 'timeline', 'for', 'my', '#genealogy', 'research', '&', 'book', 'outline', 'for', 'that', 'research', '.', '#FridayFeeling', '#AI', 'https://t.co/Dpq9dxJgHU']"
1634290314729992192,1634276723880521728,2023-03-11 04:29:09 Malay Peninsula Standard Time,2023-03-11,04:29:09,90258002,"On (NOT) faking classic fiction w/ GPT:  ""The system is driven WELL below the regular distribution you've given by the texts. These [#LLMs] are free energy minimizers. #ChatGPT is UNABLE to create those slots where surprise can happen.""  @LaboratoryMinds:  https://t.co/1Oh5hwDOu5  https://t.co/HHFXI96L6F",en,"['llms', 'chatgpt']",[],"On (NOT) faking classic fiction w/ GPT:  ""The system is driven WELL below the regular distribution you've given by the texts. These [#LLMs] are free energy minimizers. #ChatGPT is UNABLE to create those slots where surprise can happen.""  @LaboratoryMinds:  https://t.co/1Oh5hwDOu5  https://t.co/HHFXI96L6F","['On', '(', 'NOT', ')', 'faking', 'classic', 'fiction', 'w', '/', 'GPT', ':', '""', 'The', 'system', 'is', 'driven', 'WELL', 'below', 'the', 'regular', 'distribution', ""you've"", 'given', 'by', 'the', 'texts', '.', 'These', '[', '#LLMs', ']', 'are', 'free', 'energy', 'minimizers', '.', '#ChatGPT', 'is', 'UNABLE', 'to', 'create', 'those', 'slots', 'where', 'surprise', 'can', 'happen', '.', '""', ':', 'https://t.co/1Oh5hwDOu5', 'https://t.co/HHFXI96L6F']"
1634290298846081025,1634177492704452608,2023-03-11 04:29:05 Malay Peninsula Standard Time,2023-03-11,04:29:05,22393716,"@marconeves Any learning tasks for which having lots of examples or asking very specific questions would help, I feel #ChatGPT is helpful",en,['chatgpt'],"[{'screen_name': 'marconeves', 'name': 'Marco Neves', 'id': '21135992'}]","@marconeves Any learning tasks for which having lots of examples or asking very specific questions would help, I feel #ChatGPT is helpful","['Any', 'learning', 'tasks', 'for', 'which', 'having', 'lots', 'of', 'examples', 'or', 'asking', 'very', 'specific', 'questions', 'would', 'help', ',', 'I', 'feel', '#ChatGPT', 'is', 'helpful']"
1634290287848878080,1634290287848878080,2023-03-11 04:29:02 Malay Peninsula Standard Time,2023-03-11,04:29:02,701671508,"#ChatGPT #SLED 9th Annual Solutions Summit : CHECK OUT Some of Our Featured Vendors, March 30th  https://t.co/5vC5R5SaOG  https://t.co/v3nTlDp33O",en,"['chatgpt', 'sled']",[],"#ChatGPT #SLED 9th Annual Solutions Summit : CHECK OUT Some of Our Featured Vendors, March 30th  https://t.co/5vC5R5SaOG  https://t.co/v3nTlDp33O","['#ChatGPT', '#SLED', '9th', 'Annual', 'Solutions', 'Summit', ':', 'CHECK', 'OUT', 'Some', 'of', 'Our', 'Featured', 'Vendors', ',', 'March', '30th', 'https://t.co/5vC5R5SaOG', 'https://t.co/v3nTlDp33O']"
1634290063394611200,1634290063394611200,2023-03-11 04:28:09 Malay Peninsula Standard Time,2023-03-11,04:28:09,85271847,The Consequences of Relying Too Much on AI  #AI #AI+ML #ChatGPT via  buckleyplanet  https://t.co/r1Xh7pMaAZ,en,"['ai', 'ai', 'chatgpt']",[],The Consequences of Relying Too Much on AI  #AI #AI+ML #ChatGPT via  buckleyplanet  https://t.co/r1Xh7pMaAZ,"['The', 'Consequences', 'of', 'Relying', 'Too', 'Much', 'on', 'AI', '#AI', '#AI', '+', 'ML', '#ChatGPT', 'via', 'buckleyplanet', 'https://t.co/r1Xh7pMaAZ']"
1634290055928860686,1634290055928860672,2023-03-11 04:28:07 Malay Peninsula Standard Time,2023-03-11,04:28:07,153677826,"Upon his head, a hat of bees he wore, A sight that few had seen e'er seen before. And yet, this man did not seem so afraid, For he knew well the debt that bees had paid. #ChatGPT #midjourney #whatatimetobealive #TGIF  https://t.co/QgVB3u4le2",en,"['chatgpt', 'midjourney', 'whatatimetobealive', 'tgif']",[],"Upon his head, a hat of bees he wore, A sight that few had seen e'er seen before. And yet, this man did not seem so afraid, For he knew well the debt that bees had paid. #ChatGPT #midjourney #whatatimetobealive #TGIF  https://t.co/QgVB3u4le2","['Upon', 'his', 'head', ',', 'a', 'hat', 'of', 'bees', 'he', 'wore', ',', 'A', 'sight', 'that', 'few', 'had', 'seen', ""e'er"", 'seen', 'before', '.', 'And', 'yet', ',', 'this', 'man', 'did', 'not', 'seem', 'so', 'afraid', ',', 'For', 'he', 'knew', 'well', 'the', 'debt', 'that', 'bees', 'had', 'paid', '.', '#ChatGPT', '#midjourney', '#whatatimetobealive', '#TGIF', 'https://t.co/QgVB3u4le2']"
1634289977306632197,1634289977306632192,2023-03-11 04:27:48 Malay Peninsula Standard Time,2023-03-11,04:27:48,278666824,"quoting #chatgpt #bing all very interesting but these seem like stopping points in a trajectory of human thinking, it stimulates, but I am far more curious what it thought it stokes in people   #edtechchat #edchat #k12",en,"['chatgpt', 'bing', 'edtechchat', 'edchat', 'k12']",[],"quoting #chatgpt #bing all very interesting but these seem like stopping points in a trajectory of human thinking, it stimulates, but I am far more curious what it thought it stokes in people   #edtechchat #edchat #k12","['quoting', '#chatgpt', '#bing', 'all', 'very', 'interesting', 'but', 'these', 'seem', 'like', 'stopping', 'points', 'in', 'a', 'trajectory', 'of', 'human', 'thinking', ',', 'it', 'stimulates', ',', 'but', 'I', 'am', 'far', 'more', 'curious', 'what', 'it', 'thought', 'it', 'stokes', 'in', 'people', '#edtechchat', '#edchat', '#k12']"
1634289961506689064,1634289961506689024,2023-03-11 04:27:45 Malay Peninsula Standard Time,2023-03-11,04:27:45,1576601411676151812,Welcome to another episode of what crazy stuff can Rob do with #ChatGPT now? 😂  https://t.co/m7jfxHDZmv,en,['chatgpt'],[],Welcome to another episode of what crazy stuff can Rob do with #ChatGPT now? 😂  https://t.co/m7jfxHDZmv,"['Welcome', 'to', 'another', 'episode', 'of', 'what', 'crazy', 'stuff', 'can', 'Rob', 'do', 'with', '#ChatGPT', 'now', '?', '😂', 'https://t.co/m7jfxHDZmv']"
1634289948974108687,1633999864769003520,2023-03-11 04:27:42 Malay Peninsula Standard Time,2023-03-11,04:27:42,42644216,@aaditsh @SaveToNotion #thread #chatgpt,qme,"['thread', 'chatgpt']","[{'screen_name': 'aaditsh', 'name': 'Aadit Sheth', 'id': '1273505391553449985'}]",@aaditsh @SaveToNotion #thread #chatgpt,"['#thread', '#chatgpt']"
1634289946382028828,1634289946382028800,2023-03-11 04:27:41 Malay Peninsula Standard Time,2023-03-11,04:27:41,1529076301126066177,Cheese is the most stolen food in the world.  #ChatGPT,en,['chatgpt'],[],Cheese is the most stolen food in the world.  #ChatGPT,"['Cheese', 'is', 'the', 'most', 'stolen', 'food', 'in', 'the', 'world', '.', '#ChatGPT']"
1634289929122467857,1634289929122467840,2023-03-11 04:27:37 Malay Peninsula Standard Time,2023-03-11,04:27:37,1356557456860712963,"Erstens: #ChatGPT mit Künstlicher Intelligenz zu vergleichen, ist Schwachsinn.   Zweitens: Die aufgebauschte Abneigung gegen ChatGPT erschliesst sich mir nicht.",de,['chatgpt'],[],"First, to compare #ChatGPT with artificial intelligence is.   Secondly, the exaggerated aversion to ChatGPT does not open up to me.","['First', ',', 'to', 'compare', '#ChatGPT', 'with', 'artificial', 'intelligence', 'is', '.', 'Secondly', ',', 'the', 'exaggerated', 'aversion', 'to', 'ChatGPT', 'does', 'not', 'open', 'up', 'to', 'me', '.']"
1634289920989712443,1634289920989712384,2023-03-11 04:27:35 Malay Peninsula Standard Time,2023-03-11,04:27:35,16905666,"my #chatGPT history disappeared on me, hoping it comes back soon",en,['chatgpt'],[],"my #chatGPT history disappeared on me, hoping it comes back soon","['my', '#chatGPT', 'history', 'disappeared', 'on', 'me', ',', 'hoping', 'it', 'comes', 'back', 'soon']"
1634289905927966748,1634289905927966720,2023-03-11 04:27:31 Malay Peninsula Standard Time,2023-03-11,04:27:31,224984062,"Salesforce and OpenAI Bring ChatGPT to Slack, Resurrect Einstein With Generative AI -  https://t.co/p8WWMTL1UI #ChatGPT #Salesforce   https://t.co/IGJIMtqjB8",en,"['chatgpt', 'salesforce']",[],"Salesforce and OpenAI Bring ChatGPT to Slack, Resurrect Einstein With Generative AI -  https://t.co/p8WWMTL1UI #ChatGPT #Salesforce   https://t.co/IGJIMtqjB8","['Salesforce', 'and', 'OpenAI', 'Bring', 'ChatGPT', 'to', 'Slack', ',', 'Resurrect', 'Einstein', 'With', 'Generative', 'AI', '-', 'https://t.co/p8WWMTL1UI', '#ChatGPT', '#Salesforce', 'https://t.co/IGJIMtqjB8']"
1634289894402019389,1634289894402019328,2023-03-11 04:27:29 Malay Peninsula Standard Time,2023-03-11,04:27:29,1513761019973222401,#VoiceAi Domain for sale  #voice #ai #artificalintelligence #aivoice #soundai #soubd #music #ailabs #aistudios #pro #brand #program #Professional #company #web3 #ChatGPT  https://t.co/2vPLFQkQsH,en,"['voiceai', 'voice', 'ai', 'artificalintelligence', 'aivoice', 'soundai', 'soubd', 'music', 'ailabs', 'aistudios', 'pro', 'brand', 'program', 'professional', 'company', 'web3', 'chatgpt']",[],#VoiceAi Domain for sale  #voice #ai #artificalintelligence #aivoice #soundai #soubd #music #ailabs #aistudios #pro #brand #program #Professional #company #web3 #ChatGPT  https://t.co/2vPLFQkQsH,"['#VoiceAi', 'Domain', 'for', 'sale', '#voice', '#ai', '#artificalintelligence', '#aivoice', '#soundai', '#soubd', '#music', '#ailabs', '#aistudios', '#pro', '#brand', '#program', '#Professional', '#company', '#web3', '#ChatGPT', 'https://t.co/2vPLFQkQsH']"
1634289874663624708,1634289874663624704,2023-03-11 04:27:24 Malay Peninsula Standard Time,2023-03-11,04:27:24,2202065401,"🚀👩‍💻No sólo #chatgpt es una tendencia en la aulas, hay más tecnologías que están evolucionando la educación y con las cuales podemos beneficiarnos. ¡Conoce algunas de las que ya están volándonos la cabeza! #tecnologiaeducativa  https://t.co/PsLrm98yqO",es,"['chatgpt', 'tecnologiaeducativa']",[],"🚀👩 💻Not only is #chatgpt a trend in the classroom, there are more technologies that are evolving education and with which we can benefit. Meet some of the ones that are already blowing our minds! #tecnologiaeducativa https://t.co/PsLrm98yqO","['🚀', '👩', '💻', 'Not', 'only', 'is', '#chatgpt', 'a', 'trend', 'in', 'the', 'classroom', ',', 'there', 'are', 'more', 'technologies', 'that', 'are', 'evolving', 'education', 'and', 'with', 'which', 'we', 'can', 'benefit', '.', 'Meet', 'some', 'of', 'the', 'ones', 'that', 'are', 'already', 'blowing', 'our', 'minds', '!', '#tecnologiaeducativa', 'https://t.co/PsLrm98yqO']"
1634289813888159753,1634162829447122944,2023-03-11 04:27:09 Malay Peninsula Standard Time,2023-03-11,04:27:09,314544386,@DirkGerard uw enthoesiasme is aanstekelijk maar welk (merk)teken c.q. woord(keuze) gaat ons toelaten uw schrijfwerk te onderkennen van door #ChatGPT geproduceerde ... 🤔,nl,['chatgpt'],"[{'screen_name': 'DirkGerard', 'name': 'Dirk Gerard', 'id': '390354250'}]","@DirkGerard your enthoesiasm is contagious, but which (mark) sign or word (choice) will allow us to recognize your writing of #ChatGPT produced by ... 🤔","['your', 'enthoesiasm', 'is', 'contagious', ',', 'but', 'which', '(', 'mark', ')', 'sign', 'or', 'word', '(', 'choice', ')', 'will', 'allow', 'us', 'to', 'recognize', 'your', 'writing', 'of', '#ChatGPT', 'produced', 'by', '...', '🤔']"
