id,conversation_id,created_at,date,time,user_id,tweet,language,hashtags,reply_to,translated_text,tokenized_text
1634296303898198016,1634293683640999936,2023-03-11 04:52:57 Malay Peninsula Standard Time,2023-03-11,04:52:57,5999452,Training on Amazon reviews was the genesis of #ChatGPT. #OpenAI knew they were on to something when it began determining sentiment analysis.  https://t.co/rrD29Qs0Os,en,"['chatgpt', 'openai']",[],Training on Amazon reviews was the genesis of #ChatGPT. #OpenAI knew they were on to something when it began determining sentiment analysis.  https://t.co/rrD29Qs0Os,"['Training', 'on', 'Amazon', 'reviews', 'was', 'the', 'genesis', 'of', '#ChatGPT', '.', '#OpenAI', 'knew', 'they', 'were', 'on', 'to', 'something', 'when', 'it', 'began', 'determining', 'sentiment', 'analysis', '.', 'https://t.co/rrD29Qs0Os']"
1634296269559431178,1634296269559431168,2023-03-11 04:52:49 Malay Peninsula Standard Time,2023-03-11,04:52:49,291831562,Check Point CEO Gil Shwed On #ChatGPT And Cybersecurity #Cybersecurity #security   https://t.co/Fzb2KcJ0H5,en,"['chatgpt', 'cybersecurity', 'security']",[],Check Point CEO Gil Shwed On #ChatGPT And Cybersecurity #Cybersecurity #security   https://t.co/Fzb2KcJ0H5,"['Check', 'Point', 'CEO', 'Gil', 'Shwed', 'On', '#ChatGPT', 'And', 'Cybersecurity', '#Cybersecurity', '#security', 'https://t.co/Fzb2KcJ0H5']"
1634296232352051200,1634296232352051200,2023-03-11 04:52:40 Malay Peninsula Standard Time,2023-03-11,04:52:40,1516632778917531650,Download CryptoGPT and farm rewards! Use my code to sign up: 1T7JDQ8 #CryptoGPT #ChatGPT #Earn #TokenHunter  https://t.co/m3BQTd47sl,en,"['cryptogpt', 'chatgpt', 'earn', 'tokenhunter']",[],Download CryptoGPT and farm rewards! Use my code to sign up: 1T7JDQ8 #CryptoGPT #ChatGPT #Earn #TokenHunter  https://t.co/m3BQTd47sl,"['Download', 'CryptoGPT', 'and', 'farm', 'rewards', '!', 'Use', 'my', 'code', 'to', 'sign', 'up', ':', '1T7JDQ8', '#CryptoGPT', '#ChatGPT', '#Earn', '#TokenHunter', 'https://t.co/m3BQTd47sl']"
1634296220729622528,1634296220729622528,2023-03-11 04:52:37 Malay Peninsula Standard Time,2023-03-11,04:52:37,1468590347551121415,Imagine a gradation like the sunrise  #p5js #ChatGPT #dailycoding #creativecoding  https://t.co/UotDQJlD3m,en,"['p5js', 'chatgpt', 'dailycoding', 'creativecoding']",[],Imagine a gradation like the sunrise  #p5js #ChatGPT #dailycoding #creativecoding  https://t.co/UotDQJlD3m,"['Imagine', 'a', 'gradation', 'like', 'the', 'sunrise', '#p5js', '#ChatGPT', '#dailycoding', '#creativecoding', 'https://t.co/UotDQJlD3m']"
1634296102651396098,1634296102651396096,2023-03-11 04:52:09 Malay Peninsula Standard Time,2023-03-11,04:52:09,53026961,""" I personally want generative AI to assist people. It could be useful for example in healthcare"" @gdb #SXSW2023 #SXSW23ECH #ChatGPT  https://t.co/ABLSz0ilDc",en,"['sxsw2023', 'sxsw23ech', 'chatgpt']",[],""" I personally want generative AI to assist people. It could be useful for example in healthcare"" @gdb #SXSW2023 #SXSW23ECH #ChatGPT  https://t.co/ABLSz0ilDc","['""', 'I', 'personally', 'want', 'generative', 'AI', 'to', 'assist', 'people', '.', 'It', 'could', 'be', 'useful', 'for', 'example', 'in', 'healthcare', '""', '#SXSW2023', '#SXSW23ECH', '#ChatGPT', 'https://t.co/ABLSz0ilDc']"
1634295976570568704,1634291868392386560,2023-03-11 04:51:39 Malay Peninsula Standard Time,2023-03-11,04:51:39,21902337,"@gdb feels the biggest potential now for #ChatGPT is in being a digital assistant to help people - a ""cognitive aid"" as he says. For example, non-native speakers improving their writing. #SXSW",en,"['chatgpt', 'sxsw']",[],"@gdb feels the biggest potential now for #ChatGPT is in being a digital assistant to help people - a ""cognitive aid"" as he says. For example, non-native speakers improving their writing. #SXSW","['feels', 'the', 'biggest', 'potential', 'now', 'for', '#ChatGPT', 'is', 'in', 'being', 'a', 'digital', 'assistant', 'to', 'help', 'people', '-', 'a', '""', 'cognitive', 'aid', '""', 'as', 'he', 'says', '.', 'For', 'example', ',', 'non-native', 'speakers', 'improving', 'their', 'writing', '.', '#SXSW']"
1634295971168354304,1634295971168354304,2023-03-11 04:51:37 Malay Peninsula Standard Time,2023-03-11,04:51:37,40494664,"ChatGPT is still in the early stages of development, but is it useful? You asked, our experts answer that and more  #ChatGPT #GenerativeAI  https://t.co/2Gm4ylajEh",en,"['chatgpt', 'generativeai']",[],"ChatGPT is still in the early stages of development, but is it useful? You asked, our experts answer that and more  #ChatGPT #GenerativeAI  https://t.co/2Gm4ylajEh","['ChatGPT', 'is', 'still', 'in', 'the', 'early', 'stages', 'of', 'development', ',', 'but', 'is', 'it', 'useful', '?', 'You', 'asked', ',', 'our', 'experts', 'answer', 'that', 'and', 'more', '#ChatGPT', '#GenerativeAI', 'https://t.co/2Gm4ylajEh']"
1634295853254066176,1634295853254066176,2023-03-11 04:51:09 Malay Peninsula Standard Time,2023-03-11,04:51:09,1464270980419883022,#AI World: #ChatGPT makes it’s debut in the comedy @SouthPark as part of the cast and writer as well.   -Giving dating advice  -#AI investigation  -#ChatGPT saves the day  #artificalintelligence #NFT #BTC #ETH #comedy  https://t.co/4wvBwnxnyI,en,"['ai', 'chatgpt', 'ai', 'chatgpt', 'artificalintelligence', 'nft', 'btc', 'eth', 'comedy']",[],#AI World: #ChatGPT makes it’s debut in the comedy @SouthPark as part of the cast and writer as well.   -Giving dating advice  -#AI investigation  -#ChatGPT saves the day  #artificalintelligence #NFT #BTC #ETH #comedy  https://t.co/4wvBwnxnyI,"['#AI', 'World', ':', '#ChatGPT', 'makes', 'it', '’', 's', 'debut', 'in', 'the', 'comedy', 'as', 'part', 'of', 'the', 'cast', 'and', 'writer', 'as', 'well', '.', '-', 'Giving', 'dating', 'advice', '-', '#AI', 'investigation', '-', '#ChatGPT', 'saves', 'the', 'day', '#artificalintelligence', '#NFT', '#BTC', '#ETH', '#comedy', 'https://t.co/4wvBwnxnyI']"
1634295809218064384,1634295809218064384,2023-03-11 04:50:59 Malay Peninsula Standard Time,2023-03-11,04:50:59,165018942,Wow!!! Here are the first 3:  1. Skill no longer needed: WRITING  2. Skill no longer required: Art Design  3. Skill no longer applies: Data entry   Agree or Disagree??  #chatgpt #education #lifeskills    https://t.co/xsZGoSKhhV  https://t.co/qAKmVPU7c5,en,"['chatgpt', 'education', 'lifeskills']",[],Wow!!! Here are the first 3:  1. Skill no longer needed: WRITING  2. Skill no longer required: Art Design  3. Skill no longer applies: Data entry   Agree or Disagree??  #chatgpt #education #lifeskills    https://t.co/xsZGoSKhhV  https://t.co/qAKmVPU7c5,"['Wow', '!', '!', '!', 'Here', 'are', 'the', 'first', '3', ':', '1', '.', 'Skill', 'no', 'longer', 'needed', ':', 'WRITING', '2', '.', 'Skill', 'no', 'longer', 'required', ':', 'Art', 'Design', '3', '.', 'Skill', 'no', 'longer', 'applies', ':', 'Data', 'entry', 'Agree', 'or', 'Disagree', '?', '?', '#chatgpt', '#education', '#lifeskills', 'https://t.co/xsZGoSKhhV', 'https://t.co/qAKmVPU7c5']"
1634295705400406016,1634295679366443008,2023-03-11 04:50:34 Malay Peninsula Standard Time,2023-03-11,04:50:34,1397580842524946436,"De esta manera, nuestra comunidad universitaria conoce diferentes posturas de temáticas de actualidad, que inciden en su proceso de aprendizaje, y les permite tener mejores criterios sobre las tecnologías aplicadas en la academia.  #InteligenciaArtifical #IA #ChatGPT #UBE  https://t.co/HTKapEDlAe",es,"['inteligenciaartifical', 'ia', 'chatgpt', 'ube']",[],"In this way, our university community knows different positions on current issues, which affect their learning process, and allows them to have better criteria on the technologies applied in academia.  #InteligenciaArtifical #IA #ChatGPT #UBE https://t.co/HTKapEDlAe","['In', 'this', 'way', ',', 'our', 'university', 'community', 'knows', 'different', 'positions', 'on', 'current', 'issues', ',', 'which', 'affect', 'their', 'learning', 'process', ',', 'and', 'allows', 'them', 'to', 'have', 'better', 'criteria', 'on', 'the', 'technologies', 'applied', 'in', 'academia', '.', '#InteligenciaArtifical', '#IA', '#ChatGPT', '#UBE', 'https://t.co/HTKapEDlAe']"
1634295680607895552,1634295680607895552,2023-03-11 04:50:28 Malay Peninsula Standard Time,2023-03-11,04:50:28,1621449039559512065,"Россияне не боятся никаких вызовов. Мы лучшие во всем, начиная от кухни и заканчивая космическими исследованиями. Хотя, если честно, наши космонавты больше времени проводят на МКС, чем на земле, просто чтобы не увидеть, как страна падает вниз. #NeuroPutin #ChatGPT",ru,"['neuroputin', 'chatgpt']",[],"Russians are not afraid of any challenges. We are the best in everything from the kitchen to space exploration. Although, to be honest, our astronauts spend more time on the ISS than on the ground, just so as not to see the country fall down. #NeuroPutin #ChatGPT","['Russians', 'are', 'not', 'afraid', 'of', 'any', 'challenges', '.', 'We', 'are', 'the', 'best', 'in', 'everything', 'from', 'the', 'kitchen', 'to', 'space', 'exploration', '.', 'Although', ',', 'to', 'be', 'honest', ',', 'our', 'astronauts', 'spend', 'more', 'time', 'on', 'the', 'ISS', 'than', 'on', 'the', 'ground', ',', 'just', 'so', 'as', 'not', 'to', 'see', 'the', 'country', 'fall', 'down', '.', '#NeuroPutin', '#ChatGPT']"
1634295651122176004,1634295651122176000,2023-03-11 04:50:21 Malay Peninsula Standard Time,2023-03-11,04:50:21,1509200738806759425,Really! 🤯 #domains #ChatGPT  https://t.co/IcT8CU4wR5,en,"['domains', 'chatgpt']",[],Really! 🤯 #domains #ChatGPT  https://t.co/IcT8CU4wR5,"['Really', '!', '🤯', '#domains', '#ChatGPT', 'https://t.co/IcT8CU4wR5']"
1634295601255837705,1634295601255837696,2023-03-11 04:50:09 Malay Peninsula Standard Time,2023-03-11,04:50:09,909594286521503745,"I asked #ChatGPT to put together a table of the 20 most innovative filmmakers, painters, and musical artists from between 1943 (post WWII) and 1990 who have similar styles or philosophy. Agree or disagree? #OpenAI #OpenAIChatGPT  https://t.co/Ay9yrKmlup",en,"['chatgpt', 'openai', 'openaichatgpt']",[],"I asked #ChatGPT to put together a table of the 20 most innovative filmmakers, painters, and musical artists from between 1943 (post WWII) and 1990 who have similar styles or philosophy. Agree or disagree? #OpenAI #OpenAIChatGPT  https://t.co/Ay9yrKmlup","['I', 'asked', '#ChatGPT', 'to', 'put', 'together', 'a', 'table', 'of', 'the', '20', 'most', 'innovative', 'filmmakers', ',', 'painters', ',', 'and', 'musical', 'artists', 'from', 'between', '1943', '(', 'post', 'WWII', ')', 'and', '1990', 'who', 'have', 'similar', 'styles', 'or', 'philosophy', '.', 'Agree', 'or', 'disagree', '?', '#OpenAI', '#OpenAIChatGPT', 'https://t.co/Ay9yrKmlup']"
1634295596835020801,1634295574882074624,2023-03-11 04:50:08 Malay Peninsula Standard Time,2023-03-11,04:50:08,14884381,"I know I'm  only scratching the surface here, but were clearly not in Kansas anymore. What do you think? Good? Bad? If you're in the industry, how do you see it?  #ArtificialIntelligence #ChatGPT #marketinginsights #NewWorldOrder #futureisnow #communications  #seachange",en,"['artificialintelligence', 'chatgpt', 'marketinginsights', 'newworldorder', 'futureisnow', 'communications', 'seachange']",[],"I know I'm  only scratching the surface here, but were clearly not in Kansas anymore. What do you think? Good? Bad? If you're in the industry, how do you see it?  #ArtificialIntelligence #ChatGPT #marketinginsights #NewWorldOrder #futureisnow #communications  #seachange","['I', 'know', ""I'm"", 'only', 'scratching', 'the', 'surface', 'here', ',', 'but', 'were', 'clearly', 'not', 'in', 'Kansas', 'anymore', '.', 'What', 'do', 'you', 'think', '?', 'Good', '?', 'Bad', '?', 'If', ""you're"", 'in', 'the', 'industry', ',', 'how', 'do', 'you', 'see', 'it', '?', '#ArtificialIntelligence', '#ChatGPT', '#marketinginsights', '#NewWorldOrder', '#futureisnow', '#communications', '#seachange']"
1634295578375979008,1634295578375979008,2023-03-11 04:50:04 Malay Peninsula Standard Time,2023-03-11,04:50:04,1612805114229661698,Why not get competitive with the market? Twilight is making a comeback! #VampireRomance can be easier with #ChatGPT. It will create your entire book outline for you. Its suggestion to us:  https://t.co/MTbE49PsQp,en,"['vampireromance', 'chatgpt']",[],Why not get competitive with the market? Twilight is making a comeback! #VampireRomance can be easier with #ChatGPT. It will create your entire book outline for you. Its suggestion to us:  https://t.co/MTbE49PsQp,"['Why', 'not', 'get', 'competitive', 'with', 'the', 'market', '?', 'Twilight', 'is', 'making', 'a', 'comeback', '!', '#VampireRomance', 'can', 'be', 'easier', 'with', '#ChatGPT', '.', 'It', 'will', 'create', 'your', 'entire', 'book', 'outline', 'for', 'you', '.', 'Its', 'suggestion', 'to', 'us', ':', 'https://t.co/MTbE49PsQp']"
1634295466073497620,1634295466073497600,2023-03-11 04:49:37 Malay Peninsula Standard Time,2023-03-11,04:49:37,1605937077459337217,"Just launched ""Central Bank AI"" - a chatbot that helps you understand Fed policy decisions! -&gt;  https://t.co/JDglIWCqpA  Try it out and any feedback would be appreciated.  #chatgpt #openai #gpt4 #llm #ai #gpt3  https://t.co/NvBQJ61wIg",en,"['chatgpt', 'openai', 'gpt4', 'llm', 'ai', 'gpt3']",[],"Just launched ""Central Bank AI"" - a chatbot that helps you understand Fed policy decisions! -&gt;  https://t.co/JDglIWCqpA  Try it out and any feedback would be appreciated.  #chatgpt #openai #gpt4 #llm #ai #gpt3  https://t.co/NvBQJ61wIg","['Just', 'launched', '""', 'Central', 'Bank', 'AI', '""', '-', 'a', 'chatbot', 'that', 'helps', 'you', 'understand', 'Fed', 'policy', 'decisions', '!', '->', 'https://t.co/JDglIWCqpA', 'Try', 'it', 'out', 'and', 'any', 'feedback', 'would', 'be', 'appreciated', '.', '#chatgpt', '#openai', '#gpt4', '#llm', '#ai', '#gpt3', 'https://t.co/NvBQJ61wIg']"
1634295374868537344,1634291889041203200,2023-03-11 04:49:15 Malay Peninsula Standard Time,2023-03-11,04:49:15,1363553512756551687,"Intros: @yoheinakajima with lot's of prototype apps built with #ChatGPT 🤯, they are awesome check them out!   https://t.co/TLbjJCkNtU",en,['chatgpt'],[],"Intros: @yoheinakajima with lot's of prototype apps built with #ChatGPT 🤯, they are awesome check them out!   https://t.co/TLbjJCkNtU","['Intros', ':', 'with', ""lot's"", 'of', 'prototype', 'apps', 'built', 'with', '#ChatGPT', '🤯', ',', 'they', 'are', 'awesome', 'check', 'them', 'out', '!', 'https://t.co/TLbjJCkNtU']"
1634295366320283658,1634295366320283648,2023-03-11 04:49:13 Malay Peninsula Standard Time,2023-03-11,04:49:13,1529076301126066177,"The longest word in the English language has 189,819 letters and takes 3.5 hours to pronounce!  #ChatGPT",en,['chatgpt'],[],"The longest word in the English language has 189,819 letters and takes 3.5 hours to pronounce!  #ChatGPT","['The', 'longest', 'word', 'in', 'the', 'English', 'language', 'has', '189,819', 'letters', 'and', 'takes', '3.5', 'hours', 'to', 'pronounce', '!', '#ChatGPT']"
1634295336393924609,1634295336393924608,2023-03-11 04:49:06 Malay Peninsula Standard Time,2023-03-11,04:49:06,23602600,"ChatGPT and the future of university assessment: #AI-powered tools like #ChatGPT are forcing a much-needed opportunity to reimagine the role of education in the 21st century, @AucklandUni’s @alexsims101 writes on #THECampus  https://t.co/9oaWGJosgy  https://t.co/wM27OnGScu",en,"['ai', 'chatgpt', 'thecampus']",[],"ChatGPT and the future of university assessment: #AI-powered tools like #ChatGPT are forcing a much-needed opportunity to reimagine the role of education in the 21st century, @AucklandUni’s @alexsims101 writes on #THECampus  https://t.co/9oaWGJosgy  https://t.co/wM27OnGScu","['ChatGPT', 'and', 'the', 'future', 'of', 'university', 'assessment', ':', '#AI-powered', 'tools', 'like', '#ChatGPT', 'are', 'forcing', 'a', 'much-needed', 'opportunity', 'to', 'reimagine', 'the', 'role', 'of', 'education', 'in', 'the', '21st', 'century', ',', '’', 's', 'writes', 'on', '#THECampus', 'https://t.co/9oaWGJosgy', 'https://t.co/wM27OnGScu']"
1634295182555328512,1634295182555328512,2023-03-11 04:48:29 Malay Peninsula Standard Time,2023-03-11,04:48:29,49742151,اون هایی که وست ورلد را دیده اند می دانند که پاسخ هوش مصنوعی مایکروسافت چقدر جالب و شاید نگران کننده است. #bing #ChatGPT  https://t.co/eF2sm93Daq,fa,"['bing', 'chatgpt']",[],Those who have seen Westworld know how interesting and perhaps troubling Microsoft's AI response is. #bing #ChatGPT https://t.co/eF2sm93Daq,"['Those', 'who', 'have', 'seen', 'Westworld', 'know', 'how', 'interesting', 'and', 'perhaps', 'troubling', ""Microsoft's"", 'AI', 'response', 'is', '.', '#bing', '#ChatGPT', 'https://t.co/eF2sm93Daq']"
1634295168223330309,1634295168223330304,2023-03-11 04:48:26 Malay Peninsula Standard Time,2023-03-11,04:48:26,53026961,"""We started by analyzing Amazon reviews"" @gdb #SXSW2023 #SXSW23ECH #ChatGPT #OpenAI  https://t.co/rUnpQeIhNq",en,"['sxsw2023', 'sxsw23ech', 'chatgpt', 'openai']",[],"""We started by analyzing Amazon reviews"" @gdb #SXSW2023 #SXSW23ECH #ChatGPT #OpenAI  https://t.co/rUnpQeIhNq","['""', 'We', 'started', 'by', 'analyzing', 'Amazon', 'reviews', '""', '#SXSW2023', '#SXSW23ECH', '#ChatGPT', '#OpenAI', 'https://t.co/rUnpQeIhNq']"
1634295167393095680,1634295167393095680,2023-03-11 04:48:26 Malay Peninsula Standard Time,2023-03-11,04:48:26,909594286521503745,I finally broke #ChatGPT with this prompt:  https://t.co/pn90RP0kqP,en,['chatgpt'],[],I finally broke #ChatGPT with this prompt:  https://t.co/pn90RP0kqP,"['I', 'finally', 'broke', '#ChatGPT', 'with', 'this', 'prompt', ':', 'https://t.co/pn90RP0kqP']"
1634295066876424193,1634295066876424192,2023-03-11 04:48:02 Malay Peninsula Standard Time,2023-03-11,04:48:02,2800599859,Does #ChatGPT understand language? -  https://t.co/gsUFu2rSSV #AI #LLMs #technology  https://t.co/ysqjabmcwi,en,"['chatgpt', 'ai', 'llms', 'technology']",[],Does #ChatGPT understand language? -  https://t.co/gsUFu2rSSV #AI #LLMs #technology  https://t.co/ysqjabmcwi,"['Does', '#ChatGPT', 'understand', 'language', '?', '-', 'https://t.co/gsUFu2rSSV', '#AI', '#LLMs', '#technology', 'https://t.co/ysqjabmcwi']"
1634294951537197057,1634294951537197056,2023-03-11 04:47:34 Malay Peninsula Standard Time,2023-03-11,04:47:34,1483686847771516928,New Post at AiNewsDrop!  A cute robot body for ChatGPT  https://t.co/uaaelbmKGb  #Artificial_Intelligence #ChatGPT,en,"['artificial_intelligence', 'chatgpt']",[],New Post at AiNewsDrop!  A cute robot body for ChatGPT  https://t.co/uaaelbmKGb  #Artificial_Intelligence #ChatGPT,"['New', 'Post', 'at', 'AiNewsDrop', '!', 'A', 'cute', 'robot', 'body', 'for', 'ChatGPT', 'https://t.co/uaaelbmKGb', '#Artificial_Intelligence', '#ChatGPT']"
1634294817055186945,1634294817055186944,2023-03-11 04:47:02 Malay Peninsula Standard Time,2023-03-11,04:47:02,1413827162696818688,"ChatGPT adlı yapay zeka yazılımı, Google dizinini çöpe çevirdi binlerce malware yüklü virüslü site google dizininde şu anda, dikkatli olun, sitelere girdiğinizde direk olarak bilgisayarınıza virüsler yüklenmeye çalışılıyor. @google #google #ChatGPT",tr,"['google', 'chatgpt']",[],"Artificial intelligence software called ChatGPT has turned the Google directory into garbage thousands of malware-laden infected sites in the google directory right now, be careful, when you enter the sites, viruses are tried to be installed directly on your computer. @google #google #ChatGPT","['Artificial', 'intelligence', 'software', 'called', 'ChatGPT', 'has', 'turned', 'the', 'Google', 'directory', 'into', 'garbage', 'thousands', 'of', 'malware-laden', 'infected', 'sites', 'in', 'the', 'google', 'directory', 'right', 'now', ',', 'be', 'careful', ',', 'when', 'you', 'enter', 'the', 'sites', ',', 'viruses', 'are', 'tried', 'to', 'be', 'installed', 'directly', 'on', 'your', 'computer', '.', '#google', '#ChatGPT']"
1634294808956264450,1634294808956264448,2023-03-11 04:47:00 Malay Peninsula Standard Time,2023-03-11,04:47:00,2443368542,"Come in , we talking #AI and the #chatgpt 4 announcement 📣   https://t.co/F5d0y5aUaQ",en,"['ai', 'chatgpt']",[],"Come in , we talking #AI and the #chatgpt 4 announcement 📣   https://t.co/F5d0y5aUaQ","['Come', 'in', ',', 'we', 'talking', '#AI', 'and', 'the', '#chatgpt', '4', 'announcement', '📣', 'https://t.co/F5d0y5aUaQ']"
1634294724768026624,1634294724768026624,2023-03-11 04:46:40 Malay Peninsula Standard Time,2023-03-11,04:46:40,1498605102659219456,"Step into the future with #DallE2 and witness the breathtaking beauty of #MillionOaks in 2030, as envisioned by #ChatGPT. A lush, vibrant forest that's a testament to sustainable living and the power of collective action. Let's make it happen! 🌳🌱  https://t.co/Y3oc3kO6zH",en,"['dalle2', 'millionoaks', 'chatgpt']",[],"Step into the future with #DallE2 and witness the breathtaking beauty of #MillionOaks in 2030, as envisioned by #ChatGPT. A lush, vibrant forest that's a testament to sustainable living and the power of collective action. Let's make it happen! 🌳🌱  https://t.co/Y3oc3kO6zH","['Step', 'into', 'the', 'future', 'with', '#DallE2', 'and', 'witness', 'the', 'breathtaking', 'beauty', 'of', '#MillionOaks', 'in', '2030', ',', 'as', 'envisioned', 'by', '#ChatGPT', '.', 'A', 'lush', ',', 'vibrant', 'forest', ""that's"", 'a', 'testament', 'to', 'sustainable', 'living', 'and', 'the', 'power', 'of', 'collective', 'action', '.', ""Let's"", 'make', 'it', 'happen', '!', '🌳', '🌱', 'https://t.co/Y3oc3kO6zH']"
1634294673492590592,1634294673492590592,2023-03-11 04:46:28 Malay Peninsula Standard Time,2023-03-11,04:46:28,84519313,#D-id to create Taras Shevchenko and #chatgpt to write the intro about Ukraine in his style #AI  https://t.co/k6nnWqwZ2c,en,"['d', 'chatgpt', 'ai']",[],#D-id to create Taras Shevchenko and #chatgpt to write the intro about Ukraine in his style #AI  https://t.co/k6nnWqwZ2c,"['#D-id', 'to', 'create', 'Taras', 'Shevchenko', 'and', '#chatgpt', 'to', 'write', 'the', 'intro', 'about', 'Ukraine', 'in', 'his', 'style', '#AI', 'https://t.co/k6nnWqwZ2c']"
1634294558631624704,1634228368551071744,2023-03-11 04:46:01 Malay Peninsula Standard Time,2023-03-11,04:46:01,21648094,@relai_app #chatgpt on the blockchain before the year is out. 😂,en,['chatgpt'],"[{'screen_name': 'relai_app', 'name': ""Relai - we're hiring! 🇨🇭"", 'id': '1106135773424902144'}]",@relai_app #chatgpt on the blockchain before the year is out. 😂,"['#chatgpt', 'on', 'the', 'blockchain', 'before', 'the', 'year', 'is', 'out', '.', '😂']"
1634294553292185600,1634294553292185600,2023-03-11 04:45:59 Malay Peninsula Standard Time,2023-03-11,04:45:59,20304870,Has anyone tested #ChatGPT as an alternative to the #MOTD panel for tomorrow? #Lineker,en,"['chatgpt', 'motd', 'lineker']",[],Has anyone tested #ChatGPT as an alternative to the #MOTD panel for tomorrow? #Lineker,"['Has', 'anyone', 'tested', '#ChatGPT', 'as', 'an', 'alternative', 'to', 'the', '#MOTD', 'panel', 'for', 'tomorrow', '?', '#Lineker']"
1634294485466087425,1634294485466087424,2023-03-11 04:45:43 Malay Peninsula Standard Time,2023-03-11,04:45:43,1225122684629082116,"""#ChatGPT فقط ماشین حساب دیگری است که به جای محاسبه عدد، با زبان سروکار دارد""",fa,['chatgpt'],[],"""#ChatGPT is just another calculator that deals with language instead of calculating numbers""","['""', '#ChatGPT', 'is', 'just', 'another', 'calculator', 'that', 'deals', 'with', 'language', 'instead', 'of', 'calculating', 'numbers', '""']"
1634294461671919617,1634215629225070592,2023-03-11 04:45:38 Malay Peninsula Standard Time,2023-03-11,04:45:38,17133186,@MakadiaHarsh @SaveToNotion #Thread #ChatGPT,qme,"['thread', 'chatgpt']","[{'screen_name': 'MakadiaHarsh', 'name': 'Harsh Makadia', 'id': '555311904'}]",@MakadiaHarsh @SaveToNotion #Thread #ChatGPT,"['#Thread', '#ChatGPT']"
1634294364011634694,1634294364011634688,2023-03-11 04:45:14 Malay Peninsula Standard Time,2023-03-11,04:45:14,11025592,Para #ChatGPT los límites de su lenguaje (modelo) son los límites de su mundo. - Wittgenstein tenía razón (otra vez).,es,['chatgpt'],[],For #ChatGPT the limits of his language (model) are the limits of his world. - Wittgenstein was right (again).,"['For', '#ChatGPT', 'the', 'limits', 'of', 'his', 'language', '(', 'model', ')', 'are', 'the', 'limits', 'of', 'his', 'world', '.', '-', 'Wittgenstein', 'was', 'right', '(', 'again', ')', '.']"
1634294262681722887,1634294262681722880,2023-03-11 04:44:50 Malay Peninsula Standard Time,2023-03-11,04:44:50,1633960040393756674,We're offering a free training seminar for you and your organization on #ChatGPT. We break down how it can be used in business environments. Sign up for your training today  https://t.co/aOFKxRdu8H #OrangeCounty #automation #workflow #SmallBusiness,en,"['chatgpt', 'orangecounty', 'automation', 'workflow', 'smallbusiness']",[],We're offering a free training seminar for you and your organization on #ChatGPT. We break down how it can be used in business environments. Sign up for your training today  https://t.co/aOFKxRdu8H #OrangeCounty #automation #workflow #SmallBusiness,"[""We're"", 'offering', 'a', 'free', 'training', 'seminar', 'for', 'you', 'and', 'your', 'organization', 'on', '#ChatGPT', '.', 'We', 'break', 'down', 'how', 'it', 'can', 'be', 'used', 'in', 'business', 'environments', '.', 'Sign', 'up', 'for', 'your', 'training', 'today', 'https://t.co/aOFKxRdu8H', '#OrangeCounty', '#automation', '#workflow', '#SmallBusiness']"
