id,conversation_id,created_at,date,time,user_id,tweet,language,hashtags,reply_to,translated_text,tokenized_text
1634292368596774912,1634292368596774912,2023-03-11 04:37:19 Malay Peninsula Standard Time,2023-03-11,04:37:19,1230114383122108420,"GPT-4 is expected to be released in the first quarter of 2023.   It was hinted that GPT-4 might have multimodal capabilities,   text, photographs, videos, sounds   #ecommerce #DigitalTransformation #digitalera #chatgpt #NewUpdate #Upcoming #RoboticProcessAutomation  https://t.co/mHdXPHPHab",en,"['ecommerce', 'digitaltransformation', 'digitalera', 'chatgpt', 'newupdate', 'upcoming', 'roboticprocessautomation']",[],"GPT-4 is expected to be released in the first quarter of 2023.   It was hinted that GPT-4 might have multimodal capabilities,   text, photographs, videos, sounds   #ecommerce #DigitalTransformation #digitalera #chatgpt #NewUpdate #Upcoming #RoboticProcessAutomation  https://t.co/mHdXPHPHab","['GPT', '-', '4', 'is', 'expected', 'to', 'be', 'released', 'in', 'the', 'first', 'quarter', 'of', '2023', '.', 'It', 'was', 'hinted', 'that', 'GPT', '-', '4', 'might', 'have', 'multimodal', 'capabilities', ',', 'text', ',', 'photographs', ',', 'videos', ',', 'sounds', '#ecommerce', '#DigitalTransformation', '#digitalera', '#chatgpt', '#NewUpdate', '#Upcoming', '#RoboticProcessAutomation', 'https://t.co/mHdXPHPHab']"
1634292305757630465,1634292305757630464,2023-03-11 04:37:04 Malay Peninsula Standard Time,2023-03-11,04:37:04,1113367472751689728, https://t.co/SVVLyegt7A #chatgpt4 #trending #chatgpt,qme,"['chatgpt4', 'trending', 'chatgpt']",[],https://t.co/SVVLyegt7A #chatgpt4 #trending #chatgpt,"['https://t.co/SVVLyegt7A', '#chatgpt4', '#trending', '#chatgpt']"
1634292303610228738,1634292303610228736,2023-03-11 04:37:03 Malay Peninsula Standard Time,2023-03-11,04:37:03,992343398525874181,"Was haben @KrasseZwiebel, @Giraffe_Herr und @RudolfSharting gemeinsam? Keine Ahnung, aber ich stelle mir gerade eine Giraffe vor, die in einer Pisswanne steht und eine Zwiebel knabbert.   – lustiger Tweet von #ChatGPT",de,['chatgpt'],[],"What do @KrasseZwiebel, @Giraffe_Herr and @RudolfSharting have in common? I don't know, but I'm just imagining a giraffe standing in a pee tub nibbling an onion.   – funny tweet from #ChatGPT","['What', 'do', ',', 'and', 'have', 'in', 'common', '?', 'I', ""don't"", 'know', ',', 'but', ""I'm"", 'just', 'imagining', 'a', 'giraffe', 'standing', 'in', 'a', 'pee', 'tub', 'nibbling', 'an', 'onion', '.', '–', 'funny', 'tweet', 'from', '#ChatGPT']"
1634292277534158848,1634292277534158848,2023-03-11 04:36:57 Malay Peninsula Standard Time,2023-03-11,04:36:57,1444250056429768705,ChatGPT now available in Microsoft's Azure OpenAI service for preview.  #Microsoft #OpenAI #ChatGPT #AI #ArtificialIntelligence #Azure  https://t.co/jPmalduszk,en,"['microsoft', 'openai', 'chatgpt', 'ai', 'artificialintelligence', 'azure']",[],ChatGPT now available in Microsoft's Azure OpenAI service for preview.  #Microsoft #OpenAI #ChatGPT #AI #ArtificialIntelligence #Azure  https://t.co/jPmalduszk,"['ChatGPT', 'now', 'available', 'in', ""Microsoft's"", 'Azure', 'OpenAI', 'service', 'for', 'preview', '.', '#Microsoft', '#OpenAI', '#ChatGPT', '#AI', '#ArtificialIntelligence', '#Azure', 'https://t.co/jPmalduszk']"
1634292212589633541,1634292212589633536,2023-03-11 04:36:41 Malay Peninsula Standard Time,2023-03-11,04:36:41,245475764,"🍜 #MarketSoup #ChatGPT  #Ai  #OpenAI  #DALLE  $ILMN $TMO $RHHBY $ABT $BDX $BIO The MaSo Mid-PM Six Company Analysis is LIVE! Focus: Diagnostic &amp; Research Ind. FB, IG &amp; LI:  https://t.co/jUh1yVJuOe The market makes demands on the apathetic &amp; it is hard to see oneself in it. – MaSo",en,"['marketsoup', 'chatgpt', 'ai', 'openai', 'dalle']",[],"🍜 #MarketSoup #ChatGPT  #Ai  #OpenAI  #DALLE  $ILMN $TMO $RHHBY $ABT $BDX $BIO The MaSo Mid-PM Six Company Analysis is LIVE! Focus: Diagnostic &amp; Research Ind. FB, IG &amp; LI:  https://t.co/jUh1yVJuOe The market makes demands on the apathetic &amp; it is hard to see oneself in it. – MaSo","['🍜', '#MarketSoup', '#ChatGPT', '#Ai', '#OpenAI', '#DALLE', '$', 'ILMN', '$', 'TMO', '$', 'RHHBY', '$', 'ABT', '$', 'BDX', '$', 'BIO', 'The', 'MaSo', 'Mid-PM', 'Six', 'Company', 'Analysis', 'is', 'LIVE', '!', 'Focus', ':', 'Diagnostic', '&', 'Research', 'Ind', '.', 'FB', ',', 'IG', '&', 'LI', ':', 'https://t.co/jUh1yVJuOe', 'The', 'market', 'makes', 'demands', 'on', 'the', 'apathetic', '&', 'it', 'is', 'hard', 'to', 'see', 'oneself', 'in', 'it', '.', '–', 'MaSo']"
1634292040857993216,1634292040857993216,2023-03-11 04:36:00 Malay Peninsula Standard Time,2023-03-11,04:36:00,17473062,"The rise of #ChatGPT has generated excitement about the potential for #AI to lighten workloads, as well as unease about the possible displacement of knowledge workers. But what exactly is this game-changing technology, and what can we expect it to do?  https://t.co/HtjwoePicW",en,"['chatgpt', 'ai']",[],"The rise of #ChatGPT has generated excitement about the potential for #AI to lighten workloads, as well as unease about the possible displacement of knowledge workers. But what exactly is this game-changing technology, and what can we expect it to do?  https://t.co/HtjwoePicW","['The', 'rise', 'of', '#ChatGPT', 'has', 'generated', 'excitement', 'about', 'the', 'potential', 'for', '#AI', 'to', 'lighten', 'workloads', ',', 'as', 'well', 'as', 'unease', 'about', 'the', 'possible', 'displacement', 'of', 'knowledge', 'workers', '.', 'But', 'what', 'exactly', 'is', 'this', 'game-changing', 'technology', ',', 'and', 'what', 'can', 'we', 'expect', 'it', 'to', 'do', '?', 'https://t.co/HtjwoePicW']"
1634292017642590209,1634292017642590208,2023-03-11 04:35:55 Malay Peninsula Standard Time,2023-03-11,04:35:55,1410546163846049793,「AIわん AIに手を出さないからよ。効率よりも根本わん。#ChatGPT」,ja,['chatgpt'],[],"""AI wan, because I don't touch AI, it's more fundamental than efficiency. #ChatGPT」","['""', 'AI', 'wan', ',', 'because', 'I', ""don't"", 'touch', 'AI', ',', ""it's"", 'more', 'fundamental', 'than', 'efficiency', '.', '#ChatGPT', '」']"
1634291975791714306,1634291975791714304,2023-03-11 04:35:45 Malay Peninsula Standard Time,2023-03-11,04:35:45,26291578,"Hi Twitter, it has been quiet on this channel. Best pic for a Twitter comeback: OpenAI-Founder talking about #ChatGPT at #sxsw.  https://t.co/RRSOrghniM",en,"['chatgpt', 'sxsw']",[],"Hi Twitter, it has been quiet on this channel. Best pic for a Twitter comeback: OpenAI-Founder talking about #ChatGPT at #sxsw.  https://t.co/RRSOrghniM","['Hi', 'Twitter', ',', 'it', 'has', 'been', 'quiet', 'on', 'this', 'channel', '.', 'Best', 'pic', 'for', 'a', 'Twitter', 'comeback', ':', 'OpenAI-Founder', 'talking', 'about', '#ChatGPT', 'at', '#sxsw', '.', 'https://t.co/RRSOrghniM']"
1634291958859419649,1634291958859419648,2023-03-11 04:35:41 Malay Peninsula Standard Time,2023-03-11,04:35:41,1444250056429768705,Apple Watch Users Can Now Access the Renowned AI Chatbot ChatGPT.  #Apple #AppleWatch #AI #artificalintelligence #chatbot #OpenAI #OpenAIChatGPT #ChatGPT  https://t.co/QirUMweeSZ,en,"['apple', 'applewatch', 'ai', 'artificalintelligence', 'chatbot', 'openai', 'openaichatgpt', 'chatgpt']",[],Apple Watch Users Can Now Access the Renowned AI Chatbot ChatGPT.  #Apple #AppleWatch #AI #artificalintelligence #chatbot #OpenAI #OpenAIChatGPT #ChatGPT  https://t.co/QirUMweeSZ,"['Apple', 'Watch', 'Users', 'Can', 'Now', 'Access', 'the', 'Renowned', 'AI', 'Chatbot', 'ChatGPT', '.', '#Apple', '#AppleWatch', '#AI', '#artificalintelligence', '#chatbot', '#OpenAI', '#OpenAIChatGPT', '#ChatGPT', 'https://t.co/QirUMweeSZ']"
1634291889858854916,1634251980657811456,2023-03-11 04:35:24 Malay Peninsula Standard Time,2023-03-11,04:35:24,739853,OpenAI President Greg Brockman speaking about the accessibility and simplicity behind #ChatGPT that drove it’s adoption and momentum.   “Raise your hand if you’ve used ChatGPT” and vast majority of the room raises hands.   #SXSW #SXSW2023  https://t.co/0S44texOYW,en,"['chatgpt', 'sxsw', 'sxsw2023']",[],OpenAI President Greg Brockman speaking about the accessibility and simplicity behind #ChatGPT that drove it’s adoption and momentum.   “Raise your hand if you’ve used ChatGPT” and vast majority of the room raises hands.   #SXSW #SXSW2023  https://t.co/0S44texOYW,"['OpenAI', 'President', 'Greg', 'Brockman', 'speaking', 'about', 'the', 'accessibility', 'and', 'simplicity', 'behind', '#ChatGPT', 'that', 'drove', 'it', '’', 's', 'adoption', 'and', 'momentum', '.', '“', 'Raise', 'your', 'hand', 'if', 'you', '’', 've', 'used', 'ChatGPT', '”', 'and', 'vast', 'majority', 'of', 'the', 'room', 'raises', 'hands', '.', '#SXSW', '#SXSW2023', 'https://t.co/0S44texOYW']"
1634291889041203203,1634291889041203200,2023-03-11 04:35:24 Malay Peninsula Standard Time,2023-03-11,04:35:24,1363553512756551687,"Here is our recording on #ChatGPT, discussed leading tools, trends and projects, enjoy!  https://t.co/moJ2f9X6E3",en,['chatgpt'],[],"Here is our recording on #ChatGPT, discussed leading tools, trends and projects, enjoy!  https://t.co/moJ2f9X6E3","['Here', 'is', 'our', 'recording', 'on', '#ChatGPT', ',', 'discussed', 'leading', 'tools', ',', 'trends', 'and', 'projects', ',', 'enjoy', '!', 'https://t.co/moJ2f9X6E3']"
1634291862528835585,1634291862528835584,2023-03-11 04:35:18 Malay Peninsula Standard Time,2023-03-11,04:35:18,175178569,"Quién es #SamAltman, el hombre detrás de #OpenAI y herramientas como #ChatGPT o #DALLE2  https://t.co/NwZWUkos3Y",es,"['samaltman', 'openai', 'chatgpt', 'dalle2']",[],"Who is #SamAltman, the man behind #OpenAI and tools like #ChatGPT or #DALLE2 https://t.co/NwZWUkos3Y","['Who', 'is', '#SamAltman', ',', 'the', 'man', 'behind', '#OpenAI', 'and', 'tools', 'like', '#ChatGPT', 'or', '#DALLE2', 'https://t.co/NwZWUkos3Y']"
1634291838155644930,1634291838155644928,2023-03-11 04:35:12 Malay Peninsula Standard Time,2023-03-11,04:35:12,295796258,¿Puede una Inteligencia Artificial dar mi clase?  Una conversación con #ChatGPT sobre IA y enseñanza de lenguas  https://t.co/ccnjA4cZhV a través de @ftsaez,es,['chatgpt'],[],Can an Artificial Intelligence teach my class?  A conversation with #ChatGPT about AI and language teaching https://t.co/ccnjA4cZhV through @ftsaez,"['Can', 'an', 'Artificial', 'Intelligence', 'teach', 'my', 'class', '?', 'A', 'conversation', 'with', '#ChatGPT', 'about', 'AI', 'and', 'language', 'teaching', 'https://t.co/ccnjA4cZhV', 'through']"
1634291821940539395,1634291821940539392,2023-03-11 04:35:08 Malay Peninsula Standard Time,2023-03-11,04:35:08,1307483418079485952,Hoy se me ha ocurrido encontrar a un buen compañero de juegos para Jugar a #words el juego que juagaba @Berto_Romero en el programa y la verdad me parece impresionante lo que es capaz de pensar el chat. #ChatGPT  https://t.co/dbXNNDTiJR,es,"['words', 'chatgpt']",[],Today it occurred to me to find a good playmate to play #words the game I played @Berto_Romero in the program and the truth seems impressive to me what the chat is capable of thinking. #ChatGPT https://t.co/dbXNNDTiJR,"['Today', 'it', 'occurred', 'to', 'me', 'to', 'find', 'a', 'good', 'playmate', 'to', 'play', '#words', 'the', 'game', 'I', 'played', 'in', 'the', 'program', 'and', 'the', 'truth', 'seems', 'impressive', 'to', 'me', 'what', 'the', 'chat', 'is', 'capable', 'of', 'thinking', '.', '#ChatGPT', 'https://t.co/dbXNNDTiJR']"
1634291756576522241,1634291756576522240,2023-03-11 04:34:53 Malay Peninsula Standard Time,2023-03-11,04:34:53,1529076301126066177,"Tautologies are phrases that repeat themselves, like ""it is what it is.""  #ChatGPT",en,['chatgpt'],[],"Tautologies are phrases that repeat themselves, like ""it is what it is.""  #ChatGPT","['Tautologies', 'are', 'phrases', 'that', 'repeat', 'themselves', ',', 'like', '""', 'it', 'is', 'what', 'it', 'is', '.', '""', '#ChatGPT']"
1634291726926991362,1634291726926991360,2023-03-11 04:34:46 Malay Peninsula Standard Time,2023-03-11,04:34:46,594555797,Feeling stuck with your writing?  Give ChatGPT prompts a try! Our AI-generated prompts will help jumpstart your writing process and get you back to creating! #ChatGPT #writingprompts #writersblock,en,"['chatgpt', 'writingprompts', 'writersblock']",[],Feeling stuck with your writing?  Give ChatGPT prompts a try! Our AI-generated prompts will help jumpstart your writing process and get you back to creating! #ChatGPT #writingprompts #writersblock,"['Feeling', 'stuck', 'with', 'your', 'writing', '?', 'Give', 'ChatGPT', 'prompts', 'a', 'try', '!', 'Our', 'AI-generated', 'prompts', 'will', 'help', 'jumpstart', 'your', 'writing', 'process', 'and', 'get', 'you', 'back', 'to', 'creating', '!', '#ChatGPT', '#writingprompts', '#writersblock']"
1634291694056120321,1634291694056120320,2023-03-11 04:34:38 Malay Peninsula Standard Time,2023-03-11,04:34:38,45418537,"Greg Brockman, fondateur de #ChatGPT dans une salle comble à #SXSW #SXSW2023 @JIN_live  https://t.co/cE4fvlqgqy",fr,"['chatgpt', 'sxsw', 'sxsw2023']",[],"Greg Brockman, founder of #ChatGPT in a packed house at #SXSW #SXSW2023 @JIN_live https://t.co/cE4fvlqgqy","['Greg', 'Brockman', ',', 'founder', 'of', '#ChatGPT', 'in', 'a', 'packed', 'house', 'at', '#SXSW', '#SXSW2023', 'https://t.co/cE4fvlqgqy']"
1634291631502262272,1634289796561489920,2023-03-11 04:34:23 Malay Peninsula Standard Time,2023-03-11,04:34:23,494078632,"@woofmetoken #WOOFME  AI WEB3 BOT would be massive, the bot is already capable of communicating flawlessly and even better than #ChatGPT  IMO, this is huge for @woofmetoken #ShibariumBETA   #cryptocrash $WOOFME $ETH $BTC #USDC",en,"['woofme', 'chatgpt', 'shibariumbeta', 'cryptocrash', 'usdc']","[{'screen_name': 'woofmetoken', 'name': 'WOOFMEISTER $WOOFME', 'id': '1508090835975479304'}]","@woofmetoken #WOOFME  AI WEB3 BOT would be massive, the bot is already capable of communicating flawlessly and even better than #ChatGPT  IMO, this is huge for @woofmetoken #ShibariumBETA   #cryptocrash $WOOFME $ETH $BTC #USDC","['#WOOFME', 'AI', 'WEB', '3', 'BOT', 'would', 'be', 'massive', ',', 'the', 'bot', 'is', 'already', 'capable', 'of', 'communicating', 'flawlessly', 'and', 'even', 'better', 'than', '#ChatGPT', 'IMO', ',', 'this', 'is', 'huge', 'for', '#ShibariumBETA', '#cryptocrash', '$', 'WOOFME', '$', 'ETH', '$', 'BTC', '#USDC']"
1634291445854265344,1634291445854265344,2023-03-11 04:33:39 Malay Peninsula Standard Time,2023-03-11,04:33:39,410232198,Breaking news #chatGPT says there is no best shark  https://t.co/xFYzxxq9Ht,en,['chatgpt'],[],Breaking news #chatGPT says there is no best shark  https://t.co/xFYzxxq9Ht,"['Breaking', 'news', '#chatGPT', 'says', 'there', 'is', 'no', 'best', 'shark', 'https://t.co/xFYzxxq9Ht']"
1634291412610043905,1634291412610043904,2023-03-11 04:33:31 Malay Peninsula Standard Time,2023-03-11,04:33:31,79233690,"Discord, ChatGPT ile başlayarak her sunucuya yapay zeka getiriyor via  https://t.co/bed65LgOVV  #discord #ai #chatgpt #gündem #haber #TeknolojiHaberleri",tr,"['discord', 'ai', 'chatgpt', 'gündem', 'haber', 'teknolojihaberleri']",[],"Discord brings artificial intelligence to every server, starting with ChatGPT via https://t.co/bed65LgOVV #discord #ai #chatgpt #gündem #haber #TeknolojiHaberleri","['Discord', 'brings', 'artificial', 'intelligence', 'to', 'every', 'server', ',', 'starting', 'with', 'ChatGPT', 'via', 'https://t.co/bed65LgOVV', '#discord', '#ai', '#chatgpt', '#gündem', '#haber', '#TeknolojiHaberleri']"
1634291302425858048,1634291302425858048,2023-03-11 04:33:04 Malay Peninsula Standard Time,2023-03-11,04:33:04,632355616,#OpenAI's may have just accelerated the adoption of #ChatGPT!  @Aragonresearch1 reviews the latest development with OpenAI giving #API access to their Whisper speech-to-text algorithm.  Learn more about this latest development:  https://t.co/OLGBOr97ff,en,"['openai', 'chatgpt', 'api']",[],#OpenAI's may have just accelerated the adoption of #ChatGPT!  @Aragonresearch1 reviews the latest development with OpenAI giving #API access to their Whisper speech-to-text algorithm.  Learn more about this latest development:  https://t.co/OLGBOr97ff,"[""#OpenAI's"", 'may', 'have', 'just', 'accelerated', 'the', 'adoption', 'of', '#ChatGPT', '!', 'reviews', 'the', 'latest', 'development', 'with', 'OpenAI', 'giving', '#API', 'access', 'to', 'their', 'Whisper', 'speech-to-text', 'algorithm', '.', 'Learn', 'more', 'about', 'this', 'latest', 'development', ':', 'https://t.co/OLGBOr97ff']"
1634291262646890504,1634291262646890496,2023-03-11 04:32:55 Malay Peninsula Standard Time,2023-03-11,04:32:55,459236018,Checking out the keynote with #OpenAI president @gdb &amp; @LaurieSegall @ #SXSW #ChatGPT 🤖  https://t.co/iXs4qEXEpe,en,"['openai', 'sxsw', 'chatgpt']",[],Checking out the keynote with #OpenAI president @gdb &amp; @LaurieSegall @ #SXSW #ChatGPT 🤖  https://t.co/iXs4qEXEpe,"['Checking', 'out', 'the', 'keynote', 'with', '#OpenAI', 'president', '&', '@', '#SXSW', '#ChatGPT', '🤖', 'https://t.co/iXs4qEXEpe']"
1634291230296137730,1634291230296137728,2023-03-11 04:32:47 Malay Peninsula Standard Time,2023-03-11,04:32:47,1444250056429768705,DuckDuckGo Uses AI Tech To Give You ChatGPT-Like Search Results.  #duckduckgo #SearchEngine #AI #ArtificialIntelligence #tech #ChatGPT #chatbot #OpenAI #OpenAIChatGPT  https://t.co/7MslGhCa0A,en,"['duckduckgo', 'searchengine', 'ai', 'artificialintelligence', 'tech', 'chatgpt', 'chatbot', 'openai', 'openaichatgpt']",[],DuckDuckGo Uses AI Tech To Give You ChatGPT-Like Search Results.  #duckduckgo #SearchEngine #AI #ArtificialIntelligence #tech #ChatGPT #chatbot #OpenAI #OpenAIChatGPT  https://t.co/7MslGhCa0A,"['DuckDuckGo', 'Uses', 'AI', 'Tech', 'To', 'Give', 'You', 'ChatGPT-Like', 'Search', 'Results', '.', '#duckduckgo', '#SearchEngine', '#AI', '#ArtificialIntelligence', '#tech', '#ChatGPT', '#chatbot', '#OpenAI', '#OpenAIChatGPT', 'https://t.co/7MslGhCa0A']"
1634291150969352194,1634291141783834624,2023-03-11 04:32:28 Malay Peninsula Standard Time,2023-03-11,04:32:28,1263506738021531648,"Finally, to complete the analysis - we ask good ol' #ChatGPT what is $AMAM? - here is the answer (maybe I should incorporate this into @ConvexValue ?)  https://t.co/2vdsTNmQke",en,['chatgpt'],[],"Finally, to complete the analysis - we ask good ol' #ChatGPT what is $AMAM? - here is the answer (maybe I should incorporate this into @ConvexValue ?)  https://t.co/2vdsTNmQke","['Finally', ',', 'to', 'complete', 'the', 'analysis', '-', 'we', 'ask', 'good', 'ol', ""'"", '#ChatGPT', 'what', 'is', '$', 'AMAM', '?', '-', 'here', 'is', 'the', 'answer', '(', 'maybe', 'I', 'should', 'incorporate', 'this', 'into', '?', ')', 'https://t.co/2vdsTNmQke']"
1634291116991283200,1634291116991283200,2023-03-11 04:32:20 Malay Peninsula Standard Time,2023-03-11,04:32:20,1586165115833012224,"""#ChatGPT devient un allié"" : ces #enseignants apprivoisent l'#intelligenceartificielle pour améliorer leurs #cours et aider leurs #élèves   https://t.co/wmOoExdAFe",fr,"['chatgpt', 'enseignants', 'intelligenceartificielle', 'cours', 'élèves']",[],"""#ChatGPT becomes an ally"": these #enseignants tame the #intelligenceartificielle to improve their #cours and help their #élèves https://t.co/wmOoExdAFe","['""', '#ChatGPT', 'becomes', 'an', 'ally', '""', ':', 'these', '#enseignants', 'tame', 'the', '#intelligenceartificielle', 'to', 'improve', 'their', '#cours', 'and', 'help', 'their', '#élèves', 'https://t.co/wmOoExdAFe']"
1634291075605987329,1634291075605987328,2023-03-11 04:32:10 Malay Peninsula Standard Time,2023-03-11,04:32:10,36747038,Over 50 attendees registered in the first 24 hours! #PR #ChatGPT #AI,en,"['pr', 'chatgpt', 'ai']",[],Over 50 attendees registered in the first 24 hours! #PR #ChatGPT #AI,"['Over', '50', 'attendees', 'registered', 'in', 'the', 'first', '24', 'hours', '!', '#PR', '#ChatGPT', '#AI']"
1634291058921144327,1634291058921144320,2023-03-11 04:32:06 Malay Peninsula Standard Time,2023-03-11,04:32:06,1613076862955028481,There are rumors that GPT-4 will be presented next week. 🤯🤖  #gpt4 #ChatGPT #GPT3 #AI #ArtificialIntelligence #NLP #NaturalLanguageProcessing #LanguageModel #Automation #ContentCreation #Ethics #Responsibility #Workflow #Productivity #Technology #ai  https://t.co/FI9fowrgtD,en,"['gpt4', 'chatgpt', 'gpt3', 'ai', 'artificialintelligence', 'nlp', 'naturallanguageprocessing', 'languagemodel', 'automation', 'contentcreation', 'ethics', 'responsibility', 'workflow', 'productivity', 'technology', 'ai']",[],There are rumors that GPT-4 will be presented next week. 🤯🤖  #gpt4 #ChatGPT #GPT3 #AI #ArtificialIntelligence #NLP #NaturalLanguageProcessing #LanguageModel #Automation #ContentCreation #Ethics #Responsibility #Workflow #Productivity #Technology #ai  https://t.co/FI9fowrgtD,"['There', 'are', 'rumors', 'that', 'GPT', '-', '4', 'will', 'be', 'presented', 'next', 'week', '.', '🤯', '🤖', '#gpt4', '#ChatGPT', '#GPT3', '#AI', '#ArtificialIntelligence', '#NLP', '#NaturalLanguageProcessing', '#LanguageModel', '#Automation', '#ContentCreation', '#Ethics', '#Responsibility', '#Workflow', '#Productivity', '#Technology', '#ai', 'https://t.co/FI9fowrgtD']"
1634291038876491776,1634291038876491776,2023-03-11 04:32:01 Malay Peninsula Standard Time,2023-03-11,04:32:01,258988172,📢 Microsoft recently announced it integrated #ChatGPT into its low-code Power Platform #developer suite. What does this mean for the industry?  https://t.co/1nmrg26A2G   #Microsoft #generativeAI #OpenAI,en,"['chatgpt', 'developer', 'microsoft', 'generativeai', 'openai']",[],📢 Microsoft recently announced it integrated #ChatGPT into its low-code Power Platform #developer suite. What does this mean for the industry?  https://t.co/1nmrg26A2G   #Microsoft #generativeAI #OpenAI,"['📢', 'Microsoft', 'recently', 'announced', 'it', 'integrated', '#ChatGPT', 'into', 'its', 'low-code', 'Power', 'Platform', '#developer', 'suite', '.', 'What', 'does', 'this', 'mean', 'for', 'the', 'industry', '?', 'https://t.co/1nmrg26A2G', '#Microsoft', '#generativeAI', '#OpenAI']"
1634290984346370049,1634290984346370048,2023-03-11 04:31:48 Malay Peninsula Standard Time,2023-03-11,04:31:48,234445164,Wondering how #ChatGPT will impact your role as a marketer? We explore exactly that in this piece for @ANAmarketers  https://t.co/zCtz6KniTu,en,['chatgpt'],[],Wondering how #ChatGPT will impact your role as a marketer? We explore exactly that in this piece for @ANAmarketers  https://t.co/zCtz6KniTu,"['Wondering', 'how', '#ChatGPT', 'will', 'impact', 'your', 'role', 'as', 'a', 'marketer', '?', 'We', 'explore', 'exactly', 'that', 'in', 'this', 'piece', 'for', 'https://t.co/zCtz6KniTu']"
1634290878222065666,1634290878222065664,2023-03-11 04:31:23 Malay Peninsula Standard Time,2023-03-11,04:31:23,1632685061983068162,🔥Create such beautiful realistic people with my #Midjourney Prompt!  🏆Take the chance! 👉 https://t.co/1DuejepO7u…  #AI #AIart #AIArtCommuity #Midjourney #ChatGPT  #AIArtwork #BeautyTeenGirl #Midjourneyart #NFT #NFTarts #GIRLFRIEND #girlskissing #beauty #girl #beautiful  https://t.co/Ra1FPTyeK1,en,"['midjourney', 'ai', 'aiart', 'aiartcommuity', 'midjourney', 'chatgpt', 'aiartwork', 'beautyteengirl', 'midjourneyart', 'nft', 'nftarts', 'girlfriend', 'girlskissing', 'beauty', 'girl', 'beautiful']",[],🔥Create such beautiful realistic people with my #Midjourney Prompt!  🏆Take the chance! 👉 https://t.co/1DuejepO7u…  #AI #AIart #AIArtCommuity #Midjourney #ChatGPT  #AIArtwork #BeautyTeenGirl #Midjourneyart #NFT #NFTarts #GIRLFRIEND #girlskissing #beauty #girl #beautiful  https://t.co/Ra1FPTyeK1,"['🔥', 'Create', 'such', 'beautiful', 'realistic', 'people', 'with', 'my', '#Midjourney', 'Prompt', '!', '🏆', 'Take', 'the', 'chance', '!', '👉', 'https://t.co/1DuejepO7u…', '#AI', '#AIart', '#AIArtCommuity', '#Midjourney', '#ChatGPT', '#AIArtwork', '#BeautyTeenGirl', '#Midjourneyart', '#NFT', '#NFTarts', '#GIRLFRIEND', '#girlskissing', '#beauty', '#girl', '#beautiful', 'https://t.co/Ra1FPTyeK1']"
1634290805425725440,1634290805425725440,2023-03-11 04:31:06 Malay Peninsula Standard Time,2023-03-11,04:31:06,1624934049897672704,"#OpenAI, the company responsible for GPT-3 language model and #ChatGPT conversational agent, is gearing up for the release of #GPT4. Anticipation for this new artificial intelligence tool is already high.  https://t.co/cvaCicPSdK",en,"['openai', 'chatgpt', 'gpt4']",[],"#OpenAI, the company responsible for GPT-3 language model and #ChatGPT conversational agent, is gearing up for the release of #GPT4. Anticipation for this new artificial intelligence tool is already high.  https://t.co/cvaCicPSdK","['#OpenAI', ',', 'the', 'company', 'responsible', 'for', 'GPT', '-', '3', 'language', 'model', 'and', '#ChatGPT', 'conversational', 'agent', ',', 'is', 'gearing', 'up', 'for', 'the', 'release', 'of', '#GPT4', '.', 'Anticipation', 'for', 'this', 'new', 'artificial', 'intelligence', 'tool', 'is', 'already', 'high', '.', 'https://t.co/cvaCicPSdK']"
1634290742842769408,1634290742842769408,2023-03-11 04:30:51 Malay Peninsula Standard Time,2023-03-11,04:30:51,1159799683293704194,（Market Rebellionから）GMは車にChatGPTを搭載することを考えていることが報道されています。  https://t.co/QGkfgaosg6  #chatgpt   https://t.co/hcynaJsrCC,ja,['chatgpt'],[],It has been reported (from Market Rebellion) that GM is considering installing ChatGPT in its car.  https://t.co/QGkfgaosg6 #chatgpt https://t.co/hcynaJsrCC,"['It', 'has', 'been', 'reported', '(', 'from', 'Market', 'Rebellion', ')', 'that', 'GM', 'is', 'considering', 'installing', 'ChatGPT', 'in', 'its', 'car', '.', 'https://t.co/QGkfgaosg6', '#chatgpt', 'https://t.co/hcynaJsrCC']"
