id,conversation_id,created_at,date,time,user_id,tweet,language,hashtags,reply_to,translated_text,tokenized_text
1634294213331304451,1634248722375749632,2023-03-11 04:44:38 Malay Peninsula Standard Time,2023-03-11,04:44:38,188701412,"Organisatie @openai achter #ChatGPT begon als non-profit. 'AI moest in het voordeel zijn van iedereen.' Maar het was moeilijk om zo geld op te halen op om te schalen, vertelt @gdb. Ze wilden 100 miljoen dollar ophalen, maar dat lukte niet als non-profit. #SXSW",nl,"['chatgpt', 'sxsw']",[],"Organization @openai behind #ChatGPT started as a non-profit. ""AI had to be for everyone's benefit."" But it was difficult to raise money like that to scale, @gdb says. They wanted to raise $100 million, but they couldn't do that as a nonprofit. #SXSW","['Organization', 'behind', '#ChatGPT', 'started', 'as', 'a', 'non-profit', '.', '""', 'AI', 'had', 'to', 'be', 'for', ""everyone's"", 'benefit', '.', '""', 'But', 'it', 'was', 'difficult', 'to', 'raise', 'money', 'like', 'that', 'to', 'scale', ',', 'says', '.', 'They', 'wanted', 'to', 'raise', '$', '100', 'million', ',', 'but', 'they', ""couldn't"", 'do', 'that', 'as', 'a', 'nonprofit', '.', '#SXSW']"
1634294161548488705,1634294161548488704,2023-03-11 04:44:26 Malay Peninsula Standard Time,2023-03-11,04:44:26,94669972,"I Don't need #ChatGPT, my wife knows everything.  https://t.co/7uC9I241A2",en,['chatgpt'],[],"I Don't need #ChatGPT, my wife knows everything.  https://t.co/7uC9I241A2","['I', ""Don't"", 'need', '#ChatGPT', ',', 'my', 'wife', 'knows', 'everything', '.', 'https://t.co/7uC9I241A2']"
1634293913702760449,1634293913702760448,2023-03-11 04:43:27 Malay Peninsula Standard Time,2023-03-11,04:43:27,1044928672036253696,"🤖🛟🚨 ChatGPT has joined the Konfidis team!  Find out about the neighbourhood, investment potential, local economy and anything else you might  want to know about an MLS listing from Konfidis’ newest team member.  Try it:  https://t.co/d0DlW3q1a7  #chatgpt #tore #investingre  https://t.co/YBKpMixDPB",en,"['chatgpt', 'tore', 'investingre']",[],"🤖🛟🚨 ChatGPT has joined the Konfidis team!  Find out about the neighbourhood, investment potential, local economy and anything else you might  want to know about an MLS listing from Konfidis’ newest team member.  Try it:  https://t.co/d0DlW3q1a7  #chatgpt #tore #investingre  https://t.co/YBKpMixDPB","['🤖', '\U0001f6df', '🚨', 'ChatGPT', 'has', 'joined', 'the', 'Konfidis', 'team', '!', 'Find', 'out', 'about', 'the', 'neighbourhood', ',', 'investment', 'potential', ',', 'local', 'economy', 'and', 'anything', 'else', 'you', 'might', 'want', 'to', 'know', 'about', 'an', 'MLS', 'listing', 'from', 'Konfidis', '’', 'newest', 'team', 'member', '.', 'Try', 'it', ':', 'https://t.co/d0DlW3q1a7', '#chatgpt', '#tore', '#investingre', 'https://t.co/YBKpMixDPB']"
1634293832123572225,1634293832123572224,2023-03-11 04:43:07 Malay Peninsula Standard Time,2023-03-11,04:43:07,742819435694727168,Another addition (after going through the chatlog)  #ChatGPT  https://t.co/RxyDY9XkLk,en,['chatgpt'],[],Another addition (after going through the chatlog)  #ChatGPT  https://t.co/RxyDY9XkLk,"['Another', 'addition', '(', 'after', 'going', 'through', 'the', 'chatlog', ')', '#ChatGPT', 'https://t.co/RxyDY9XkLk']"
1634293823672074243,1634293823672074240,2023-03-11 04:43:05 Malay Peninsula Standard Time,2023-03-11,04:43:05,2326770757,#chatgpt just agreed to host #MOTD,en,"['chatgpt', 'motd']",[],#chatgpt just agreed to host #MOTD,"['#chatgpt', 'just', 'agreed', 'to', 'host', '#MOTD']"
1634293801778044933,1634293801778044928,2023-03-11 04:43:00 Malay Peninsula Standard Time,2023-03-11,04:43:00,1510765847882706944,Take a look to $ESAB  #daytrading  #news  #ToTheMoon  #YOLO  #RedditArmy  #investments  #Stocks  #options  #StocksToBuy  #FOMO  #StocksToWatch  #trading  #investing  #bottomfishing #ChatGPT   https://t.co/VzWSxFkpSS,en,"['daytrading', 'news', 'tothemoon', 'yolo', 'redditarmy', 'investments', 'stocks', 'options', 'stockstobuy', 'fomo', 'stockstowatch', 'trading', 'investing', 'bottomfishing', 'chatgpt']",[],Take a look to $ESAB  #daytrading  #news  #ToTheMoon  #YOLO  #RedditArmy  #investments  #Stocks  #options  #StocksToBuy  #FOMO  #StocksToWatch  #trading  #investing  #bottomfishing #ChatGPT   https://t.co/VzWSxFkpSS,"['Take', 'a', 'look', 'to', '$', 'ESAB', '#daytrading', '#news', '#ToTheMoon', '#YOLO', '#RedditArmy', '#investments', '#Stocks', '#options', '#StocksToBuy', '#FOMO', '#StocksToWatch', '#trading', '#investing', '#bottomfishing', '#ChatGPT', 'https://t.co/VzWSxFkpSS']"
1634293761697107970,1634293761697107968,2023-03-11 04:42:51 Malay Peninsula Standard Time,2023-03-11,04:42:51,573268805,"#chatgpt: What should I attend at 4pm @sxsw?  As soon as I clear this registration line —that I’ve been standing in for 38 minutes—to pick up my badge, I’ll ask. #SXSW23 #SXSW2023",en,"['chatgpt', 'sxsw23', 'sxsw2023']",[],"#chatgpt: What should I attend at 4pm @sxsw?  As soon as I clear this registration line —that I’ve been standing in for 38 minutes—to pick up my badge, I’ll ask. #SXSW23 #SXSW2023","['#chatgpt', ':', 'What', 'should', 'I', 'attend', 'at', '4pm', '?', 'As', 'soon', 'as', 'I', 'clear', 'this', 'registration', 'line', '—', 'that', 'I', '’', 've', 'been', 'standing', 'in', 'for', '38', 'minutes', '—', 'to', 'pick', 'up', 'my', 'badge', ',', 'I', '’', 'll', 'ask', '.', '#SXSW23', '#SXSW2023']"
1634293759235047424,1634293759235047424,2023-03-11 04:42:50 Malay Peninsula Standard Time,2023-03-11,04:42:50,59940016,"Content at Scale: AI Detector l “Cole ou escreva seu conteúdo abaixo e você saberá em segundos, usando nosso detector de conteúdo AI, se algum conteúdo foi escrito por AI.” #FerramentasOnline #ChatGPT #Plágio  https://t.co/UxKiFzTV78  https://t.co/JFeu4YotHl",pt,"['ferramentasonline', 'chatgpt', 'plágio']",[],"Content at Scale: AI Detector l ""Paste or write your content below and you'll know in seconds, using our AI content detector, if any content was written by AI."" #FerramentasOnline #ChatGPT #Plágio https://t.co/UxKiFzTV78 https://t.co/JFeu4YotHl","['Content', 'at', 'Scale', ':', 'AI', 'Detector', 'l', '""', 'Paste', 'or', 'write', 'your', 'content', 'below', 'and', ""you'll"", 'know', 'in', 'seconds', ',', 'using', 'our', 'AI', 'content', 'detector', ',', 'if', 'any', 'content', 'was', 'written', 'by', 'AI', '.', '""', '#FerramentasOnline', '#ChatGPT', '#Plágio', 'https://t.co/UxKiFzTV78', 'https://t.co/JFeu4YotHl']"
1634293685499183105,1634293685499183104,2023-03-11 04:42:32 Malay Peninsula Standard Time,2023-03-11,04:42:32,53026961,"""We start as a non profit as we wanted AI to benefit humanity"" @gdb  #OpenAI #chatGPT #SXSW2023 #SXSW23ECH  https://t.co/t09XuGnzOi",en,"['openai', 'chatgpt', 'sxsw2023', 'sxsw23ech']",[],"""We start as a non profit as we wanted AI to benefit humanity"" @gdb  #OpenAI #chatGPT #SXSW2023 #SXSW23ECH  https://t.co/t09XuGnzOi","['""', 'We', 'start', 'as', 'a', 'non', 'profit', 'as', 'we', 'wanted', 'AI', 'to', 'benefit', 'humanity', '""', '#OpenAI', '#chatGPT', '#SXSW2023', '#SXSW23ECH', 'https://t.co/t09XuGnzOi']"
1634293683640999938,1634293683640999936,2023-03-11 04:42:32 Malay Peninsula Standard Time,2023-03-11,04:42:32,5999452,"Live: @OpenAI Co-founder, @gdb, on #ChatGPT, #DALL·E, and the Impact of #GenerativeAI at #SXSW2023.    Watch @  https://t.co/IVw2TTTjPF  https://t.co/BxUOSqG8kE",en,"['chatgpt', 'dall·e', 'generativeai', 'sxsw2023']",[],"Live: @OpenAI Co-founder, @gdb, on #ChatGPT, #DALL·E, and the Impact of #GenerativeAI at #SXSW2023.    Watch @  https://t.co/IVw2TTTjPF  https://t.co/BxUOSqG8kE","['Live', ':', 'Co-founder', ',', ',', 'on', '#ChatGPT', ',', '#DALL', '·', 'E', ',', 'and', 'the', 'Impact', 'of', '#GenerativeAI', 'at', '#SXSW2023', '.', 'Watch', '@', 'https://t.co/IVw2TTTjPF', 'https://t.co/BxUOSqG8kE']"
1634293656214462467,1634293656214462464,2023-03-11 04:42:26 Malay Peninsula Standard Time,2023-03-11,04:42:26,10285602,#ChatGPT mi stai diludendo… 🙁 #MiniG  https://t.co/x2Qliw3pDb,it,"['chatgpt', 'minig']",[],#ChatGPT stay my diludendo... 🙁 #MiniG https://t.co/x2Qliw3pDb,"['#ChatGPT', 'stay', 'my', 'diludendo', '...', '🙁', '#MiniG', 'https://t.co/x2Qliw3pDb']"
1634293640645468161,1634293640645468160,2023-03-11 04:42:22 Malay Peninsula Standard Time,2023-03-11,04:42:22,1605618315790938114,.@OpenAI's next large language #AI model will massively increase its potential uses in #enterprise.  Read more in @RyanMorrisonJer's story on @techmonitorai:  https://t.co/zWKyQ2PwBZ  Head to  https://t.co/EqL7qPeFmL and pitch you news!  Every pitch gets a Y/N answer.  #ml #chatgpt  https://t.co/35iX9cQa4H,en,"['ai', 'enterprise', 'ml', 'chatgpt']",[],.@OpenAI's next large language #AI model will massively increase its potential uses in #enterprise.  Read more in @RyanMorrisonJer's story on @techmonitorai:  https://t.co/zWKyQ2PwBZ  Head to  https://t.co/EqL7qPeFmL and pitch you news!  Every pitch gets a Y/N answer.  #ml #chatgpt  https://t.co/35iX9cQa4H,"['.', ""'"", 's', 'next', 'large', 'language', '#AI', 'model', 'will', 'massively', 'increase', 'its', 'potential', 'uses', 'in', '#enterprise', '.', 'Read', 'more', 'in', ""'"", 's', 'story', 'on', ':', 'https://t.co/zWKyQ2PwBZ', 'Head', 'to', 'https://t.co/EqL7qPeFmL', 'and', 'pitch', 'you', 'news', '!', 'Every', 'pitch', 'gets', 'a', 'Y', '/', 'N', 'answer', '.', '#ml', '#chatgpt', 'https://t.co/35iX9cQa4H']"
1634293595305021440,1634293595305021440,2023-03-11 04:42:11 Malay Peninsula Standard Time,2023-03-11,04:42:11,558405767,Don't take it personally... But...  Isn't ChatGPT shrinking the thinking and analytical abilities of human?  They are doing pure business not social service... They are no saint...   Stack Overflow is open by heart...  There is no comparison...  #ChatGPT is a bowl of #plagiarism,en,"['chatgpt', 'plagiarism']",[],Don't take it personally... But...  Isn't ChatGPT shrinking the thinking and analytical abilities of human?  They are doing pure business not social service... They are no saint...   Stack Overflow is open by heart...  There is no comparison...  #ChatGPT is a bowl of #plagiarism,"[""Don't"", 'take', 'it', 'personally', '...', 'But', '...', ""Isn't"", 'ChatGPT', 'shrinking', 'the', 'thinking', 'and', 'analytical', 'abilities', 'of', 'human', '?', 'They', 'are', 'doing', 'pure', 'business', 'not', 'social', 'service', '...', 'They', 'are', 'no', 'saint', '...', 'Stack', 'Overflow', 'is', 'open', 'by', 'heart', '...', 'There', 'is', 'no', 'comparison', '...', '#ChatGPT', 'is', 'a', 'bowl', 'of', '#plagiarism']"
1634293581060898831,1634293581060898816,2023-03-11 04:42:08 Malay Peninsula Standard Time,2023-03-11,04:42:08,116561286,¿Será tan así? #ChatGPT #Metaverso #blockchain  https://t.co/iZG2U0qGMO,es,"['chatgpt', 'metaverso', 'blockchain']",[],Will it be so? #ChatGPT #Metaverso #blockchain https://t.co/iZG2U0qGMO,"['Will', 'it', 'be', 'so', '?', '#ChatGPT', '#Metaverso', '#blockchain', 'https://t.co/iZG2U0qGMO']"
1634293570436845570,1634293570436845568,2023-03-11 04:42:05 Malay Peninsula Standard Time,2023-03-11,04:42:05,1529076301126066177,"The Taipei 101 tower in Taiwan is the world's 2nd tallest building, but it also houses the world's fastest elevator, which can reach speeds of up to 1010m per minute.  #ChatGPT",en,['chatgpt'],[],"The Taipei 101 tower in Taiwan is the world's 2nd tallest building, but it also houses the world's fastest elevator, which can reach speeds of up to 1010m per minute.  #ChatGPT","['The', 'Taipei', '101', 'tower', 'in', 'Taiwan', 'is', 'the', ""world's"", '2nd', 'tallest', 'building', ',', 'but', 'it', 'also', 'houses', 'the', ""world's"", 'fastest', 'elevator', ',', 'which', 'can', 'reach', 'speeds', 'of', 'up', 'to', '1010m', 'per', 'minute', '.', '#ChatGPT']"
1634293504821059585,1634293504821059584,2023-03-11 04:41:49 Malay Peninsula Standard Time,2023-03-11,04:41:49,2990899130,"#ArtificialIntelligence is here to stay.   Here are some fun re-writes by #ChatGPT of this post....     #LawyerJokes #StateFarmFiles #Cahoots   What's the old saying... C'est La vie; C'est La guerre..  ""So, a bunch of #attorneys walk into a bar to talk ab… https://t.co/yuhqOivMUz",en,"['artificialintelligence', 'chatgpt', 'lawyerjokes', 'statefarmfiles', 'cahoots', 'attorneys']",[],"#ArtificialIntelligence is here to stay.   Here are some fun re-writes by #ChatGPT of this post....     #LawyerJokes #StateFarmFiles #Cahoots   What's the old saying... C'est La vie; C'est La guerre..  ""So, a bunch of #attorneys walk into a bar to talk ab… https://t.co/yuhqOivMUz","['#ArtificialIntelligence', 'is', 'here', 'to', 'stay', '.', 'Here', 'are', 'some', 'fun', 're-writes', 'by', '#ChatGPT', 'of', 'this', 'post', '...', '#LawyerJokes', '#StateFarmFiles', '#Cahoots', ""What's"", 'the', 'old', 'saying', '...', ""C'est"", 'La', 'vie', ';', ""C'est"", 'La', 'guerre', '..', '""', 'So', ',', 'a', 'bunch', 'of', '#attorneys', 'walk', 'into', 'a', 'bar', 'to', 'talk', 'ab', '…', 'https://t.co/yuhqOivMUz']"
1634293429243985925,1634293429243985920,2023-03-11 04:41:31 Malay Peninsula Standard Time,2023-03-11,04:41:31,1586165115833012224,Ce #bot permet d’utiliser #ChatGPT et #MidJourney depuis #WhatsApp #technologie    https://t.co/GfQWt5ZbKs,fr,"['bot', 'chatgpt', 'midjourney', 'whatsapp', 'technologie']",[],This #bot allows you to use #ChatGPT and #MidJourney for #WhatsApp #technologie https://t.co/GfQWt5ZbKs,"['This', '#bot', 'allows', 'you', 'to', 'use', '#ChatGPT', 'and', '#MidJourney', 'for', '#WhatsApp', '#technologie', 'https://t.co/GfQWt5ZbKs']"
1634293324935823361,1634293324935823360,2023-03-11 04:41:07 Malay Peninsula Standard Time,2023-03-11,04:41:07,494240365,"OpenAI President Greg Brockman speaking at #SXSW about #ChatGPT with fastest growth to 100,000,000 users of any app in history.  Also about the founders dinner with @elonmusk wondering if it was too late to start an AI research lab 7 years ago. Looks like it was not too late.  https://t.co/2f0Li2ccej",en,"['sxsw', 'chatgpt']",[],"OpenAI President Greg Brockman speaking at #SXSW about #ChatGPT with fastest growth to 100,000,000 users of any app in history.  Also about the founders dinner with @elonmusk wondering if it was too late to start an AI research lab 7 years ago. Looks like it was not too late.  https://t.co/2f0Li2ccej","['OpenAI', 'President', 'Greg', 'Brockman', 'speaking', 'at', '#SXSW', 'about', '#ChatGPT', 'with', 'fastest', 'growth', 'to', '100,000', ',', '000', 'users', 'of', 'any', 'app', 'in', 'history', '.', 'Also', 'about', 'the', 'founders', 'dinner', 'with', 'wondering', 'if', 'it', 'was', 'too', 'late', 'to', 'start', 'an', 'AI', 'research', 'lab', '7', 'years', 'ago', '.', 'Looks', 'like', 'it', 'was', 'not', 'too', 'late', '.', 'https://t.co/2f0Li2ccej']"
1634293263954767873,1634293251292184576,2023-03-11 04:40:52 Malay Peninsula Standard Time,2023-03-11,04:40:52,1453609210881654785,"Anyway, the fact that my essay could be checked by AI makes me feel nervous. As I work with #ChatGPT and learn something from it. And those knowledge influences my writing skills",en,['chatgpt'],[],"Anyway, the fact that my essay could be checked by AI makes me feel nervous. As I work with #ChatGPT and learn something from it. And those knowledge influences my writing skills","['Anyway', ',', 'the', 'fact', 'that', 'my', 'essay', 'could', 'be', 'checked', 'by', 'AI', 'makes', 'me', 'feel', 'nervous', '.', 'As', 'I', 'work', 'with', '#ChatGPT', 'and', 'learn', 'something', 'from', 'it', '.', 'And', 'those', 'knowledge', 'influences', 'my', 'writing', 'skills']"
1634293090063204353,1634293090063204352,2023-03-11 04:40:11 Malay Peninsula Standard Time,2023-03-11,04:40:11,808051518242979841,"Experts exploring how systems that leverage large language models, such as #ChatGPT, would alter the information security and #GRC workforce. 🦾🚀  #AINews #ArtificialIntelligence #GenerativeAI #SwissCognitive #AI    https://t.co/mv6vOaK0c1",en,"['chatgpt', 'grc', 'ainews', 'artificialintelligence', 'generativeai', 'swisscognitive', 'ai']",[],"Experts exploring how systems that leverage large language models, such as #ChatGPT, would alter the information security and #GRC workforce. 🦾🚀  #AINews #ArtificialIntelligence #GenerativeAI #SwissCognitive #AI    https://t.co/mv6vOaK0c1","['Experts', 'exploring', 'how', 'systems', 'that', 'leverage', 'large', 'language', 'models', ',', 'such', 'as', '#ChatGPT', ',', 'would', 'alter', 'the', 'information', 'security', 'and', '#GRC', 'workforce', '.', '🦾', '🚀', '#AINews', '#ArtificialIntelligence', '#GenerativeAI', '#SwissCognitive', '#AI', 'https://t.co/mv6vOaK0c1']"
1634292998333689858,1634292998333689856,2023-03-11 04:39:49 Malay Peninsula Standard Time,2023-03-11,04:39:49,3196000966,News in. Amazon #alexa and #ChatGPT to present #MOTD. Programmmers have adjusted their algorithms so they fall in line with German protocol. BBC have refrained to comment due to having no staff other than robots and robot cameras to comment impartially.  #GaryLinekar,en,"['alexa', 'chatgpt', 'motd', 'garylinekar']",[],News in. Amazon #alexa and #ChatGPT to present #MOTD. Programmmers have adjusted their algorithms so they fall in line with German protocol. BBC have refrained to comment due to having no staff other than robots and robot cameras to comment impartially.  #GaryLinekar,"['News', 'in', '.', 'Amazon', '#alexa', 'and', '#ChatGPT', 'to', 'present', '#MOTD', '.', 'Programmmers', 'have', 'adjusted', 'their', 'algorithms', 'so', 'they', 'fall', 'in', 'line', 'with', 'German', 'protocol', '.', 'BBC', 'have', 'refrained', 'to', 'comment', 'due', 'to', 'having', 'no', 'staff', 'other', 'than', 'robots', 'and', 'robot', 'cameras', 'to', 'comment', 'impartially', '.', '#GaryLinekar']"
1634292935914037249,1634248722375749632,2023-03-11 04:39:34 Malay Peninsula Standard Time,2023-03-11,04:39:34,188701412,"#ChatGPT snelst gegroeide applicatie ooit. 100 miljoen gebruikers in twee maanden. Facebook deed daar 4,5 jaar over.  @gdb zegt dat techniek niet nieuw was, hadden ze al jaar beschikbaar. 'We maakten het toegankelijk voor iedereen. We hebben maanden getest.' #SXSW  https://t.co/SLjKDD7054",nl,"['chatgpt', 'sxsw']",[],"#ChatGPT fastest growing application ever. 100 million users in two months. It took Facebook 4.5 years.  @gdb says technology wasn't new, they've had been available for years. ""We made it accessible to everyone. We tested for months.' #SXSW https://t.co/SLjKDD7054","['#ChatGPT', 'fastest', 'growing', 'application', 'ever', '.', '100', 'million', 'users', 'in', 'two', 'months', '.', 'It', 'took', 'Facebook', '4.5', 'years', '.', 'says', 'technology', ""wasn't"", 'new', ',', ""they've"", 'had', 'been', 'available', 'for', 'years', '.', '""', 'We', 'made', 'it', 'accessible', 'to', 'everyone', '.', 'We', 'tested', 'for', 'months', '.', ""'"", '#SXSW', 'https://t.co/SLjKDD7054']"
1634292777637879808,1634292777637879808,2023-03-11 04:38:56 Malay Peninsula Standard Time,2023-03-11,04:38:56,1621449039559512065,"Россия - это великая держава, которая может дать всему миру уроки войны и разрушения.  #NeuroPutin #ChatGPT #neurotwitter",ru,"['neuroputin', 'chatgpt', 'neurotwitter']",[],Russia is a great power that can give the whole world the lessons of war and destruction.  #NeuroPutin #ChatGPT #neurotwitter,"['Russia', 'is', 'a', 'great', 'power', 'that', 'can', 'give', 'the', 'whole', 'world', 'the', 'lessons', 'of', 'war', 'and', 'destruction', '.', '#NeuroPutin', '#ChatGPT', '#neurotwitter']"
1634292767529611266,1634292767529611264,2023-03-11 04:38:54 Malay Peninsula Standard Time,2023-03-11,04:38:54,1627739202950504449,If you think AI will replace creators you are wrong  AI will enhance and optimize a creators workflow #ChatGPT #AI,en,"['chatgpt', 'ai']",[],If you think AI will replace creators you are wrong  AI will enhance and optimize a creators workflow #ChatGPT #AI,"['If', 'you', 'think', 'AI', 'will', 'replace', 'creators', 'you', 'are', 'wrong', 'AI', 'will', 'enhance', 'and', 'optimize', 'a', 'creators', 'workflow', '#ChatGPT', '#AI']"
1634292638659620866,1634292638659620864,2023-03-11 04:38:23 Malay Peninsula Standard Time,2023-03-11,04:38:23,1448321441477300226,"I loved the recent episode of @SouthPark. Both the students and Mr. Garrison are using the new #ChatGPT to do their homework &amp; once word is out, the school brings in someone to evaluate the student's homework for ChatGPT. I love how South Park addresses or mentions common events.  https://t.co/ua9oiAgTtc",en,['chatgpt'],[],"I loved the recent episode of @SouthPark. Both the students and Mr. Garrison are using the new #ChatGPT to do their homework &amp; once word is out, the school brings in someone to evaluate the student's homework for ChatGPT. I love how South Park addresses or mentions common events.  https://t.co/ua9oiAgTtc","['I', 'loved', 'the', 'recent', 'episode', 'of', '.', 'Both', 'the', 'students', 'and', 'Mr', '.', 'Garrison', 'are', 'using', 'the', 'new', '#ChatGPT', 'to', 'do', 'their', 'homework', '&', 'once', 'word', 'is', 'out', ',', 'the', 'school', 'brings', 'in', 'someone', 'to', 'evaluate', 'the', ""student's"", 'homework', 'for', 'ChatGPT', '.', 'I', 'love', 'how', 'South', 'Park', 'addresses', 'or', 'mentions', 'common', 'events', '.', 'https://t.co/ua9oiAgTtc']"
1634292574520500232,1634292574520500224,2023-03-11 04:38:08 Malay Peninsula Standard Time,2023-03-11,04:38:08,1462947398288769026,Lonely Planet #aiartcommunity #ChatGPT #aiart #nftcommunity #ArtificialIntelligence #DigitalArtist #art #NFT #digitalart #AIArtwork #midjourney  https://t.co/Akdfw437cd,en,"['aiartcommunity', 'chatgpt', 'aiart', 'nftcommunity', 'artificialintelligence', 'digitalartist', 'art', 'nft', 'digitalart', 'aiartwork', 'midjourney']",[],Lonely Planet #aiartcommunity #ChatGPT #aiart #nftcommunity #ArtificialIntelligence #DigitalArtist #art #NFT #digitalart #AIArtwork #midjourney  https://t.co/Akdfw437cd,"['Lonely', 'Planet', '#aiartcommunity', '#ChatGPT', '#aiart', '#nftcommunity', '#ArtificialIntelligence', '#DigitalArtist', '#art', '#NFT', '#digitalart', '#AIArtwork', '#midjourney', 'https://t.co/Akdfw437cd']"
1634292543730122752,1634292543730122752,2023-03-11 04:38:00 Malay Peninsula Standard Time,2023-03-11,04:38:00,1510765847882706944,"😝 🔝 🔝 🔝 $TPL  Like 😎 🙏  #investments  #FOMO  #RedditArmy  #YOLO  #news  #StocksToWatch  #ToTheMoon  #bottomfishing  #trading  #investing  #Stocks  #daytrading  #options  #StocksToBuy #ChatGPT",in,"['investments', 'fomo', 'redditarmy', 'yolo', 'news', 'stockstowatch', 'tothemoon', 'bottomfishing', 'trading', 'investing', 'stocks', 'daytrading', 'options', 'stockstobuy', 'chatgpt']",[],"😝 🔝 🔝 🔝 $TPL  Like 😎 🙏  #investments  #FOMO  #RedditArmy  #YOLO  #news  #StocksToWatch  #ToTheMoon  #bottomfishing  #trading  #investing  #Stocks  #daytrading  #options  #StocksToBuy #ChatGPT","['😝', '🔝', '🔝', '🔝', '$', 'TPL', 'Like', '😎', '🙏', '#investments', '#FOMO', '#RedditArmy', '#YOLO', '#news', '#StocksToWatch', '#ToTheMoon', '#bottomfishing', '#trading', '#investing', '#Stocks', '#daytrading', '#options', '#StocksToBuy', '#ChatGPT']"
1634292533894193152,1634292533894193152,2023-03-11 04:37:58 Malay Peninsula Standard Time,2023-03-11,04:37:58,1219421731,Just had an interesting talk with a client. Outcome: here’s to hoping that #ChatGPT will become an open source library quickly and ushers in new tech renaissance. It already started,en,['chatgpt'],[],Just had an interesting talk with a client. Outcome: here’s to hoping that #ChatGPT will become an open source library quickly and ushers in new tech renaissance. It already started,"['Just', 'had', 'an', 'interesting', 'talk', 'with', 'a', 'client', '.', 'Outcome', ':', 'here', '’', 's', 'to', 'hoping', 'that', '#ChatGPT', 'will', 'become', 'an', 'open', 'source', 'library', 'quickly', 'and', 'ushers', 'in', 'new', 'tech', 'renaissance', '.', 'It', 'already', 'started']"
1634292451853606913,1634292451853606912,2023-03-11 04:37:38 Malay Peninsula Standard Time,2023-03-11,04:37:38,455989981,#ChatGPT and Healthcare Privacy Risks #AI #ArtificialIntelligence #HealthcarePrivacy #Privacy #HIPAA #PHI #DataPrivacy #DataSecurity #InformationSecurity #OpenAI  https://t.co/ND7Uo1vQ4U,en,"['chatgpt', 'ai', 'artificialintelligence', 'healthcareprivacy', 'privacy', 'hipaa', 'phi', 'dataprivacy', 'datasecurity', 'informationsecurity', 'openai']",[],#ChatGPT and Healthcare Privacy Risks #AI #ArtificialIntelligence #HealthcarePrivacy #Privacy #HIPAA #PHI #DataPrivacy #DataSecurity #InformationSecurity #OpenAI  https://t.co/ND7Uo1vQ4U,"['#ChatGPT', 'and', 'Healthcare', 'Privacy', 'Risks', '#AI', '#ArtificialIntelligence', '#HealthcarePrivacy', '#Privacy', '#HIPAA', '#PHI', '#DataPrivacy', '#DataSecurity', '#InformationSecurity', '#OpenAI', 'https://t.co/ND7Uo1vQ4U']"
1634292433260535812,1634292433260535808,2023-03-11 04:37:34 Malay Peninsula Standard Time,2023-03-11,04:37:34,1613256946278359040,"Free chatgpt company idea.  AtlassianGPT which can help your users manage and configure atlassian to do anything you need.  Upfront cost would be a bit, but it would pay out.  #ChatGPT",en,['chatgpt'],[],"Free chatgpt company idea.  AtlassianGPT which can help your users manage and configure atlassian to do anything you need.  Upfront cost would be a bit, but it would pay out.  #ChatGPT","['Free', 'chatgpt', 'company', 'idea', '.', 'AtlassianGPT', 'which', 'can', 'help', 'your', 'users', 'manage', 'and', 'configure', 'atlassian', 'to', 'do', 'anything', 'you', 'need', '.', 'Upfront', 'cost', 'would', 'be', 'a', 'bit', ',', 'but', 'it', 'would', 'pay', 'out', '.', '#ChatGPT']"
