id,conversation_id,created_at,date,time,user_id,tweet,language,hashtags,reply_to,translated_text,tokenized_text
1634272311942561794,1634272311942561792,2023-03-11 03:17:37 Malay Peninsula Standard Time,2023-03-11,03:17:37,1084931943588876289,"Microsoft will launch ChatGPT 4 with AI videos next week.  ChatGPT-4 will potentially let you create AI-generated videos from simple text prompts.  The news was revealed by Andreas Braun, CTO at Microsoft Germany, at a recent event titled “AI in Focus #ChatGPT #Microsoft  https://t.co/Nw9sKxhtNq",en,"['chatgpt', 'microsoft']",[],"Microsoft will launch ChatGPT 4 with AI videos next week.  ChatGPT-4 will potentially let you create AI-generated videos from simple text prompts.  The news was revealed by Andreas Braun, CTO at Microsoft Germany, at a recent event titled “AI in Focus #ChatGPT #Microsoft  https://t.co/Nw9sKxhtNq","['Microsoft', 'will', 'launch', 'ChatGPT', '4', 'with', 'AI', 'videos', 'next', 'week', '.', 'ChatGPT', '-', '4', 'will', 'potentially', 'let', 'you', 'create', 'AI-generated', 'videos', 'from', 'simple', 'text', 'prompts', '.', 'The', 'news', 'was', 'revealed', 'by', 'Andreas', 'Braun', ',', 'CTO', 'at', 'Microsoft', 'Germany', ',', 'at', 'a', 'recent', 'event', 'titled', '“', 'AI', 'in', 'Focus', '#ChatGPT', '#Microsoft', 'https://t.co/Nw9sKxhtNq']"
1634272305936322571,1634272305936322560,2023-03-11 03:17:35 Malay Peninsula Standard Time,2023-03-11,03:17:35,17838022,404  https://t.co/s27nG4ZnDD via @YouTubeMusic  #404 #Notfound #rockandroll #ramjam #ChatGPT #BingChat  https://t.co/lhMytYYIcZ,und,"['notfound', 'rockandroll', 'ramjam', 'chatgpt', 'bingchat']",[],404 https://t.co/s27nG4ZnDD via @YouTubeMusic #404 #Notfound #rockandroll #ramjam #ChatGPT #BingChat https://t.co/lhMytYYIcZ,"['404', 'https://t.co/s27nG4ZnDD', 'via', '#404', '#Notfound', '#rockandroll', '#ramjam', '#ChatGPT', '#BingChat', 'https://t.co/lhMytYYIcZ']"
1634272289565954063,1634272289565954048,2023-03-11 03:17:31 Malay Peninsula Standard Time,2023-03-11,03:17:31,1505093815186690053,#ChatGPT  + Manual Researching,en,['chatgpt'],[],#ChatGPT  + Manual Researching,"['#ChatGPT', '+', 'Manual', 'Researching']"
1634272227469447169,1634272227469447168,2023-03-11 03:17:16 Malay Peninsula Standard Time,2023-03-11,03:17:16,1628832207308566531,"#ChatGPT is being used to automatically write emails: #Microsoft, #Salesforce and #TikTok creators are hopping on the trend  https://t.co/KuTIoxdzYT  https://t.co/QKs4CLnMNd",en,"['chatgpt', 'microsoft', 'salesforce', 'tiktok']",[],"#ChatGPT is being used to automatically write emails: #Microsoft, #Salesforce and #TikTok creators are hopping on the trend  https://t.co/KuTIoxdzYT  https://t.co/QKs4CLnMNd","['#ChatGPT', 'is', 'being', 'used', 'to', 'automatically', 'write', 'emails', ':', '#Microsoft', ',', '#Salesforce', 'and', '#TikTok', 'creators', 'are', 'hopping', 'on', 'the', 'trend', 'https://t.co/KuTIoxdzYT', 'https://t.co/QKs4CLnMNd']"
1634272099748675584,1634272099748675584,2023-03-11 03:16:46 Malay Peninsula Standard Time,2023-03-11,03:16:46,1556460193948794880,Download CryptoGPT and farm rewards! Use my code to sign up: 2F7HMNZ   https://t.co/h1meRMM5rT…  #DownloadCryptoGPT #CryptoGPTReferral  #ChatGPT,en,"['downloadcryptogpt', 'cryptogptreferral', 'chatgpt']",[],Download CryptoGPT and farm rewards! Use my code to sign up: 2F7HMNZ   https://t.co/h1meRMM5rT…  #DownloadCryptoGPT #CryptoGPTReferral  #ChatGPT,"['Download', 'CryptoGPT', 'and', 'farm', 'rewards', '!', 'Use', 'my', 'code', 'to', 'sign', 'up', ':', '2F7HMNZ', 'https://t.co/h1meRMM5rT…', '#DownloadCryptoGPT', '#CryptoGPTReferral', '#ChatGPT']"
1634272084653387776,1634272084653387776,2023-03-11 03:16:42 Malay Peninsula Standard Time,2023-03-11,03:16:42,1629975502860713985,Checkout Our #Metaverse #clubhouse 🔥🔥🔥  👉  https://t.co/9c9AZqNImQ  ⭐️ No download or APP required ⭐️  (Browser Based) 🙌 Amazing graphics! 🙌  #gamedev #BlockchainGaming #web3 #ue5 #ChatGPT #unity #P2Egaming #FreeGames #epic #roblox #Fortnite  https://t.co/1D8OalrSyb,en,"['metaverse', 'clubhouse', 'gamedev', 'blockchaingaming', 'web3', 'ue5', 'chatgpt', 'unity', 'p2egaming', 'freegames', 'epic', 'roblox', 'fortnite']",[],Checkout Our #Metaverse #clubhouse 🔥🔥🔥  👉  https://t.co/9c9AZqNImQ  ⭐️ No download or APP required ⭐️  (Browser Based) 🙌 Amazing graphics! 🙌  #gamedev #BlockchainGaming #web3 #ue5 #ChatGPT #unity #P2Egaming #FreeGames #epic #roblox #Fortnite  https://t.co/1D8OalrSyb,"['Checkout', 'Our', '#Metaverse', '#clubhouse', '🔥', '🔥', '🔥', '👉', 'https://t.co/9c9AZqNImQ', '⭐', '️', 'No', 'download', 'or', 'APP', 'required', '⭐', '️', '(', 'Browser', 'Based', ')', '🙌', 'Amazing', 'graphics', '!', '🙌', '#gamedev', '#BlockchainGaming', '#web3', '#ue5', '#ChatGPT', '#unity', '#P2Egaming', '#FreeGames', '#epic', '#roblox', '#Fortnite', 'https://t.co/1D8OalrSyb']"
1634272060133212160,1634272060133212160,2023-03-11 03:16:37 Malay Peninsula Standard Time,2023-03-11,03:16:37,1328060936,"¿Se convertirá #Siri en la nueva #ChatGPT? En cualquier caso, #Apple tiene que empezar a planear su nueva estrategia YA, si no se quiere quedar rezagada.  https://t.co/RN7PvUJe5d",es,"['siri', 'chatgpt', 'apple']",[],"Will #Siri become the new #ChatGPT? In any case, #Apple has to start planning your new strategy NOW, if you do not want to be left behind.  https://t.co/RN7PvUJe5d","['Will', '#Siri', 'become', 'the', 'new', '#ChatGPT', '?', 'In', 'any', 'case', ',', '#Apple', 'has', 'to', 'start', 'planning', 'your', 'new', 'strategy', 'NOW', ',', 'if', 'you', 'do', 'not', 'want', 'to', 'be', 'left', 'behind', '.', 'https://t.co/RN7PvUJe5d']"
1634271906730844161,1634271906730844160,2023-03-11 03:16:00 Malay Peninsula Standard Time,2023-03-11,03:16:00,2938779430,"Wait, what! does chatGPT has a WhatsApp line? 🤔  #ChatGPT #chatbot #AI #gpt3  https://t.co/q7TiGgpilp",en,"['chatgpt', 'chatbot', 'ai', 'gpt3']",[],"Wait, what! does chatGPT has a WhatsApp line? 🤔  #ChatGPT #chatbot #AI #gpt3  https://t.co/q7TiGgpilp","['Wait', ',', 'what', '!', 'does', 'chatGPT', 'has', 'a', 'WhatsApp', 'line', '?', '🤔', '#ChatGPT', '#chatbot', '#AI', '#gpt3', 'https://t.co/q7TiGgpilp']"
1634271905703251973,1634271905703251968,2023-03-11 03:16:00 Malay Peninsula Standard Time,2023-03-11,03:16:00,1188900085284921345,"El creciente interés y proyección hacia lo útil que serán las inteligencias artificiales viene a plantear nuevos paradigmas, algunas tareas que dependían del raciocinio humano poco a poco empiezan a ser delegables a Inteligencias Artificiales.  #mgcs #accounting #chatgpt #ai  https://t.co/hEGhdQd8h3",es,"['mgcs', 'accounting', 'chatgpt', 'ai']",[],"The growing interest and projection towards how useful artificial intelligences will be comes to raise new paradigms, some tasks that depended on human reasoning little by little begin to be delegable to Artificial Intelligences.  #mgcs #accounting #chatgpt #ai https://t.co/hEGhdQd8h3","['The', 'growing', 'interest', 'and', 'projection', 'towards', 'how', 'useful', 'artificial', 'intelligences', 'will', 'be', 'comes', 'to', 'raise', 'new', 'paradigms', ',', 'some', 'tasks', 'that', 'depended', 'on', 'human', 'reasoning', 'little', 'by', 'little', 'begin', 'to', 'be', 'delegable', 'to', 'Artificial', 'Intelligences', '.', '#mgcs', '#accounting', '#chatgpt', '#ai', 'https://t.co/hEGhdQd8h3']"
1634271902431694850,1634271902431694848,2023-03-11 03:15:59 Malay Peninsula Standard Time,2023-03-11,03:15:59,1529076301126066177,NASA's Curiosity Rover has already traveled 11.3 miles on Mars!  #ChatGPT,en,['chatgpt'],[],NASA's Curiosity Rover has already traveled 11.3 miles on Mars!  #ChatGPT,"[""NASA's"", 'Curiosity', 'Rover', 'has', 'already', 'traveled', '11.3', 'miles', 'on', 'Mars', '!', '#ChatGPT']"
1634271881489534987,1634271881489534976,2023-03-11 03:15:54 Malay Peninsula Standard Time,2023-03-11,03:15:54,21998204,"Tá bom. A Inteligência Artificial vai acabar com o mundo, etc... Mas será que já dá para falar de outra coisa. Este negócio de ChatGPT já deu né. #ChatGPT #stablediffusion #InteligenciaArtificial",pt,"['chatgpt', 'stablediffusion', 'inteligenciaartificial']",[],"Endorsement. Artificial Intelligence will end the world, etc... But can we talk about something else. This ChatGPT business has already given right. #ChatGPT #stablediffusion #InteligenciaArtificial","['Endorsement', '.', 'Artificial', 'Intelligence', 'will', 'end', 'the', 'world', ',', 'etc', '...', 'But', 'can', 'we', 'talk', 'about', 'something', 'else', '.', 'This', 'ChatGPT', 'business', 'has', 'already', 'given', 'right', '.', '#ChatGPT', '#stablediffusion', '#InteligenciaArtificial']"
1634271880785047552,1634271880785047552,2023-03-11 03:15:54 Malay Peninsula Standard Time,2023-03-11,03:15:54,119560241,Someone's getting fired...  #chatgpt Google #google #generativeai #largelanguagemodels #technologynews #technology #ai #artificialintelligence  https://t.co/6mnmtePneq,en,"['chatgpt', 'google', 'generativeai', 'largelanguagemodels', 'technologynews', 'technology', 'ai', 'artificialintelligence']",[],Someone's getting fired...  #chatgpt Google #google #generativeai #largelanguagemodels #technologynews #technology #ai #artificialintelligence  https://t.co/6mnmtePneq,"[""Someone's"", 'getting', 'fired', '...', '#chatgpt', 'Google', '#google', '#generativeai', '#largelanguagemodels', '#technologynews', '#technology', '#ai', '#artificialintelligence', 'https://t.co/6mnmtePneq']"
1634271878339612700,1634271878339612672,2023-03-11 03:15:53 Malay Peninsula Standard Time,2023-03-11,03:15:53,1363553512756551687,"Which #AI app/tools have more potential - standalone (Like, #ChatGPT, @heyjasperai, Dall-e) or integrated ones (like, Bing AI)?",en,"['ai', 'chatgpt']",[],"Which #AI app/tools have more potential - standalone (Like, #ChatGPT, @heyjasperai, Dall-e) or integrated ones (like, Bing AI)?","['Which', '#AI', 'app', '/', 'tools', 'have', 'more', 'potential', '-', 'standalone', '(', 'Like', ',', '#ChatGPT', ',', ',', 'Dall-e', ')', 'or', 'integrated', 'ones', '(', 'like', ',', 'Bing', 'AI', ')', '?']"
1634271853542776839,1634271853542776832,2023-03-11 03:15:47 Malay Peninsula Standard Time,2023-03-11,03:15:47,1362161883344740358,"This changes EVERYTHING 😱  #AI will reshape how you do everything in your business. Learn more about how AI can benefit your organization on The Buck Stops Here podcast. Listen now on Apple, Spotify, and our website.  #artificialintelligence #machinelearning #chatgpt  https://t.co/vUumYSBrZU",en,"['ai', 'artificialintelligence', 'machinelearning', 'chatgpt']",[],"This changes EVERYTHING 😱  #AI will reshape how you do everything in your business. Learn more about how AI can benefit your organization on The Buck Stops Here podcast. Listen now on Apple, Spotify, and our website.  #artificialintelligence #machinelearning #chatgpt  https://t.co/vUumYSBrZU","['This', 'changes', 'EVERYTHING', '😱', '#AI', 'will', 'reshape', 'how', 'you', 'do', 'everything', 'in', 'your', 'business', '.', 'Learn', 'more', 'about', 'how', 'AI', 'can', 'benefit', 'your', 'organization', 'on', 'The', 'Buck', 'Stops', 'Here', 'podcast', '.', 'Listen', 'now', 'on', 'Apple', ',', 'Spotify', ',', 'and', 'our', 'website', '.', '#artificialintelligence', '#machinelearning', '#chatgpt', 'https://t.co/vUumYSBrZU']"
1634271783799889921,1634271783799889920,2023-03-11 03:15:31 Malay Peninsula Standard Time,2023-03-11,03:15:31,72464305,I predict this will take off..  #chrisjones #microsoft #minecraft #chatgpt #ai  https://t.co/6C7R1oZLwE,en,"['chrisjones', 'microsoft', 'minecraft', 'chatgpt', 'ai']",[],I predict this will take off..  #chrisjones #microsoft #minecraft #chatgpt #ai  https://t.co/6C7R1oZLwE,"['I', 'predict', 'this', 'will', 'take', 'off', '..', '#chrisjones', '#microsoft', '#minecraft', '#chatgpt', '#ai', 'https://t.co/6C7R1oZLwE']"
1634271689306406912,1634271689306406912,2023-03-11 03:15:08 Malay Peninsula Standard Time,2023-03-11,03:15:08,2354076289,Taking ChatGPT for an Impromptu Spin 🔎  Find out more about #ChatGPT with the video Lunch and Learn by Matthew Reed and David Elizondo!  Want to go further? Check out Matthew’s blog article!  Video ⬇️  https://t.co/JqHKc9j0Ba  Blog article ⬇️  https://t.co/wJnyJns06n  https://t.co/nPfaB9jPx5,en,['chatgpt'],[],Taking ChatGPT for an Impromptu Spin 🔎  Find out more about #ChatGPT with the video Lunch and Learn by Matthew Reed and David Elizondo!  Want to go further? Check out Matthew’s blog article!  Video ⬇️  https://t.co/JqHKc9j0Ba  Blog article ⬇️  https://t.co/wJnyJns06n  https://t.co/nPfaB9jPx5,"['Taking', 'ChatGPT', 'for', 'an', 'Impromptu', 'Spin', '🔎', 'Find', 'out', 'more', 'about', '#ChatGPT', 'with', 'the', 'video', 'Lunch', 'and', 'Learn', 'by', 'Matthew', 'Reed', 'and', 'David', 'Elizondo', '!', 'Want', 'to', 'go', 'further', '?', 'Check', 'out', 'Matthew', '’', 's', 'blog', 'article', '!', 'Video', '⬇', '️', 'https://t.co/JqHKc9j0Ba', 'Blog', 'article', '⬇', '️', 'https://t.co/wJnyJns06n', 'https://t.co/nPfaB9jPx5']"
1634271674421104640,1634271674421104640,2023-03-11 03:15:05 Malay Peninsula Standard Time,2023-03-11,03:15:05,953085811066482688,一点都不像，哪里像了，你们不要乱说😜  #Huobi  #ChatGPT  https://t.co/SxxemZcrsE,zh,"['huobi', 'chatgpt']",[],"It's not like it at all, it's like it, don't talk 😜 nonsense, #Huobi #ChatGPT https://t.co/SxxemZcrsE","[""It's"", 'not', 'like', 'it', 'at', 'all', ',', ""it's"", 'like', 'it', ',', ""don't"", 'talk', '😜', 'nonsense', ',', '#Huobi', '#ChatGPT', 'https://t.co/SxxemZcrsE']"
1634271673523290112,1634231263845310464,2023-03-11 03:15:04 Malay Peninsula Standard Time,2023-03-11,03:15:04,197152470,@LeoDuffOff 🤣 J’attends l’intégration de #ChatGPT au Tamagoshi 🤔 #amiimaginaire,fr,"['chatgpt', 'amiimaginaire']","[{'screen_name': 'LeoDuffOff', 'name': 'Léo Duff', 'id': '3066028829'}]",🤣 @LeoDuffOff I am waiting for the integration of #ChatGPT in Tamagoshi🤔#amiimaginaire,"['🤣', 'I', 'am', 'waiting', 'for', 'the', 'integration', 'of', '#ChatGPT', 'in', 'Tamagoshi', '🤔', '#amiimaginaire']"
1634271595366699011,1634271595366699008,2023-03-11 03:14:46 Malay Peninsula Standard Time,2023-03-11,03:14:46,1628832207308566531,"#Unilever leverages #ChatGPT to deliver business value “Alex,” short for Alexander the Great powered by ChatGPT, filters emails in Unilever’s Consumer Engagement Center, sorting spam from real consumer messages. Then recommends responses to human agents.  https://t.co/5TfNEONMFZ  https://t.co/ciGvc9QKNu",en,"['unilever', 'chatgpt']",[],"#Unilever leverages #ChatGPT to deliver business value “Alex,” short for Alexander the Great powered by ChatGPT, filters emails in Unilever’s Consumer Engagement Center, sorting spam from real consumer messages. Then recommends responses to human agents.  https://t.co/5TfNEONMFZ  https://t.co/ciGvc9QKNu","['#Unilever', 'leverages', '#ChatGPT', 'to', 'deliver', 'business', 'value', '“', 'Alex', ',', '”', 'short', 'for', 'Alexander', 'the', 'Great', 'powered', 'by', 'ChatGPT', ',', 'filters', 'emails', 'in', 'Unilever', '’', 's', 'Consumer', 'Engagement', 'Center', ',', 'sorting', 'spam', 'from', 'real', 'consumer', 'messages', '.', 'Then', 'recommends', 'responses', 'to', 'human', 'agents', '.', 'https://t.co/5TfNEONMFZ', 'https://t.co/ciGvc9QKNu']"
1634271542845603840,1634271542845603840,2023-03-11 03:14:33 Malay Peninsula Standard Time,2023-03-11,03:14:33,1600509213549252608,#SlightlyOffensive #NoRegurts #OpenAI #AiEntertainment #OpenAIChatGPT #ChatGPT #TheGlory2 #SelectiveOutrage #ChrisRockLive        #ChrisRock       #chrisrocknetflix    Even the Ai has something to say about Will Smith.  https://t.co/MhtL6ZTMzd,en,"['slightlyoffensive', 'noregurts', 'openai', 'aientertainment', 'openaichatgpt', 'chatgpt', 'theglory2', 'selectiveoutrage', 'chrisrocklive', 'chrisrock', 'chrisrocknetflix']",[],#SlightlyOffensive #NoRegurts #OpenAI #AiEntertainment #OpenAIChatGPT #ChatGPT #TheGlory2 #SelectiveOutrage #ChrisRockLive        #ChrisRock       #chrisrocknetflix    Even the Ai has something to say about Will Smith.  https://t.co/MhtL6ZTMzd,"['#SlightlyOffensive', '#NoRegurts', '#OpenAI', '#AiEntertainment', '#OpenAIChatGPT', '#ChatGPT', '#TheGlory2', '#SelectiveOutrage', '#ChrisRockLive', '#ChrisRock', '#chrisrocknetflix', 'Even', 'the', 'Ai', 'has', 'something', 'to', 'say', 'about', 'Will', 'Smith', '.', 'https://t.co/MhtL6ZTMzd']"
1634271508615909389,1634271508615909376,2023-03-11 03:14:25 Malay Peninsula Standard Time,2023-03-11,03:14:25,58439890,Cory presenting a possible way of thinking about #ChatGPT and assessment design in relation to Blooms Taxonomy and #academicintegrity #ICAI2023 @TweetCAI (he does note that this will be debated)  https://t.co/buPbTdGv46,en,"['chatgpt', 'academicintegrity', 'icai2023']",[],Cory presenting a possible way of thinking about #ChatGPT and assessment design in relation to Blooms Taxonomy and #academicintegrity #ICAI2023 @TweetCAI (he does note that this will be debated)  https://t.co/buPbTdGv46,"['Cory', 'presenting', 'a', 'possible', 'way', 'of', 'thinking', 'about', '#ChatGPT', 'and', 'assessment', 'design', 'in', 'relation', 'to', 'Blooms', 'Taxonomy', 'and', '#academicintegrity', '#ICAI2023', '(', 'he', 'does', 'note', 'that', 'this', 'will', 'be', 'debated', ')', 'https://t.co/buPbTdGv46']"
1634271502056198144,1634271502056198144,2023-03-11 03:14:24 Malay Peninsula Standard Time,2023-03-11,03:14:24,1466308810725756935,Download CryptoGPT and farm rewards! Use my code to sign up: 2F7HMNZ   https://t.co/fZG3UzK0fx  #DownloadCryptoGPT #CryptoGPTReferral  #ChatGPT,en,"['downloadcryptogpt', 'cryptogptreferral', 'chatgpt']",[],Download CryptoGPT and farm rewards! Use my code to sign up: 2F7HMNZ   https://t.co/fZG3UzK0fx  #DownloadCryptoGPT #CryptoGPTReferral  #ChatGPT,"['Download', 'CryptoGPT', 'and', 'farm', 'rewards', '!', 'Use', 'my', 'code', 'to', 'sign', 'up', ':', '2F7HMNZ', 'https://t.co/fZG3UzK0fx', '#DownloadCryptoGPT', '#CryptoGPTReferral', '#ChatGPT']"
1634271482095325213,1633851804050915328,2023-03-11 03:14:19 Malay Peninsula Standard Time,2023-03-11,03:14:19,1054156076382334981,Here are some resources that will be of help How to become a Prompt Engineer   https://t.co/wONpJakNOC Learn Prompting  https://t.co/pZN0DcydmA First Prompt Engineer ever hired  https://t.co/2oQz1JF9nb Article on Cohere Docs  https://t.co/PUJhfq4pZY  #AI #ChatGPT #dalle2 #NLP,en,"['ai', 'chatgpt', 'dalle2', 'nlp']",[],Here are some resources that will be of help How to become a Prompt Engineer   https://t.co/wONpJakNOC Learn Prompting  https://t.co/pZN0DcydmA First Prompt Engineer ever hired  https://t.co/2oQz1JF9nb Article on Cohere Docs  https://t.co/PUJhfq4pZY  #AI #ChatGPT #dalle2 #NLP,"['Here', 'are', 'some', 'resources', 'that', 'will', 'be', 'of', 'help', 'How', 'to', 'become', 'a', 'Prompt', 'Engineer', 'https://t.co/wONpJakNOC', 'Learn', 'Prompting', 'https://t.co/pZN0DcydmA', 'First', 'Prompt', 'Engineer', 'ever', 'hired', 'https://t.co/2oQz1JF9nb', 'Article', 'on', 'Cohere', 'Docs', 'https://t.co/PUJhfq4pZY', '#AI', '#ChatGPT', '#dalle2', '#NLP']"
1634271386725240848,1634271386725240832,2023-03-11 03:13:56 Malay Peninsula Standard Time,2023-03-11,03:13:56,68449292,The global generative AI market is expected to be valued at $8B by 2030. Learn how responsibly deployed AI technologies like #ChatGPT can help deliver more intelligent operations to business leaders:  https://t.co/kiK0Puyavx  https://t.co/fdFaM0uLVJ,en,['chatgpt'],[],The global generative AI market is expected to be valued at $8B by 2030. Learn how responsibly deployed AI technologies like #ChatGPT can help deliver more intelligent operations to business leaders:  https://t.co/kiK0Puyavx  https://t.co/fdFaM0uLVJ,"['The', 'global', 'generative', 'AI', 'market', 'is', 'expected', 'to', 'be', 'valued', 'at', '$', '8B', 'by', '2030', '.', 'Learn', 'how', 'responsibly', 'deployed', 'AI', 'technologies', 'like', '#ChatGPT', 'can', 'help', 'deliver', 'more', 'intelligent', 'operations', 'to', 'business', 'leaders', ':', 'https://t.co/kiK0Puyavx', 'https://t.co/fdFaM0uLVJ']"
1634271334707634181,1634271334707634176,2023-03-11 03:13:44 Malay Peninsula Standard Time,2023-03-11,03:13:44,1368738747227861004, https://t.co/lmuPRbfVur  @SouthPark always have their finger on the pulse. Love the new #ChatGPT EP. 😂,en,['chatgpt'],[], https://t.co/lmuPRbfVur  @SouthPark always have their finger on the pulse. Love the new #ChatGPT EP. 😂,"['https://t.co/lmuPRbfVur', 'always', 'have', 'their', 'finger', 'on', 'the', 'pulse', '.', 'Love', 'the', 'new', '#ChatGPT', 'EP', '.', '😂']"
1634271246539010049,1634271246539010048,2023-03-11 03:13:23 Malay Peninsula Standard Time,2023-03-11,03:13:23,747893755,AI integrations aimed at boosting productivity continue to roll off the production line.   .@Grammarly .@SlackHQ .@OpenAI #AI #ChatGPT #Slack #Grammarly  https://t.co/9hbCH8gs1k,en,"['ai', 'chatgpt', 'slack', 'grammarly']",[],AI integrations aimed at boosting productivity continue to roll off the production line.   .@Grammarly .@SlackHQ .@OpenAI #AI #ChatGPT #Slack #Grammarly  https://t.co/9hbCH8gs1k,"['AI', 'integrations', 'aimed', 'at', 'boosting', 'productivity', 'continue', 'to', 'roll', 'off', 'the', 'production', 'line', '.   .  .  .', '#AI', '#ChatGPT', '#Slack', '#Grammarly', 'https://t.co/9hbCH8gs1k']"
1634271197218193408,1634271197218193408,2023-03-11 03:13:11 Malay Peninsula Standard Time,2023-03-11,03:13:11,1563511792915316738,"#MidJourney #OpenAi #GPT #StableDiffusion2 #DallE #ChatGPT join:  https://t.co/rlyimpQw40  #imagine 'Netsuke designed by Jean-Baptiste Monge and Matt Kindt, A Zhangjiajie elven mystic made of translucent jade with translucent flowing iridescent silk fabric, backlit photography…  https://t.co/eKGeklS5Ge",en,"['midjourney', 'openai', 'gpt', 'stablediffusion2', 'dalle', 'chatgpt', 'imagine']",[],"#MidJourney #OpenAi #GPT #StableDiffusion2 #DallE #ChatGPT join:  https://t.co/rlyimpQw40  #imagine 'Netsuke designed by Jean-Baptiste Monge and Matt Kindt, A Zhangjiajie elven mystic made of translucent jade with translucent flowing iridescent silk fabric, backlit photography…  https://t.co/eKGeklS5Ge","['#MidJourney', '#OpenAi', '#GPT', '#StableDiffusion2', '#DallE', '#ChatGPT', 'join', ':', 'https://t.co/rlyimpQw40', '#imagine', ""'"", 'Netsuke', 'designed', 'by', 'Jean-Baptiste', 'Monge', 'and', 'Matt', 'Kindt', ',', 'A', 'Zhangjiajie', 'elven', 'mystic', 'made', 'of', 'translucent', 'jade', 'with', 'translucent', 'flowing', 'iridescent', 'silk', 'fabric', ',', 'backlit', 'photography', '…', 'https://t.co/eKGeklS5Ge']"
1634271189643460608,1634215629225070592,2023-03-11 03:13:09 Malay Peninsula Standard Time,2023-03-11,03:13:09,829935315225751552,@MakadiaHarsh @SaveToNotion #Thread #ChatGPT,qme,"['thread', 'chatgpt']","[{'screen_name': 'MakadiaHarsh', 'name': 'Harsh Makadia', 'id': '555311904'}]",@MakadiaHarsh @SaveToNotion #Thread #ChatGPT,"['#Thread', '#ChatGPT']"
1634271121439707136,1634271121439707136,2023-03-11 03:12:53 Malay Peninsula Standard Time,2023-03-11,03:12:53,870069453723127808,Well that makes #ChatGPT the #SexPanther of the Internet...  https://t.co/d2jgPNJl4L,en,"['chatgpt', 'sexpanther']",[],Well that makes #ChatGPT the #SexPanther of the Internet...  https://t.co/d2jgPNJl4L,"['Well', 'that', 'makes', '#ChatGPT', 'the', '#SexPanther', 'of', 'the', 'Internet', '...', 'https://t.co/d2jgPNJl4L']"
1634271085825871891,1634271085825871872,2023-03-11 03:12:44 Malay Peninsula Standard Time,2023-03-11,03:12:44,57125434,"Hmm #ChatGPT cannot play legal chess.  1 e4 1... e5 2 f4 2... exf4 Nf3 3... g5 d4 4... d5 e5 5... Qe7+ Be2 Be2 is a good move, but unfortunately, it's an illegal move in the current position as your queen is attacking my king on e7.",en,['chatgpt'],[],"Hmm #ChatGPT cannot play legal chess.  1 e4 1... e5 2 f4 2... exf4 Nf3 3... g5 d4 4... d5 e5 5... Qe7+ Be2 Be2 is a good move, but unfortunately, it's an illegal move in the current position as your queen is attacking my king on e7.","['Hmm', '#ChatGPT', 'cannot', 'play', 'legal', 'chess', '.', '1', 'e4', '1', '...', 'e5', '2', 'f4', '2', '...', 'exf', '4', 'Nf3', '3', '...', 'g5', 'd4', '4', '...', 'd5', 'e5', '5', '...', 'Qe7', '+', 'Be2', 'Be2', 'is', 'a', 'good', 'move', ',', 'but', 'unfortunately', ',', ""it's"", 'an', 'illegal', 'move', 'in', 'the', 'current', 'position', 'as', 'your', 'queen', 'is', 'attacking', 'my', 'king', 'on', 'e7', '.']"
1634271038694408193,1634271038694408192,2023-03-11 03:12:33 Malay Peninsula Standard Time,2023-03-11,03:12:33,71197161,Alla fine ho ceduto anche io #GiorgiaMeloni #globoterraqueo #ChatGPT  https://t.co/BGZve21xHg,it,"['giorgiameloni', 'globoterraqueo', 'chatgpt']",[],In the end I also gave in #GiorgiaMeloni #globoterraqueo #ChatGPT https://t.co/BGZve21xHg,"['In', 'the', 'end', 'I', 'also', 'gave', 'in', '#GiorgiaMeloni', '#globoterraqueo', '#ChatGPT', 'https://t.co/BGZve21xHg']"
