id,conversation_id,created_at,date,time,user_id,tweet,language,hashtags,reply_to,translated_text,tokenized_text
1634269695560884225,1634228176502046720,2023-03-11 03:07:13 Malay Peninsula Standard Time,2023-03-11,03:07:13,149570063,"Also um den Tofu für die Bowl zu verwurschteln, hab ich #ChatGpt gefragt und der meinte, mit Soja, Reisessig, Sesamöl, Knobi und Ingwer marinieren und dann braten. Und das schmeckt richtig lecker.  https://t.co/EIauMryF0M",de,['chatgpt'],[],"So to spoil the tofu for the bowl, I asked #ChatGpt and he said, marinate with soy, rice vinegar, sesame oil, garlic and ginger and then fry. And that tastes really delicious.  https://t.co/EIauMryF0M","['So', 'to', 'spoil', 'the', 'tofu', 'for', 'the', 'bowl', ',', 'I', 'asked', '#ChatGpt', 'and', 'he', 'said', ',', 'marinate', 'with', 'soy', ',', 'rice', 'vinegar', ',', 'sesame', 'oil', ',', 'garlic', 'and', 'ginger', 'and', 'then', 'fry', '.', 'And', 'that', 'tastes', 'really', 'delicious', '.', 'https://t.co/EIauMryF0M']"
1634269482800619523,1634269482800619520,2023-03-11 03:06:22 Malay Peninsula Standard Time,2023-03-11,03:06:22,1340102489790660610,LFG!!! #meme #ai #ailaunchpad #cryptolaunchpad #chatgpt #chatgpt3 #ArtificialIntelligence #aiprojects @AIPADTECH  https://t.co/pWV97kwR08,und,"['meme', 'ai', 'ailaunchpad', 'cryptolaunchpad', 'chatgpt', 'chatgpt3', 'artificialintelligence', 'aiprojects']",[],LFG!!! #meme #ai #ailaunchpad #cryptolaunchpad #chatgpt #chatgpt3 #ArtificialIntelligence #aiprojects @AIPADTECH https://t.co/pWV97kwR08,"['LFG', '!', '!', '!', '#meme', '#ai', '#ailaunchpad', '#cryptolaunchpad', '#chatgpt', '#chatgpt3', '#ArtificialIntelligence', '#aiprojects', 'https://t.co/pWV97kwR08']"
1634269475485921281,1634269475485921280,2023-03-11 03:06:20 Malay Peninsula Standard Time,2023-03-11,03:06:20,1599172712362291202,2023/03/11 4:06:20 ChatGPTAPIを使用して、自動的にブログを作るためのノウハウを下記の本にまとめました！ Amazon Unlimitedであれば、無料で読めるので、ぜひよんでください！！   https://t.co/PXK35PT4V0  #AI #プログラミング #ChatGpt #CSharp #ブログ,ja,"['ai', 'プログラミング', 'chatgpt', 'csharp', 'ブログ']",[],"2023/03/11 4:06:20 AM We have compiled the know-how for automatically creating a blog using ChatGPTAPI in the book below! If you are Amazon Unlimited, you can read it for free, so please read it!   https://t.co/PXK35PT4V0 #AI #プログラミング #ChatGpt #CSharp #ブログ","['2023/03', '/', '11', '4:06', ':', '20', 'AM', 'We', 'have', 'compiled', 'the', 'know-how', 'for', 'automatically', 'creating', 'a', 'blog', 'using', 'ChatGPTAPI', 'in', 'the', 'book', 'below', '!', 'If', 'you', 'are', 'Amazon', 'Unlimited', ',', 'you', 'can', 'read', 'it', 'for', 'free', ',', 'so', 'please', 'read', 'it', '!', 'https://t.co/PXK35PT4V0', '#AI', '#プログラミング', '#ChatGpt', '#CSharp', '#ブログ']"
1634269405386342401,1634269405386342400,2023-03-11 03:06:04 Malay Peninsula Standard Time,2023-03-11,03:06:04,63234258,AI is the hottest topic in content creation today. Check out this article on  https://t.co/SqWV70mHUt from OPTIZMO's COO with 4 tips for content creators to start taking advantage of AI. #chatgpt  Council Post: 4 Tips For Content Creators In The Dawn Of AI  https://t.co/5VVcLQYGZe,en,['chatgpt'],[],AI is the hottest topic in content creation today. Check out this article on  https://t.co/SqWV70mHUt from OPTIZMO's COO with 4 tips for content creators to start taking advantage of AI. #chatgpt  Council Post: 4 Tips For Content Creators In The Dawn Of AI  https://t.co/5VVcLQYGZe,"['AI', 'is', 'the', 'hottest', 'topic', 'in', 'content', 'creation', 'today', '.', 'Check', 'out', 'this', 'article', 'on', 'https://t.co/SqWV70mHUt', 'from', ""OPTIZMO's"", 'COO', 'with', '4', 'tips', 'for', 'content', 'creators', 'to', 'start', 'taking', 'advantage', 'of', 'AI', '.', '#chatgpt', 'Council', 'Post', ':', '4', 'Tips', 'For', 'Content', 'Creators', 'In', 'The', 'Dawn', 'Of', 'AI', 'https://t.co/5VVcLQYGZe']"
1634269403259781121,1634269403259781120,2023-03-11 03:06:03 Malay Peninsula Standard Time,2023-03-11,03:06:03,1387310397892427776,#ChatGPT に 株価がレンジ中かトレンド中か判断させるプログラムを書いてもらった #python #CUDA #株  https://t.co/NhTGyrmWzg,ja,"['chatgpt', 'python', 'cuda', '株']",[],#ChatGPT wrote a program to help me determine if a stock price is in a range or trend#python #CUDA #株 https://t.co/NhTGyrmWzg,"['#ChatGPT', 'wrote', 'a', 'program', 'to', 'help', 'me', 'determine', 'if', 'a', 'stock', 'price', 'is', 'in', 'a', 'range', 'or', 'trend', '#python', '#CUDA', '#', '株', 'https://t.co/NhTGyrmWzg']"
1634269396431523844,1634269396431523840,2023-03-11 03:06:02 Malay Peninsula Standard Time,2023-03-11,03:06:02,236830345,Join @HollyClarkEdu and explore the impact of #ChatGPT on writing instruction in schools. From what it is to how we as educators can rethink some writing instruction to help students better show their writing. #BeAnAuthor  Secure your seat at  https://t.co/xCJyZ3GxUf  https://t.co/grQCK7Hn3H,en,"['chatgpt', 'beanauthor']",[],Join @HollyClarkEdu and explore the impact of #ChatGPT on writing instruction in schools. From what it is to how we as educators can rethink some writing instruction to help students better show their writing. #BeAnAuthor  Secure your seat at  https://t.co/xCJyZ3GxUf  https://t.co/grQCK7Hn3H,"['Join', 'and', 'explore', 'the', 'impact', 'of', '#ChatGPT', 'on', 'writing', 'instruction', 'in', 'schools', '.', 'From', 'what', 'it', 'is', 'to', 'how', 'we', 'as', 'educators', 'can', 'rethink', 'some', 'writing', 'instruction', 'to', 'help', 'students', 'better', 'show', 'their', 'writing', '.', '#BeAnAuthor', 'Secure', 'your', 'seat', 'at', 'https://t.co/xCJyZ3GxUf', 'https://t.co/grQCK7Hn3H']"
1634269394007195650,1634269394007195648,2023-03-11 03:06:01 Malay Peninsula Standard Time,2023-03-11,03:06:01,153770747,"There's no denying that #ChatGPT is impressive, but will it end up taking all our jobs? Lucy Bishop looks at the capabilities and limitations of #AI in this fascinating blog 🤖   Read more here 👉   https://t.co/oa2hq1ugKD",en,"['chatgpt', 'ai']",[],"There's no denying that #ChatGPT is impressive, but will it end up taking all our jobs? Lucy Bishop looks at the capabilities and limitations of #AI in this fascinating blog 🤖   Read more here 👉   https://t.co/oa2hq1ugKD","[""There's"", 'no', 'denying', 'that', '#ChatGPT', 'is', 'impressive', ',', 'but', 'will', 'it', 'end', 'up', 'taking', 'all', 'our', 'jobs', '?', 'Lucy', 'Bishop', 'looks', 'at', 'the', 'capabilities', 'and', 'limitations', 'of', '#AI', 'in', 'this', 'fascinating', 'blog', '🤖', 'Read', 'more', 'here', '👉', 'https://t.co/oa2hq1ugKD']"
1634269294812069888,1634269294812069888,2023-03-11 03:05:37 Malay Peninsula Standard Time,2023-03-11,03:05:37,1624397317381160961,ChatGPTにPythonのコーディング上のミスがあるコードの修正依頼 #ChatGPT #AI #Python #コーディングミス #エラーコード  https://t.co/TzkaXNisFX,ja,"['chatgpt', 'ai', 'python', 'コーディングミス', 'エラーコード']",[],Request ChatGPT to fix code with Python coding mistakes #ChatGPT #AI #Python #コーディングミス #エラーコード https://t.co/TzkaXNisFX,"['Request', 'ChatGPT', 'to', 'fix', 'code', 'with', 'Python', 'coding', 'mistakes', '#ChatGPT', '#AI', '#Python', '#コーディングミス', '#エラーコード', 'https://t.co/TzkaXNisFX']"
1634269226088255493,1634269226088255488,2023-03-11 03:05:21 Malay Peninsula Standard Time,2023-03-11,03:05:21,58439890,A reminder from Allyson that #ChatGPT cannot access the Internet (although there are many workarounds) #ICAI2023 #academicintegrity @TweetCAI  https://t.co/3meUNIpAnc,en,"['chatgpt', 'icai2023', 'academicintegrity']",[],A reminder from Allyson that #ChatGPT cannot access the Internet (although there are many workarounds) #ICAI2023 #academicintegrity @TweetCAI  https://t.co/3meUNIpAnc,"['A', 'reminder', 'from', 'Allyson', 'that', '#ChatGPT', 'cannot', 'access', 'the', 'Internet', '(', 'although', 'there', 'are', 'many', 'workarounds', ')', '#ICAI2023', '#academicintegrity', 'https://t.co/3meUNIpAnc']"
1634269197952774144,1633883830170861568,2023-03-11 03:05:14 Malay Peninsula Standard Time,2023-03-11,03:05:14,68571954,"@FelippeRegazio Hoje pedi um código simples para o GPT, um daqueles para calcular DV, ele me entregou uma 1ª versão com erros crassos, eu alertei, veio a 2ª, também com erro e por fim uma versão certa.  Para quem não sabe programar e arquitetar isso é um pesadelo. #ChatGPT #javascript",pt,"['chatgpt', 'javascript']","[{'screen_name': 'FelippeRegazio', 'name': '✪ Felippe', 'id': '927028057763995648'}]","@FelippeRegazio Today I asked for a simple code for GPT, one of those to calculate DV, he gave me a 1st version with crass errors, I warned, came the 2nd, also with error and finally a right version.  For those who do not know how to program and architect this is a nightmare. #ChatGPT #javascript","['Today', 'I', 'asked', 'for', 'a', 'simple', 'code', 'for', 'GPT', ',', 'one', 'of', 'those', 'to', 'calculate', 'DV', ',', 'he', 'gave', 'me', 'a', '1st', 'version', 'with', 'crass', 'errors', ',', 'I', 'warned', ',', 'came', 'the', '2nd', ',', 'also', 'with', 'error', 'and', 'finally', 'a', 'right', 'version', '.', 'For', 'those', 'who', 'do', 'not', 'know', 'how', 'to', 'program', 'and', 'architect', 'this', 'is', 'a', 'nightmare', '.', '#ChatGPT', '#javascript']"
1634269144651628547,1634269144651628544,2023-03-11 03:05:01 Malay Peninsula Standard Time,2023-03-11,03:05:01,54384777,"What does the future of #copyrightlaw look like with the advent of #artificialintelligence, #ChatGPT &amp; other #AI tools? Tune in to the latest episode of @TodayinTech as @KeithShawTekGuy chats with AI expert Lisa Palmer to get the answers!    https://t.co/Jwb1UiDntY #legalissues  https://t.co/YiLxyXGbGD",en,"['copyrightlaw', 'artificialintelligence', 'chatgpt', 'ai', 'legalissues']",[],"What does the future of #copyrightlaw look like with the advent of #artificialintelligence, #ChatGPT &amp; other #AI tools? Tune in to the latest episode of @TodayinTech as @KeithShawTekGuy chats with AI expert Lisa Palmer to get the answers!    https://t.co/Jwb1UiDntY #legalissues  https://t.co/YiLxyXGbGD","['What', 'does', 'the', 'future', 'of', '#copyrightlaw', 'look', 'like', 'with', 'the', 'advent', 'of', '#artificialintelligence', ',', '#ChatGPT', '&', 'other', '#AI', 'tools', '?', 'Tune', 'in', 'to', 'the', 'latest', 'episode', 'of', 'as', 'chats', 'with', 'AI', 'expert', 'Lisa', 'Palmer', 'to', 'get', 'the', 'answers', '!', 'https://t.co/Jwb1UiDntY', '#legalissues', 'https://t.co/YiLxyXGbGD']"
1634269076083077121,1634269076083077120,2023-03-11 03:04:45 Malay Peninsula Standard Time,2023-03-11,03:04:45,873119692352700417,The latest Robotic Surgery Today!!  https://t.co/DFFZ9Dj6sP Thanks to @ndpsr @pierrepinna @DD_NaNa_ #ai #chatgpt,en,"['ai', 'chatgpt']",[],The latest Robotic Surgery Today!!  https://t.co/DFFZ9Dj6sP Thanks to @ndpsr @pierrepinna @DD_NaNa_ #ai #chatgpt,"['The', 'latest', 'Robotic', 'Surgery', 'Today', '!', '!', 'https://t.co/DFFZ9Dj6sP', 'Thanks', 'to', '#ai', '#chatgpt']"
1634269032143638535,1634236646563651584,2023-03-11 03:04:35 Malay Peninsula Standard Time,2023-03-11,03:04:35,163535738,"@TVSanjeev I'm glad I didn't screenshot what #ChatGPT said about your hair and dancing! Mind, you said it all first. :-D",en,['chatgpt'],"[{'screen_name': 'TVSanjeev', 'name': 'Sanjeev Bhaskar💙', 'id': '2296689098'}]","@TVSanjeev I'm glad I didn't screenshot what #ChatGPT said about your hair and dancing! Mind, you said it all first. :-D","[""I'm"", 'glad', 'I', ""didn't"", 'screenshot', 'what', '#ChatGPT', 'said', 'about', 'your', 'hair', 'and', 'dancing', '!', 'Mind', ',', 'you', 'said', 'it', 'all', 'first', '.', ':-D']"
1634268951747149824,1634268951747149824,2023-03-11 03:04:16 Malay Peninsula Standard Time,2023-03-11,03:04:16,1244416836793520128,"Despite #ChatGPT suggestions, I’m retweeting @men_odins content for a week.",en,['chatgpt'],[],"Despite #ChatGPT suggestions, I’m retweeting @men_odins content for a week.","['Despite', '#ChatGPT', 'suggestions', ',', 'I', '’', 'm', 'retweeting', 'content', 'for', 'a', 'week', '.']"
1634268941034962944,1634268941034962944,2023-03-11 03:04:13 Malay Peninsula Standard Time,2023-03-11,03:04:13,378658145,"Io che chiedo a #ChatGPT de: ""La metamorfosi"" di Kakà e lui che mi risponde pure... deve essere un libro che ha letto solo lui 🤔  https://t.co/n8d8AOOebG",it,['chatgpt'],[],"I ask #ChatGPT de: ""The metamorphosis"" of KaKa and he who answers me as well ... It must be a book that only he 🤔 has read https://t.co/n8d8AOOebG","['I', 'ask', '#ChatGPT', 'de', ':', '""', 'The', 'metamorphosis', '""', 'of', 'KaKa', 'and', 'he', 'who', 'answers', 'me', 'as', 'well', '...', 'It', 'must', 'be', 'a', 'book', 'that', 'only', 'he', '🤔', 'has', 'read', 'https://t.co/n8d8AOOebG']"
1634268913750925316,1634268913750925312,2023-03-11 03:04:06 Malay Peninsula Standard Time,2023-03-11,03:04:06,1632685061983068162,🌠Realistic Persons Illustrations🌠  🏆Get that Prompt now!  👉 https://t.co/1DuejepO7u  #AI #AIart #AIArtCommuity #Midjourney #ChatGPT  #AIArtwork #BeautyTeenGirl #Midjourneyart #creator #NFT #NFTarts #GIRLFRIEND #girlskissing #Trending #Girlhot #AIgirl #Artworkทึเม #GenerativeAI  https://t.co/w5TdtPQuCu,en,"['ai', 'aiart', 'aiartcommuity', 'midjourney', 'chatgpt', 'aiartwork', 'beautyteengirl', 'midjourneyart', 'creator', 'nft', 'nftarts', 'girlfriend', 'girlskissing', 'trending', 'girlhot', 'aigirl', 'artworkทึเม', 'generativeai']",[],🌠Realistic Persons Illustrations🌠  🏆Get that Prompt now!  👉 https://t.co/1DuejepO7u  #AI #AIart #AIArtCommuity #Midjourney #ChatGPT  #AIArtwork #BeautyTeenGirl #Midjourneyart #creator #NFT #NFTarts #GIRLFRIEND #girlskissing #Trending #Girlhot #AIgirl #Artworkทึเม #GenerativeAI  https://t.co/w5TdtPQuCu,"['🌠', 'Realistic', 'Persons', 'Illustrations', '🌠', '🏆', 'Get', 'that', 'Prompt', 'now', '!', '👉', 'https://t.co/1DuejepO7u', '#AI', '#AIart', '#AIArtCommuity', '#Midjourney', '#ChatGPT', '#AIArtwork', '#BeautyTeenGirl', '#Midjourneyart', '#creator', '#NFT', '#NFTarts', '#GIRLFRIEND', '#girlskissing', '#Trending', '#Girlhot', '#AIgirl', '#Artworkทึเม', '#GenerativeAI', 'https://t.co/w5TdtPQuCu']"
1634268830263287808,1634268830263287808,2023-03-11 03:03:47 Malay Peninsula Standard Time,2023-03-11,03:03:47,21500964,An agricultural company is building machine learning models to automatically manage farm animals. It's called 'AI-AI-O' #MachineLearning #ChatGPT #agriculture #mcdonalds,en,"['machinelearning', 'chatgpt', 'agriculture', 'mcdonalds']",[],An agricultural company is building machine learning models to automatically manage farm animals. It's called 'AI-AI-O' #MachineLearning #ChatGPT #agriculture #mcdonalds,"['An', 'agricultural', 'company', 'is', 'building', 'machine', 'learning', 'models', 'to', 'automatically', 'manage', 'farm', 'animals', '.', ""It's"", 'called', ""'"", 'AI-AI-O', ""'"", '#MachineLearning', '#ChatGPT', '#agriculture', '#mcdonalds']"
1634268808046051328,1634268808046051328,2023-03-11 03:03:41 Malay Peninsula Standard Time,2023-03-11,03:03:41,252676902,"Let's just call #ChatGPT #Chad. Simpler, easier to say, and has some definitions that are appropriate.",en,"['chatgpt', 'chad']",[],"Let's just call #ChatGPT #Chad. Simpler, easier to say, and has some definitions that are appropriate.","[""Let's"", 'just', 'call', '#ChatGPT', '#Chad', '.', 'Simpler', ',', 'easier', 'to', 'say', ',', 'and', 'has', 'some', 'definitions', 'that', 'are', 'appropriate', '.']"
1634268779873017857,1634268779873017856,2023-03-11 03:03:35 Malay Peninsula Standard Time,2023-03-11,03:03:35,1087118858,"OK, what design thinking tools should I learn how to use or apply?  Read more 👉  https://t.co/aNtJs5K7tK  #desingthinking #AI #ChatGPT #OpenAI  https://t.co/PIaW3kELwF",en,"['desingthinking', 'ai', 'chatgpt', 'openai']",[],"OK, what design thinking tools should I learn how to use or apply?  Read more 👉  https://t.co/aNtJs5K7tK  #desingthinking #AI #ChatGPT #OpenAI  https://t.co/PIaW3kELwF","['OK', ',', 'what', 'design', 'thinking', 'tools', 'should', 'I', 'learn', 'how', 'to', 'use', 'or', 'apply', '?', 'Read', 'more', '👉', 'https://t.co/aNtJs5K7tK', '#desingthinking', '#AI', '#ChatGPT', '#OpenAI', 'https://t.co/PIaW3kELwF']"
1634268717314895872,1634268717314895872,2023-03-11 03:03:20 Malay Peninsula Standard Time,2023-03-11,03:03:20,23032310,"Inspired by a recent @axios piece on AI sermons and hokey space religions, I asked #ChatGPT for a revivalist take on the Jedi Code. Not mad about it.   Apologies in advance, @jackmjenkins.  https://t.co/tRz9c3a7JY",en,['chatgpt'],[],"Inspired by a recent @axios piece on AI sermons and hokey space religions, I asked #ChatGPT for a revivalist take on the Jedi Code. Not mad about it.   Apologies in advance, @jackmjenkins.  https://t.co/tRz9c3a7JY","['Inspired', 'by', 'a', 'recent', 'piece', 'on', 'AI', 'sermons', 'and', 'hokey', 'space', 'religions', ',', 'I', 'asked', '#ChatGPT', 'for', 'a', 'revivalist', 'take', 'on', 'the', 'Jedi', 'Code', '.', 'Not', 'mad', 'about', 'it', '.', 'Apologies', 'in', 'advance', ',', '.', 'https://t.co/tRz9c3a7JY']"
1634268713363947521,1634268713363947520,2023-03-11 03:03:19 Malay Peninsula Standard Time,2023-03-11,03:03:19,368002912,""" A bedtime story for Wendy... "" #SouthPark #DeepLearning #ChatGPT  https://t.co/Lfk8tHvyXR",en,"['southpark', 'deeplearning', 'chatgpt']",[],""" A bedtime story for Wendy... "" #SouthPark #DeepLearning #ChatGPT  https://t.co/Lfk8tHvyXR","['""', 'A', 'bedtime', 'story', 'for', 'Wendy', '...', '""', '#SouthPark', '#DeepLearning', '#ChatGPT', 'https://t.co/Lfk8tHvyXR']"
1634268702299377671,1634268702299377664,2023-03-11 03:03:16 Malay Peninsula Standard Time,2023-03-11,03:03:16,995302600064020480,Introducing your new best friend! 😊  We have announced today the release of our new ChatGPT Features to streamline contract insights and assist with contract recommendations.  Learn more in our press release:  https://t.co/EIOms16lc7  #ChatGPT #AI #Feature #CLM,en,"['chatgpt', 'ai', 'feature', 'clm']",[],Introducing your new best friend! 😊  We have announced today the release of our new ChatGPT Features to streamline contract insights and assist with contract recommendations.  Learn more in our press release:  https://t.co/EIOms16lc7  #ChatGPT #AI #Feature #CLM,"['Introducing', 'your', 'new', 'best', 'friend', '!', '😊', 'We', 'have', 'announced', 'today', 'the', 'release', 'of', 'our', 'new', 'ChatGPT', 'Features', 'to', 'streamline', 'contract', 'insights', 'and', 'assist', 'with', 'contract', 'recommendations', '.', 'Learn', 'more', 'in', 'our', 'press', 'release', ':', 'https://t.co/EIOms16lc7', '#ChatGPT', '#AI', '#Feature', '#CLM']"
1634268615737331726,1634268615737331712,2023-03-11 03:02:55 Malay Peninsula Standard Time,2023-03-11,03:02:55,1240136222980427779,Digging into #ChatGPT with #openAI bc I need life tr o get fun again @elonmusk  https://t.co/FEwEgWB8um,en,"['chatgpt', 'openai']",[],Digging into #ChatGPT with #openAI bc I need life tr o get fun again @elonmusk  https://t.co/FEwEgWB8um,"['Digging', 'into', '#ChatGPT', 'with', '#openAI', 'bc', 'I', 'need', 'life', 'tr', 'o', 'get', 'fun', 'again', 'https://t.co/FEwEgWB8um']"
1634268473902747655,1634268473902747648,2023-03-11 03:02:22 Malay Peninsula Standard Time,2023-03-11,03:02:22,1310896339,"Few press releases are great. Many should be better, no doubt. But they’re not supposed to be works of art, either.  Read the full article: The Reykjavik Press Release—ChatGPT ▸  https://t.co/fsTpm1wkUZ  #ChatGPT #PublicRelations  https://t.co/RjUWtNhERV",en,"['chatgpt', 'publicrelations']",[],"Few press releases are great. Many should be better, no doubt. But they’re not supposed to be works of art, either.  Read the full article: The Reykjavik Press Release—ChatGPT ▸  https://t.co/fsTpm1wkUZ  #ChatGPT #PublicRelations  https://t.co/RjUWtNhERV","['Few', 'press', 'releases', 'are', 'great', '.', 'Many', 'should', 'be', 'better', ',', 'no', 'doubt', '.', 'But', 'they', '’', 're', 'not', 'supposed', 'to', 'be', 'works', 'of', 'art', ',', 'either', '.', 'Read', 'the', 'full', 'article', ':', 'The', 'Reykjavik', 'Press', 'Release', '—', 'ChatGPT', '▸', 'https://t.co/fsTpm1wkUZ', '#ChatGPT', '#PublicRelations', 'https://t.co/RjUWtNhERV']"
1634268459130404864,1633851804050915328,2023-03-11 03:02:18 Malay Peninsula Standard Time,2023-03-11,03:02:18,1054156076382334981,•Develop Your Writing and Communication Skills •Understand How Language Models Work •Practice Creativity •Learn and Understand Technical Skills •Build a Portfolio •Apply for Jobs  #AI #ChatGPT #PromptEngineering  #NLP #dalle2,en,"['ai', 'chatgpt', 'promptengineering', 'nlp', 'dalle2']",[],•Develop Your Writing and Communication Skills •Understand How Language Models Work •Practice Creativity •Learn and Understand Technical Skills •Build a Portfolio •Apply for Jobs  #AI #ChatGPT #PromptEngineering  #NLP #dalle2,"['•', 'Develop', 'Your', 'Writing', 'and', 'Communication', 'Skills', '•', 'Understand', 'How', 'Language', 'Models', 'Work', '•', 'Practice', 'Creativity', '•', 'Learn', 'and', 'Understand', 'Technical', 'Skills', '•', 'Build', 'a', 'Portfolio', '•', 'Apply', 'for', 'Jobs', '#AI', '#ChatGPT', '#PromptEngineering', '#NLP', '#dalle2']"
1634268392898330625,1634268392898330624,2023-03-11 03:02:02 Malay Peninsula Standard Time,2023-03-11,03:02:02,956824109832286208,ChatGPTによると、ひろゆきさんは1年間「内閣総理大臣」だったと出てきますが…正確性には欠けているもののおすすめな使い方があるようです。 @hirox246 #ChatGPT  https://t.co/Qqbi72KPsc,ja,['chatgpt'],[],"According to ChatGPT, Hiroyuki was ""Prime Minister"" for one year... Although it lacks accuracy, there seems to be a recommended usage. @hirox246 #ChatGPT https://t.co/Qqbi72KPsc","['According', 'to', 'ChatGPT', ',', 'Hiroyuki', 'was', '""', 'Prime', 'Minister', '""', 'for', 'one', 'year', '...', 'Although', 'it', 'lacks', 'accuracy', ',', 'there', 'seems', 'to', 'be', 'a', 'recommended', 'usage', '.', '#ChatGPT', 'https://t.co/Qqbi72KPsc']"
1634268391774081037,1634268391774081024,2023-03-11 03:02:02 Malay Peninsula Standard Time,2023-03-11,03:02:02,288967765,💣 Is seems that OpenAI will release GPT4 for Microsoft   https://t.co/f0ciQFh8rY  What do you expect from GPT4?   #microsoft #openai #chatgpt #generativeAI,en,"['microsoft', 'openai', 'chatgpt', 'generativeai']",[],💣 Is seems that OpenAI will release GPT4 for Microsoft   https://t.co/f0ciQFh8rY  What do you expect from GPT4?   #microsoft #openai #chatgpt #generativeAI,"['💣', 'Is', 'seems', 'that', 'OpenAI', 'will', 'release', 'GPT', '4', 'for', 'Microsoft', 'https://t.co/f0ciQFh8rY', 'What', 'do', 'you', 'expect', 'from', 'GPT', '4', '?', '#microsoft', '#openai', '#chatgpt', '#generativeAI']"
1634268382420930561,1634268382420930560,2023-03-11 03:02:00 Malay Peninsula Standard Time,2023-03-11,03:02:00,101107945,.  Examples...  .   #Memes #photo #Blockchain #news #programming #AI #ChatGPT #dataScientist #CyberAttack #hacks #NFT #RETROGAMING #Crypto #Java #Python #setup #javascript  #CyberSecurity  #BigDatA #IOTA #IoT #Hacking #PyTorch #ReactJS #Serverless #photo #Linux #Web3 #CryptoNews  https://t.co/ch2ydRBX7U,en,"['memes', 'photo', 'blockchain', 'news', 'programming', 'ai', 'chatgpt', 'datascientist', 'cyberattack', 'hacks', 'nft', 'retrogaming', 'crypto', 'java', 'python', 'setup', 'javascript', 'cybersecurity', 'bigdata', 'iota', 'iot', 'hacking', 'pytorch', 'reactjs', 'serverless', 'photo', 'linux', 'web3', 'cryptonews']",[],.  Examples...  .   #Memes #photo #Blockchain #news #programming #AI #ChatGPT #dataScientist #CyberAttack #hacks #NFT #RETROGAMING #Crypto #Java #Python #setup #javascript  #CyberSecurity  #BigDatA #IOTA #IoT #Hacking #PyTorch #ReactJS #Serverless #photo #Linux #Web3 #CryptoNews  https://t.co/ch2ydRBX7U,"['.', 'Examples', '...  .', '#Memes', '#photo', '#Blockchain', '#news', '#programming', '#AI', '#ChatGPT', '#dataScientist', '#CyberAttack', '#hacks', '#NFT', '#RETROGAMING', '#Crypto', '#Java', '#Python', '#setup', '#javascript', '#CyberSecurity', '#BigDatA', '#IOTA', '#IoT', '#Hacking', '#PyTorch', '#ReactJS', '#Serverless', '#photo', '#Linux', '#Web3', '#CryptoNews', 'https://t.co/ch2ydRBX7U']"
