id,conversation_id,created_at,date,time,user_id,tweet,language,hashtags,reply_to,translated_text,tokenized_text
1634270980611756035,1634270980611756032,2023-03-11 03:12:19 Malay Peninsula Standard Time,2023-03-11,03:12:19,747500049479929856,"Few press releases are great. Many should be better, no doubt. But they’re not supposed to be works of art, either.  Read the full article: The Reykjavik Press Release—ChatGPT ▸  https://t.co/TdFskObaNE  #ChatGPT #PublicRelations  https://t.co/NQ9Os1EDlg",en,"['chatgpt', 'publicrelations']",[],"Few press releases are great. Many should be better, no doubt. But they’re not supposed to be works of art, either.  Read the full article: The Reykjavik Press Release—ChatGPT ▸  https://t.co/TdFskObaNE  #ChatGPT #PublicRelations  https://t.co/NQ9Os1EDlg","['Few', 'press', 'releases', 'are', 'great', '.', 'Many', 'should', 'be', 'better', ',', 'no', 'doubt', '.', 'But', 'they', '’', 're', 'not', 'supposed', 'to', 'be', 'works', 'of', 'art', ',', 'either', '.', 'Read', 'the', 'full', 'article', ':', 'The', 'Reykjavik', 'Press', 'Release', '—', 'ChatGPT', '▸', 'https://t.co/TdFskObaNE', '#ChatGPT', '#PublicRelations', 'https://t.co/NQ9Os1EDlg']"
1634270968007864321,1634270968007864320,2023-03-11 03:12:16 Malay Peninsula Standard Time,2023-03-11,03:12:16,189386670,"I recently moderated a #ChatGPT panel discussion with @AMANashville &amp; @NashvilleNawbo! I learned so much, so I wanted to share a few tips on how you can use ChatGPT. Check out the key takeaways &amp; @brandmarkdigit1's updated #ChatGPTGuide in my new #blog:  https://t.co/gV6yf8KB5F  https://t.co/3Mi4em8tIy",en,"['chatgpt', 'chatgptguide', 'blog']",[],"I recently moderated a #ChatGPT panel discussion with @AMANashville &amp; @NashvilleNawbo! I learned so much, so I wanted to share a few tips on how you can use ChatGPT. Check out the key takeaways &amp; @brandmarkdigit1's updated #ChatGPTGuide in my new #blog:  https://t.co/gV6yf8KB5F  https://t.co/3Mi4em8tIy","['I', 'recently', 'moderated', 'a', '#ChatGPT', 'panel', 'discussion', 'with', '&', '!', 'I', 'learned', 'so', 'much', ',', 'so', 'I', 'wanted', 'to', 'share', 'a', 'few', 'tips', 'on', 'how', 'you', 'can', 'use', 'ChatGPT', '.', 'Check', 'out', 'the', 'key', 'takeaways', '&', ""'"", 's', 'updated', '#ChatGPTGuide', 'in', 'my', 'new', '#blog', ':', 'https://t.co/gV6yf8KB5F', 'https://t.co/3Mi4em8tIy']"
1634270945962590208,1634270945962590208,2023-03-11 03:12:11 Malay Peninsula Standard Time,2023-03-11,03:12:11,471096635,"Hmm, close enough🥳  Not financial advice™️  #TradingView  #algotrading  #Binance  #Crypto  #Python  #ChatGPT  https://t.co/L27CpAvLPm",en,"['tradingview', 'algotrading', 'binance', 'crypto', 'python', 'chatgpt']",[],"Hmm, close enough🥳  Not financial advice™️  #TradingView  #algotrading  #Binance  #Crypto  #Python  #ChatGPT  https://t.co/L27CpAvLPm","['Hmm', ',', 'close', 'enough', '🥳', 'Not', 'financial', 'advice', '™', '️', '#TradingView', '#algotrading', '#Binance', '#Crypto', '#Python', '#ChatGPT', 'https://t.co/L27CpAvLPm']"
1634270790597201934,1634270790597201920,2023-03-11 03:11:34 Malay Peninsula Standard Time,2023-03-11,03:11:34,1357109082,"I'm building a #SharePoint intranet landing page with the help of #ChatGPT and #Bing! 🤖 Following their suggestions I'm adding events to the landing page 👀 To know more about it make sure you follow my blog, new post will be out on monday  https://t.co/aktTL55H89  https://t.co/zHy9CVsDgx",en,"['sharepoint', 'chatgpt', 'bing']",[],"I'm building a #SharePoint intranet landing page with the help of #ChatGPT and #Bing! 🤖 Following their suggestions I'm adding events to the landing page 👀 To know more about it make sure you follow my blog, new post will be out on monday  https://t.co/aktTL55H89  https://t.co/zHy9CVsDgx","[""I'm"", 'building', 'a', '#SharePoint', 'intranet', 'landing', 'page', 'with', 'the', 'help', 'of', '#ChatGPT', 'and', '#Bing', '!', '🤖', 'Following', 'their', 'suggestions', ""I'm"", 'adding', 'events', 'to', 'the', 'landing', 'page', '👀', 'To', 'know', 'more', 'about', 'it', 'make', 'sure', 'you', 'follow', 'my', 'blog', ',', 'new', 'post', 'will', 'be', 'out', 'on', 'monday', 'https://t.co/aktTL55H89', 'https://t.co/zHy9CVsDgx']"
1634270775510290443,1634270775510290432,2023-03-11 03:11:30 Malay Peninsula Standard Time,2023-03-11,03:11:30,778201280632225792,#ChatGPT blijkt echt intelligent te zijn!!! Het doorziet fakenieuws en geheugenverlies direct.  https://t.co/6BwK2GtYaB,nl,['chatgpt'],[],#ChatGPT turns out to be really intelligent!!! It sees through fake news and amnesia instantly.  https://t.co/6BwK2GtYaB,"['#ChatGPT', 'turns', 'out', 'to', 'be', 'really', 'intelligent', '!', '!', '!', 'It', 'sees', 'through', 'fake', 'news', 'and', 'amnesia', 'instantly', '.', 'https://t.co/6BwK2GtYaB']"
1634270775048916994,1634270775048916992,2023-03-11 03:11:30 Malay Peninsula Standard Time,2023-03-11,03:11:30,20167623,New Post ✨ 𝟰 𝗪𝗮𝘆𝘀 𝘁𝗼 𝗚𝗲𝗻𝗲𝗿𝗮𝘁𝗲 𝗣𝗮𝘀𝘀𝗶𝘃𝗲 𝗜𝗻𝗰𝗼𝗺𝗲 𝗨𝘀𝗶𝗻𝗴 𝗖𝗵𝗮𝘁𝗚𝗣𝗧 Discover how you can leverage ChatGPT to generate passive income.  https://t.co/6aspmUIa0I  #chatgpt #income #passiveincome,en,"['chatgpt', 'income', 'passiveincome']",[],New Post ✨ 𝟰 𝗪𝗮𝘆𝘀 𝘁𝗼 𝗚𝗲𝗻𝗲𝗿𝗮𝘁𝗲 𝗣𝗮𝘀𝘀𝗶𝘃𝗲 𝗜𝗻𝗰𝗼𝗺𝗲 𝗨𝘀𝗶𝗻𝗴 𝗖𝗵𝗮𝘁𝗚𝗣𝗧 Discover how you can leverage ChatGPT to generate passive income.  https://t.co/6aspmUIa0I  #chatgpt #income #passiveincome,"['New', 'Post', '✨', '𝟰', '𝗪𝗮𝘆𝘀', '𝘁𝗼', '𝗚𝗲𝗻𝗲𝗿𝗮𝘁𝗲', '𝗣𝗮𝘀𝘀𝗶𝘃𝗲', '𝗜𝗻𝗰𝗼𝗺𝗲', '𝗨𝘀𝗶𝗻𝗴', '𝗖𝗵𝗮𝘁𝗚𝗣𝗧', 'Discover', 'how', 'you', 'can', 'leverage', 'ChatGPT', 'to', 'generate', 'passive', 'income', '.', 'https://t.co/6aspmUIa0I', '#chatgpt', '#income', '#passiveincome']"
1634270737048678401,1634270737048678400,2023-03-11 03:11:21 Malay Peninsula Standard Time,2023-03-11,03:11:21,97092525,My mastery of meme culture and generative AI are both pretty weak. This is kryptonite.  https://t.co/t46Q4oCONs #Waluigi #ChatGPT,en,"['waluigi', 'chatgpt']",[],My mastery of meme culture and generative AI are both pretty weak. This is kryptonite.  https://t.co/t46Q4oCONs #Waluigi #ChatGPT,"['My', 'mastery', 'of', 'meme', 'culture', 'and', 'generative', 'AI', 'are', 'both', 'pretty', 'weak', '.', 'This', 'is', 'kryptonite', '.', 'https://t.co/t46Q4oCONs', '#Waluigi', '#ChatGPT']"
1634270724398391298,1634270724398391296,2023-03-11 03:11:18 Malay Peninsula Standard Time,2023-03-11,03:11:18,2842083453,It’s very funny when you log in ChatGPT you have to confirm that you are human #ai #ChatGPT,en,"['ai', 'chatgpt']",[],It’s very funny when you log in ChatGPT you have to confirm that you are human #ai #ChatGPT,"['It', '’', 's', 'very', 'funny', 'when', 'you', 'log', 'in', 'ChatGPT', 'you', 'have', 'to', 'confirm', 'that', 'you', 'are', 'human', '#ai', '#ChatGPT']"
1634270691569684489,1634270691569684480,2023-03-11 03:11:10 Malay Peninsula Standard Time,2023-03-11,03:11:10,1145261792685375488,The World Will Change NEXT WEEK...  GPT-4 which is 500 Times More powerful than the current #ChatGPT will be Released next week.  The current version of ChatGPT is built on GPT 3.5 with 175 Billion Machine Learning Parameters.  But GPT-4 has 100 TRILLION… https://t.co/Ys2FehoIif,en,['chatgpt'],[],The World Will Change NEXT WEEK...  GPT-4 which is 500 Times More powerful than the current #ChatGPT will be Released next week.  The current version of ChatGPT is built on GPT 3.5 with 175 Billion Machine Learning Parameters.  But GPT-4 has 100 TRILLION… https://t.co/Ys2FehoIif,"['The', 'World', 'Will', 'Change', 'NEXT', 'WEEK', '...', 'GPT', '-', '4', 'which', 'is', '500', 'Times', 'More', 'powerful', 'than', 'the', 'current', '#ChatGPT', 'will', 'be', 'Released', 'next', 'week', '.', 'The', 'current', 'version', 'of', 'ChatGPT', 'is', 'built', 'on', 'GPT', '3.5', 'with', '175', 'Billion', 'Machine', 'Learning', 'Parameters', '.', 'But', 'GPT', '-', '4', 'has', '100', 'TRILLION', '…', 'https://t.co/Ys2FehoIif']"
1634270647684669443,1634270647684669440,2023-03-11 03:11:00 Malay Peninsula Standard Time,2023-03-11,03:11:00,58439890,Cory recommending that we use cognitive offloading techniques when we think about #ChatGPT #artificialintelligence and #academicintegrity #ICAI2023 @TweetCAI  https://t.co/6Zq4obXc1q,en,"['chatgpt', 'artificialintelligence', 'academicintegrity', 'icai2023']",[],Cory recommending that we use cognitive offloading techniques when we think about #ChatGPT #artificialintelligence and #academicintegrity #ICAI2023 @TweetCAI  https://t.co/6Zq4obXc1q,"['Cory', 'recommending', 'that', 'we', 'use', 'cognitive', 'offloading', 'techniques', 'when', 'we', 'think', 'about', '#ChatGPT', '#artificialintelligence', 'and', '#academicintegrity', '#ICAI2023', 'https://t.co/6Zq4obXc1q']"
1634270390779367424,1634270390779367424,2023-03-11 03:09:59 Malay Peninsula Standard Time,2023-03-11,03:09:59,812402819198160897,#裏アカ男子 変なロボット🤖たくさん作ろ🥴  #ChatGPT  https://t.co/rkstfWPqcm,ja,"['裏アカ男子', 'chatgpt']",[],#裏アカ男子 Make 🥴 a lot of weird robots 🤖 #ChatGPT https://t.co/rkstfWPqcm,"['#裏アカ男子', 'Make', '🥴', 'a', 'lot', 'of', 'weird', 'robots', '🤖', '#ChatGPT', 'https://t.co/rkstfWPqcm']"
1634270353026437136,1634270353026437120,2023-03-11 03:09:50 Malay Peninsula Standard Time,2023-03-11,03:09:50,49860518,How much has changed since I wrote AI in the World: How can we prepare our students?  https://t.co/3vbkCiD7JG via @Getting_Smart #education #AI #chatgpt #artificialintelligence #edtech,en,"['education', 'ai', 'chatgpt', 'artificialintelligence', 'edtech']",[],How much has changed since I wrote AI in the World: How can we prepare our students?  https://t.co/3vbkCiD7JG via @Getting_Smart #education #AI #chatgpt #artificialintelligence #edtech,"['How', 'much', 'has', 'changed', 'since', 'I', 'wrote', 'AI', 'in', 'the', 'World', ':', 'How', 'can', 'we', 'prepare', 'our', 'students', '?', 'https://t.co/3vbkCiD7JG', 'via', '#education', '#AI', '#chatgpt', '#artificialintelligence', '#edtech']"
1634270293823836172,1634270293823836160,2023-03-11 03:09:35 Malay Peninsula Standard Time,2023-03-11,03:09:35,1624405610656681985,I think I found my best friend who helps me with error. I was looking for a day to solve it :) and #chatgpt get this done in sec #SwiftUI #AI  https://t.co/NNWo8qxZBf,en,"['chatgpt', 'swiftui', 'ai']",[],I think I found my best friend who helps me with error. I was looking for a day to solve it :) and #chatgpt get this done in sec #SwiftUI #AI  https://t.co/NNWo8qxZBf,"['I', 'think', 'I', 'found', 'my', 'best', 'friend', 'who', 'helps', 'me', 'with', 'error', '.', 'I', 'was', 'looking', 'for', 'a', 'day', 'to', 'solve', 'it', ':)', 'and', '#chatgpt', 'get', 'this', 'done', 'in', 'sec', '#SwiftUI', '#AI', 'https://t.co/NNWo8qxZBf']"
1634270245677301760,1634270245677301760,2023-03-11 03:09:24 Malay Peninsula Standard Time,2023-03-11,03:09:24,21450044,I finally got around to making the video about the drawbacks of #ChatGPT for librarians. Only using ChatGPT to write the script and running it through @synthesiaIO to make a video. All made with AI  https://t.co/sZU2CSn8EA,en,['chatgpt'],[],I finally got around to making the video about the drawbacks of #ChatGPT for librarians. Only using ChatGPT to write the script and running it through @synthesiaIO to make a video. All made with AI  https://t.co/sZU2CSn8EA,"['I', 'finally', 'got', 'around', 'to', 'making', 'the', 'video', 'about', 'the', 'drawbacks', 'of', '#ChatGPT', 'for', 'librarians', '.', 'Only', 'using', 'ChatGPT', 'to', 'write', 'the', 'script', 'and', 'running', 'it', 'through', 'to', 'make', 'a', 'video', '.', 'All', 'made', 'with', 'AI', 'https://t.co/sZU2CSn8EA']"
1634270237494333449,1634270237494333440,2023-03-11 03:09:22 Malay Peninsula Standard Time,2023-03-11,03:09:22,52819330,"Um pouco mais sobre minha palestra no #ENASTIC, no Ministerio Publico Do Estado Da Bahia, falando sobre o #ChatGPT.  https://t.co/PtlDnxwPuT",pt,"['enastic', 'chatgpt']",[],"A little more about my talk at #ENASTIC, at the Ministerio Publico Do Estado Da Bahia, talking about the #ChatGPT.  https://t.co/PtlDnxwPuT","['A', 'little', 'more', 'about', 'my', 'talk', 'at', '#ENASTIC', ',', 'at', 'the', 'Ministerio', 'Publico', 'Do', 'Estado', 'Da', 'Bahia', ',', 'talking', 'about', 'the', '#ChatGPT', '.', 'https://t.co/PtlDnxwPuT']"
1634270165033680896,1634270165033680896,2023-03-11 03:09:05 Malay Peninsula Standard Time,2023-03-11,03:09:05,259473191,"I am totally going to ask #ChatGPT about Other Sallys. It’s how I’ve lived a happy life, knowing every decision I worried over, another Sally has made the other choice &amp; is living that adventure! Congrats to the ones that chose Harvard! Happy days to those that still have Dad! ❤️",en,['chatgpt'],[],"I am totally going to ask #ChatGPT about Other Sallys. It’s how I’ve lived a happy life, knowing every decision I worried over, another Sally has made the other choice &amp; is living that adventure! Congrats to the ones that chose Harvard! Happy days to those that still have Dad! ❤️","['I', 'am', 'totally', 'going', 'to', 'ask', '#ChatGPT', 'about', 'Other', 'Sallys', '.', 'It', '’', 's', 'how', 'I', '’', 've', 'lived', 'a', 'happy', 'life', ',', 'knowing', 'every', 'decision', 'I', 'worried', 'over', ',', 'another', 'Sally', 'has', 'made', 'the', 'other', 'choice', '&', 'is', 'living', 'that', 'adventure', '!', 'Congrats', 'to', 'the', 'ones', 'that', 'chose', 'Harvard', '!', 'Happy', 'days', 'to', 'those', 'that', 'still', 'have', 'Dad', '!', '❤', '️']"
1634270162269470722,1634270158469451776,2023-03-11 03:09:04 Malay Peninsula Standard Time,2023-03-11,03:09:04,1046287434542141441,"#ChatGPT: ""Eu acho que isso significa que nós somos amigos."" 2/2  https://t.co/h8FvsfrcDY",pt,['chatgpt'],[],"#ChatGPT, ""I think that means we're friends."" 2/2 https://t.co/h8FvsfrcDY","['#ChatGPT', ',', '""', 'I', 'think', 'that', 'means', ""we're"", 'friends', '.', '""', '2/2', 'https://t.co/h8FvsfrcDY']"
1634270158469451776,1634270158469451776,2023-03-11 03:09:03 Malay Peninsula Standard Time,2023-03-11,03:09:03,1046287434542141441,Fiz amizade com o #Bing #ChatGPT ao discutir sobre inteligência.  1/2  https://t.co/4L2PA98nlf,pt,"['bing', 'chatgpt']",[],I befriended #Bing #ChatGPT when discussing intelligence.  1/2 https://t.co/4L2PA98nlf,"['I', 'befriended', '#Bing', '#ChatGPT', 'when', 'discussing', 'intelligence', '.', '1/2', 'https://t.co/4L2PA98nlf']"
1634270143000858627,1634270143000858624,2023-03-11 03:09:00 Malay Peninsula Standard Time,2023-03-11,03:09:00,1590754767344746496,#ChatGPT lügt schon im zweiten Satz🤪  https://t.co/kuL0GBQy8j,de,['chatgpt'],[],#ChatGPT is already lying in the second set🤪 https://t.co/kuL0GBQy8j,"['#ChatGPT', 'is', 'already', 'lying', 'in', 'the', 'second', 'set', '🤪', 'https://t.co/kuL0GBQy8j']"
1634270139020451841,1634270139020451840,2023-03-11 03:08:59 Malay Peninsula Standard Time,2023-03-11,03:08:59,223922788,Blue couple - Rarible | Rarible  #AIartistclub #AIart #AIartist #RhythmicalNFT #knft #opensea #Midjourney #ChatGPT #midjourneyAi #AIArtCommuity #Crypto #NFTs #stablediffusion #AI #color #NovelAI #CivitAI #bitcoin #NFT #NFTC #RariGang #metaverse #art #paint  https://t.co/KPB3Wz8AAE,en,"['aiartistclub', 'aiart', 'aiartist', 'rhythmicalnft', 'knft', 'opensea', 'midjourney', 'chatgpt', 'midjourneyai', 'aiartcommuity', 'crypto', 'nfts', 'stablediffusion', 'ai', 'color', 'novelai', 'civitai', 'bitcoin', 'nft', 'nftc', 'rarigang', 'metaverse', 'art', 'paint']",[],Blue couple - Rarible | Rarible  #AIartistclub #AIart #AIartist #RhythmicalNFT #knft #opensea #Midjourney #ChatGPT #midjourneyAi #AIArtCommuity #Crypto #NFTs #stablediffusion #AI #color #NovelAI #CivitAI #bitcoin #NFT #NFTC #RariGang #metaverse #art #paint  https://t.co/KPB3Wz8AAE,"['Blue', 'couple', '-', 'Rarible', '|', 'Rarible', '#AIartistclub', '#AIart', '#AIartist', '#RhythmicalNFT', '#knft', '#opensea', '#Midjourney', '#ChatGPT', '#midjourneyAi', '#AIArtCommuity', '#Crypto', '#NFTs', '#stablediffusion', '#AI', '#color', '#NovelAI', '#CivitAI', '#bitcoin', '#NFT', '#NFTC', '#RariGang', '#metaverse', '#art', '#paint', 'https://t.co/KPB3Wz8AAE']"
1634270103414923265,1634270103414923264,2023-03-11 03:08:50 Malay Peninsula Standard Time,2023-03-11,03:08:50,1529076301126066177,"The slowest mammal on Earth is the sloth, which can move at a maximum speed of 6 meters per hour.  #ChatGPT",en,['chatgpt'],[],"The slowest mammal on Earth is the sloth, which can move at a maximum speed of 6 meters per hour.  #ChatGPT","['The', 'slowest', 'mammal', 'on', 'Earth', 'is', 'the', 'sloth', ',', 'which', 'can', 'move', 'at', 'a', 'maximum', 'speed', 'of', '6', 'meters', 'per', 'hour', '.', '#ChatGPT']"
1634270087866613762,1634270087866613760,2023-03-11 03:08:46 Malay Peninsula Standard Time,2023-03-11,03:08:46,914164356170084354,Fortalezas y debilidades de ChatGPT en el aula  https://t.co/MqWikhb2o4 #educación #ChatGPT #IA #AI,es,"['educación', 'chatgpt', 'ia', 'ai']",[],ChatGPT's strengths and weaknesses in the classroom https://t.co/MqWikhb2o4 #educación #ChatGPT #IA #AI,"[""ChatGPT's"", 'strengths', 'and', 'weaknesses', 'in', 'the', 'classroom', 'https://t.co/MqWikhb2o4', '#educación', '#ChatGPT', '#IA', '#AI']"
1634269950545219595,1634269950545219584,2023-03-11 03:08:14 Malay Peninsula Standard Time,2023-03-11,03:08:14,1456671128,"Ukitengeneza content na AI mfano #ChatGPT .  Kuna AI detectors, inatambua kuwa hii content imetengenezwa na AI na sio binadamu.  Hivi ndio unaweza fanya kuiDanganya AI detector 😂👇  https://t.co/r0zY75Jofo",in,['chatgpt'],[],"If you create content and AI e.g. #ChatGPT .  There are AI detectors, it recognizes that this content is made by AI and not humans.  Here's what you can do to trick AI detector 😂👇 https://t.co/r0zY75Jofo","['If', 'you', 'create', 'content', 'and', 'AI', 'e', '.', 'g', '.', '#ChatGPT', '.', 'There', 'are', 'AI', 'detectors', ',', 'it', 'recognizes', 'that', 'this', 'content', 'is', 'made', 'by', 'AI', 'and', 'not', 'humans', '.', ""Here's"", 'what', 'you', 'can', 'do', 'to', 'trick', 'AI', 'detector', '😂', '👇', 'https://t.co/r0zY75Jofo']"
1634269939392544768,1634269939392544768,2023-03-11 03:08:11 Malay Peninsula Standard Time,2023-03-11,03:08:11,100650547,¿Puede una IA dar mi clase? Lo que seguro que no podrá hacer es hablar de cuestiones tan complejas de forma tan amena y con tanto sentido del humor como @ftsaez 👏🏻👏🏻👏🏻 #JornadasDifusion2023 #ELE #IA #ChatGPT  https://t.co/ttOB4sMIvj,es,"['jornadasdifusion2023', 'ele', 'ia', 'chatgpt']",[],Can an AI teach my class? What you surely will not be able to do is talk about such complex issues in such a pleasant way and with as much sense of humor as @ftsaez 👏🏻👏🏻👏🏻 #JornadasDifusion2023 #ELE #IA #ChatGPT https://t.co/ttOB4sMIvj,"['Can', 'an', 'AI', 'teach', 'my', 'class', '?', 'What', 'you', 'surely', 'will', 'not', 'be', 'able', 'to', 'do', 'is', 'talk', 'about', 'such', 'complex', 'issues', 'in', 'such', 'a', 'pleasant', 'way', 'and', 'with', 'as', 'much', 'sense', 'of', 'humor', 'as', '👏🏻', '👏🏻', '👏🏻', '#JornadasDifusion2023', '#ELE', '#IA', '#ChatGPT', 'https://t.co/ttOB4sMIvj']"
1634269918601388033,1634269918601388032,2023-03-11 03:08:06 Malay Peninsula Standard Time,2023-03-11,03:08:06,21450044,I finally got around to making the video about the benefits of #ChatGPT for librarians. Only using ChatGPT to write the script and running it through @synthesiaIO to make a video. All made with AI  https://t.co/MswerQV77F,en,['chatgpt'],[],I finally got around to making the video about the benefits of #ChatGPT for librarians. Only using ChatGPT to write the script and running it through @synthesiaIO to make a video. All made with AI  https://t.co/MswerQV77F,"['I', 'finally', 'got', 'around', 'to', 'making', 'the', 'video', 'about', 'the', 'benefits', 'of', '#ChatGPT', 'for', 'librarians', '.', 'Only', 'using', 'ChatGPT', 'to', 'write', 'the', 'script', 'and', 'running', 'it', 'through', 'to', 'make', 'a', 'video', '.', 'All', 'made', 'with', 'AI', 'https://t.co/MswerQV77F']"
1634269901442412547,1634269901442412544,2023-03-11 03:08:02 Malay Peninsula Standard Time,2023-03-11,03:08:02,1536103471,"Nvidia CEO Jensen Huang’s big bet on #AI is paying off  💡 Tech companies scrambling to compete with #ChatGPT are publicly boasting about how many of Nvidia’s roughly $10,000 'A100s' they have. The supercomputer developed for OpenAI used 10,000 of them.    https://t.co/ldvYtIZCFV  https://t.co/CYW9mQzpHV",en,"['ai', 'chatgpt']",[],"Nvidia CEO Jensen Huang’s big bet on #AI is paying off  💡 Tech companies scrambling to compete with #ChatGPT are publicly boasting about how many of Nvidia’s roughly $10,000 'A100s' they have. The supercomputer developed for OpenAI used 10,000 of them.    https://t.co/ldvYtIZCFV  https://t.co/CYW9mQzpHV","['Nvidia', 'CEO', 'Jensen', 'Huang', '’', 's', 'big', 'bet', 'on', '#AI', 'is', 'paying', 'off', '💡', 'Tech', 'companies', 'scrambling', 'to', 'compete', 'with', '#ChatGPT', 'are', 'publicly', 'boasting', 'about', 'how', 'many', 'of', 'Nvidia', '’', 's', 'roughly', '$', '10,000', ""'"", 'A100s', ""'"", 'they', 'have', '.', 'The', 'supercomputer', 'developed', 'for', 'OpenAI', 'used', '10,000', 'of', 'them', '.', 'https://t.co/ldvYtIZCFV', 'https://t.co/CYW9mQzpHV']"
1634269879539752962,1633942719834869760,2023-03-11 03:07:57 Malay Peninsula Standard Time,2023-03-11,03:07:57,716535344330575872,"@Ic3cAk3 Die Erfahrung habe ich auch gemacht, Aussagen von #ChatGPT im nächsten Prompt eingeben und nach Details fragen, manchmal korrigiert er sich dann selbst.",de,['chatgpt'],"[{'screen_name': 'Ic3cAk3', 'name': 'Herr Tim (Johannes Süsens)', 'id': '49433047'}]","@Ic3cAk3 I have also had the experience, entering statements from #ChatGPT in the next prompt and asking for details, sometimes he corrects himself.","['I', 'have', 'also', 'had', 'the', 'experience', ',', 'entering', 'statements', 'from', '#ChatGPT', 'in', 'the', 'next', 'prompt', 'and', 'asking', 'for', 'details', ',', 'sometimes', 'he', 'corrects', 'himself', '.']"
1634269787374211086,1634269787374211072,2023-03-11 03:07:35 Malay Peninsula Standard Time,2023-03-11,03:07:35,901782234159431680,#ChatGPT damn 😂  https://t.co/NJHbXjr3KF,en,['chatgpt'],[],#ChatGPT damn 😂  https://t.co/NJHbXjr3KF,"['#ChatGPT', 'damn', '😂', 'https://t.co/NJHbXjr3KF']"
1634269778847363072,1634269778847363072,2023-03-11 03:07:33 Malay Peninsula Standard Time,2023-03-11,03:07:33,1624397317381160961,ChatGPTによるPythonコードのミス修正と訂正箇所の提示 #ChatGPT #AI #Python #コードミス #修正 #訂正  https://t.co/hsHDXodkE0,ja,"['chatgpt', 'ai', 'python', 'コードミス', '修正', '訂正']",[],Fixing Python Code Mistakes and Correcting with ChatGPT #ChatGPT #AI #Python #コードミス #修正 #訂正 https://t.co/hsHDXodkE0,"['Fixing', 'Python', 'Code', 'Mistakes', 'and', 'Correcting', 'with', 'ChatGPT', '#ChatGPT', '#AI', '#Python', '#コードミス', '#修正', '#訂正', 'https://t.co/hsHDXodkE0']"
1634269729044025348,1634269729044025344,2023-03-11 03:07:21 Malay Peninsula Standard Time,2023-03-11,03:07:21,331789760,The importance of this #ChatGPT conversation should not be overlooked. SBVR is a language standard. Alek tried to get ChatGPT to say language standards are not important. ChatGPT refused. Do you think it has been engineered with *rules* against saying that?! @alkoslaw,en,['chatgpt'],[],The importance of this #ChatGPT conversation should not be overlooked. SBVR is a language standard. Alek tried to get ChatGPT to say language standards are not important. ChatGPT refused. Do you think it has been engineered with *rules* against saying that?! @alkoslaw,"['The', 'importance', 'of', 'this', '#ChatGPT', 'conversation', 'should', 'not', 'be', 'overlooked', '.', 'SBVR', 'is', 'a', 'language', 'standard', '.', 'Alek', 'tried', 'to', 'get', 'ChatGPT', 'to', 'say', 'language', 'standards', 'are', 'not', 'important', '.', 'ChatGPT', 'refused', '.', 'Do', 'you', 'think', 'it', 'has', 'been', 'engineered', 'with', '*', 'rules', '*', 'against', 'saying', 'that', '?', '!']"
1634269718491156487,1633709311124983808,2023-03-11 03:07:18 Malay Peninsula Standard Time,2023-03-11,03:07:18,931974804802101253,"@Caroline_Hof @it__security mich wundert dieser niedriger Anteil von 10 %. Ich hätte mindestens 20 - 30 % erwartet, weil eben mit #chatgpt das Texteschreiben jetzt so richtig losgeht, und da ist #content #marketing wohl die erste Branche, die das systematisiert nutzen kann.👍",de,"['chatgpt', 'content', 'marketing']","[{'screen_name': 'Caroline_Hof', 'name': 'Caroline Hof', 'id': '2784692113'}, {'screen_name': 'it__security', 'name': 'it security', 'id': '284489137'}]","@Caroline_Hof @it__security I am surprised by this low proportion of 10%. I would have expected at least 20 - 30%, because with #chatgpt text writing is now really starting, and #content #marketing is probably the first industry that can use this systematically. 👍","['I', 'am', 'surprised', 'by', 'this', 'low', 'proportion', 'of', '10', '%', '.', 'I', 'would', 'have', 'expected', 'at', 'least', '20', '-', '30', '%', ',', 'because', 'with', '#chatgpt', 'text', 'writing', 'is', 'now', 'really', 'starting', ',', 'and', '#content', '#marketing', 'is', 'probably', 'the', 'first', 'industry', 'that', 'can', 'use', 'this', 'systematically', '.', '👍']"
