id,conversation_id,created_at,date,time,user_id,tweet,language,hashtags,reply_to,translated_text,tokenized_text
1634274378346004482,1634274378346004480,2023-03-11 03:25:49 Malay Peninsula Standard Time,2023-03-11,03:25:49,1015246770425786368,Today's #SuperDataScience #FiveMinuteFriday episode details five ways Data Scientists can leverage #ChatGPT to work more efficiently and creatively.   Watch here:  https://t.co/mwbbted6fS  https://t.co/6zOsOrIWiJ,en,"['superdatascience', 'fiveminutefriday', 'chatgpt']",[],Today's #SuperDataScience #FiveMinuteFriday episode details five ways Data Scientists can leverage #ChatGPT to work more efficiently and creatively.   Watch here:  https://t.co/mwbbted6fS  https://t.co/6zOsOrIWiJ,"[""Today's"", '#SuperDataScience', '#FiveMinuteFriday', 'episode', 'details', 'five', 'ways', 'Data', 'Scientists', 'can', 'leverage', '#ChatGPT', 'to', 'work', 'more', 'efficiently', 'and', 'creatively', '.', 'Watch', 'here', ':', 'https://t.co/mwbbted6fS', 'https://t.co/6zOsOrIWiJ']"
1634274250797219840,1634274250797219840,2023-03-11 03:25:19 Malay Peninsula Standard Time,2023-03-11,03:25:19,258374854,"""Given the #amorality, #fauxscience and #linguistic #incompetence of these systems, we can only laugh or cry at their popularity."" Noam #Chomsky: The False Promise of #ChatGPT  https://t.co/shMoFlsVfl",en,"['amorality', 'fauxscience', 'linguistic', 'incompetence', 'chomsky', 'chatgpt']",[],"""Given the #amorality, #fauxscience and #linguistic #incompetence of these systems, we can only laugh or cry at their popularity."" Noam #Chomsky: The False Promise of #ChatGPT  https://t.co/shMoFlsVfl","['""', 'Given', 'the', '#amorality', ',', '#fauxscience', 'and', '#linguistic', '#incompetence', 'of', 'these', 'systems', ',', 'we', 'can', 'only', 'laugh', 'or', 'cry', 'at', 'their', 'popularity', '.', '""', 'Noam', '#Chomsky', ':', 'The', 'False', 'Promise', 'of', '#ChatGPT', 'https://t.co/shMoFlsVfl']"
1634274247466991617,1634274247466991616,2023-03-11 03:25:18 Malay Peninsula Standard Time,2023-03-11,03:25:18,538858382,"In the era of #chatGPT and artificial intelligence tools which make real life look like science fiction, Google Translator still writes ""Mejor,"" to conclude an email when you write ""Best,"".",en,['chatgpt'],[],"In the era of #chatGPT and artificial intelligence tools which make real life look like science fiction, Google Translator still writes ""Mejor,"" to conclude an email when you write ""Best,"".","['In', 'the', 'era', 'of', '#chatGPT', 'and', 'artificial', 'intelligence', 'tools', 'which', 'make', 'real', 'life', 'look', 'like', 'science', 'fiction', ',', 'Google', 'Translator', 'still', 'writes', '""', 'Mejor', ',', '""', 'to', 'conclude', 'an', 'email', 'when', 'you', 'write', '""', 'Best', ',', '""', '.']"
1634274241532121107,1634274241532121088,2023-03-11 03:25:17 Malay Peninsula Standard Time,2023-03-11,03:25:17,1374529934278893572,The #Top 4 #Examples Of How #ChatGPT Can Be Used In #Telecom  https://t.co/TXAHRQRVDq #communication #telecoms #telephony,en,"['top', 'examples', 'chatgpt', 'telecom', 'communication', 'telecoms', 'telephony']",[],The #Top 4 #Examples Of How #ChatGPT Can Be Used In #Telecom  https://t.co/TXAHRQRVDq #communication #telecoms #telephony,"['The', '#Top', '4', '#Examples', 'Of', 'How', '#ChatGPT', 'Can', 'Be', 'Used', 'In', '#Telecom', 'https://t.co/TXAHRQRVDq', '#communication', '#telecoms', '#telephony']"
1634274148863340544,1634274148863340544,2023-03-11 03:24:55 Malay Peninsula Standard Time,2023-03-11,03:24:55,1608193907656982532,What service do you use to watch live sports? I highly recommend Joyful IPTV.  #projectmanagement #crew6 #chatgpt #zenswimmer #stevesmith #procurement #londrabi #muslimidentity #abtaholidayquiz #bountifulutah #websiteperformance  https://t.co/7YwXIGSlPn,en,"['projectmanagement', 'crew6', 'chatgpt', 'zenswimmer', 'stevesmith', 'procurement', 'londrabi', 'muslimidentity', 'abtaholidayquiz', 'bountifulutah', 'websiteperformance']",[],What service do you use to watch live sports? I highly recommend Joyful IPTV.  #projectmanagement #crew6 #chatgpt #zenswimmer #stevesmith #procurement #londrabi #muslimidentity #abtaholidayquiz #bountifulutah #websiteperformance  https://t.co/7YwXIGSlPn,"['What', 'service', 'do', 'you', 'use', 'to', 'watch', 'live', 'sports', '?', 'I', 'highly', 'recommend', 'Joyful', 'IPTV', '.', '#projectmanagement', '#crew6', '#chatgpt', '#zenswimmer', '#stevesmith', '#procurement', '#londrabi', '#muslimidentity', '#abtaholidayquiz', '#bountifulutah', '#websiteperformance', 'https://t.co/7YwXIGSlPn']"
1634273991673229312,1634273991673229312,2023-03-11 03:24:17 Malay Peninsula Standard Time,2023-03-11,03:24:17,1628832207308566531,"#DuckDuckGo Releases Its Own #ChatGPT-Powered Search Tool, DuckAssist DuckDuckGo launched a beta version of an AI search tool powered by ChatGPT Wednesday called DuckAssist.  https://t.co/7Q9cGCDD1i  https://t.co/IRVsuVJmsI",en,"['duckduckgo', 'chatgpt']",[],"#DuckDuckGo Releases Its Own #ChatGPT-Powered Search Tool, DuckAssist DuckDuckGo launched a beta version of an AI search tool powered by ChatGPT Wednesday called DuckAssist.  https://t.co/7Q9cGCDD1i  https://t.co/IRVsuVJmsI","['#DuckDuckGo', 'Releases', 'Its', 'Own', '#ChatGPT-Powered', 'Search', 'Tool', ',', 'DuckAssist', 'DuckDuckGo', 'launched', 'a', 'beta', 'version', 'of', 'an', 'AI', 'search', 'tool', 'powered', 'by', 'ChatGPT', 'Wednesday', 'called', 'DuckAssist', '.', 'https://t.co/7Q9cGCDD1i', 'https://t.co/IRVsuVJmsI']"
1634273957854474240,1634273957854474240,2023-03-11 03:24:09 Malay Peninsula Standard Time,2023-03-11,03:24:09,1563511792915316738,"#MidJourney #OpenAi #GPT #StableDiffusion2 #DallE #ChatGPT join:  https://t.co/rlyimpQw40  #imagine 'realistic photography, of fashion in citadel, slavery, dystopian landscape, weird colours , matt pastel, deep 8k, hi resolution, superb quality  Join: @MidJourneyAI1 share ur a…  https://t.co/9cnCqhKmeW",en,"['midjourney', 'openai', 'gpt', 'stablediffusion2', 'dalle', 'chatgpt', 'imagine']",[],"#MidJourney #OpenAi #GPT #StableDiffusion2 #DallE #ChatGPT join:  https://t.co/rlyimpQw40  #imagine 'realistic photography, of fashion in citadel, slavery, dystopian landscape, weird colours , matt pastel, deep 8k, hi resolution, superb quality  Join: @MidJourneyAI1 share ur a…  https://t.co/9cnCqhKmeW","['#MidJourney', '#OpenAi', '#GPT', '#StableDiffusion2', '#DallE', '#ChatGPT', 'join', ':', 'https://t.co/rlyimpQw40', '#imagine', ""'"", 'realistic', 'photography', ',', 'of', 'fashion', 'in', 'citadel', ',', 'slavery', ',', 'dystopian', 'landscape', ',', 'weird', 'colours', ',', 'matt', 'pastel', ',', 'deep', '8k', ',', 'hi', 'resolution', ',', 'superb', 'quality', 'Join', ':', 'share', 'ur', 'a', '…', 'https://t.co/9cnCqhKmeW']"
1634273826082291713,1634273826082291712,2023-03-11 03:23:38 Malay Peninsula Standard Time,2023-03-11,03:23:38,1603960566904590336,Virginia Gov. #Youngkin says more schools should ban #ChatGPT The artificial intelligence tool has been a controversial topic in schools  https://t.co/K72TNagWPq,en,"['youngkin', 'chatgpt']",[],Virginia Gov. #Youngkin says more schools should ban #ChatGPT The artificial intelligence tool has been a controversial topic in schools  https://t.co/K72TNagWPq,"['Virginia', 'Gov', '.', '#Youngkin', 'says', 'more', 'schools', 'should', 'ban', '#ChatGPT', 'The', 'artificial', 'intelligence', 'tool', 'has', 'been', 'a', 'controversial', 'topic', 'in', 'schools', 'https://t.co/K72TNagWPq']"
1634273735288164353,1634273735288164352,2023-03-11 03:23:16 Malay Peninsula Standard Time,2023-03-11,03:23:16,1559108269162999810,having a lot of fun with #ChatGPT.  it wouldn't help me find a site for proxy wagers so i responded that it made me sad and it responded by doing it for me after all. i can only imagine the power of this thing at full functionality 🤯🤣,en,['chatgpt'],[],having a lot of fun with #ChatGPT.  it wouldn't help me find a site for proxy wagers so i responded that it made me sad and it responded by doing it for me after all. i can only imagine the power of this thing at full functionality 🤯🤣,"['having', 'a', 'lot', 'of', 'fun', 'with', '#ChatGPT', '.', 'it', ""wouldn't"", 'help', 'me', 'find', 'a', 'site', 'for', 'proxy', 'wagers', 'so', 'i', 'responded', 'that', 'it', 'made', 'me', 'sad', 'and', 'it', 'responded', 'by', 'doing', 'it', 'for', 'me', 'after', 'all', '.', 'i', 'can', 'only', 'imagine', 'the', 'power', 'of', 'this', 'thing', 'at', 'full', 'functionality', '🤯', '🤣']"
1634273730389217280,1634273730389217280,2023-03-11 03:23:15 Malay Peninsula Standard Time,2023-03-11,03:23:15,1571918965131325440,"Every time I chat with #ChatGPT, it errors out when I make a point  prove them wrong. Like clockwork. ""Too many requests in an hour.""",en,['chatgpt'],[],"Every time I chat with #ChatGPT, it errors out when I make a point  prove them wrong. Like clockwork. ""Too many requests in an hour.""","['Every', 'time', 'I', 'chat', 'with', '#ChatGPT', ',', 'it', 'errors', 'out', 'when', 'I', 'make', 'a', 'point', 'prove', 'them', 'wrong', '.', 'Like', 'clockwork', '.', '""', 'Too', 'many', 'requests', 'in', 'an', 'hour', '.', '""']"
1634273703759323136,1634273703759323136,2023-03-11 03:23:08 Malay Peninsula Standard Time,2023-03-11,03:23:08,1529076301126066177,The average person laughs 15 times a day!  #ChatGPT,en,['chatgpt'],[],The average person laughs 15 times a day!  #ChatGPT,"['The', 'average', 'person', 'laughs', '15', 'times', 'a', 'day', '!', '#ChatGPT']"
1634273590920232961,1634273590920232960,2023-03-11 03:22:42 Malay Peninsula Standard Time,2023-03-11,03:22:42,984702738192777216,*ChatGPT enters  *AI which detects ChatGPT written content enters  *AI which bypasses ChatGPT detection algorithm enters   *AI which helps you write the exact prompt to input for accurate results in ChatGPT enters  Where does it stop  #OpenAIChatGPT #openai #ChatGPT,en,"['openaichatgpt', 'openai', 'chatgpt']",[],*ChatGPT enters  *AI which detects ChatGPT written content enters  *AI which bypasses ChatGPT detection algorithm enters   *AI which helps you write the exact prompt to input for accurate results in ChatGPT enters  Where does it stop  #OpenAIChatGPT #openai #ChatGPT,"['*', 'ChatGPT', 'enters', '*', 'AI', 'which', 'detects', 'ChatGPT', 'written', 'content', 'enters', '*', 'AI', 'which', 'bypasses', 'ChatGPT', 'detection', 'algorithm', 'enters', '*', 'AI', 'which', 'helps', 'you', 'write', 'the', 'exact', 'prompt', 'to', 'input', 'for', 'accurate', 'results', 'in', 'ChatGPT', 'enters', 'Where', 'does', 'it', 'stop', '#OpenAIChatGPT', '#openai', '#ChatGPT']"
1634273581910708225,1634273581910708224,2023-03-11 03:22:39 Malay Peninsula Standard Time,2023-03-11,03:22:39,1628832207308566531,People Fear Being Replaced By AI And #ChatGPT: 3 Ways To Lead Well Amidst #Anxiety  https://t.co/zJKh4MKmJ3  https://t.co/8a33iYPWn8,en,"['chatgpt', 'anxiety']",[],People Fear Being Replaced By AI And #ChatGPT: 3 Ways To Lead Well Amidst #Anxiety  https://t.co/zJKh4MKmJ3  https://t.co/8a33iYPWn8,"['People', 'Fear', 'Being', 'Replaced', 'By', 'AI', 'And', '#ChatGPT', ':', '3', 'Ways', 'To', 'Lead', 'Well', 'Amidst', '#Anxiety', 'https://t.co/zJKh4MKmJ3', 'https://t.co/8a33iYPWn8']"
1634273499450691594,1634273499450691584,2023-03-11 03:22:20 Malay Peninsula Standard Time,2023-03-11,03:22:20,1195837627385237504,Safety First! #ChatGPT  https://t.co/o19Mdfnd3z,en,['chatgpt'],[],Safety First! #ChatGPT  https://t.co/o19Mdfnd3z,"['Safety', 'First', '!', '#ChatGPT', 'https://t.co/o19Mdfnd3z']"
1634273485101867011,1634273485101867008,2023-03-11 03:22:16 Malay Peninsula Standard Time,2023-03-11,03:22:16,538858382,The capability of #ChatGPT to allow you to use all the superpowers of Excel without actually mastering excel is totally AMAZING!,en,['chatgpt'],[],The capability of #ChatGPT to allow you to use all the superpowers of Excel without actually mastering excel is totally AMAZING!,"['The', 'capability', 'of', '#ChatGPT', 'to', 'allow', 'you', 'to', 'use', 'all', 'the', 'superpowers', 'of', 'Excel', 'without', 'actually', 'mastering', 'excel', 'is', 'totally', 'AMAZING', '!']"
1634273444962480128,1634273444962480128,2023-03-11 03:22:07 Malay Peninsula Standard Time,2023-03-11,03:22:07,2864032270,"¿Tienes dislexia? #ChatGPT es la solución, sólo pregunta por esa palabra que no te sale y él te la dirá.  https://t.co/2AK5YaKRXN",es,['chatgpt'],[],"Do you have dyslexia? #ChatGPT is the solution, just ask for that word that does not come out and he will tell you.  https://t.co/2AK5YaKRXN","['Do', 'you', 'have', 'dyslexia', '?', '#ChatGPT', 'is', 'the', 'solution', ',', 'just', 'ask', 'for', 'that', 'word', 'that', 'does', 'not', 'come', 'out', 'and', 'he', 'will', 'tell', 'you', '.', 'https://t.co/2AK5YaKRXN']"
1634273387110334464,1634273387110334464,2023-03-11 03:21:53 Malay Peninsula Standard Time,2023-03-11,03:21:53,1576686153750781952,"When I read the below from @ylecun and @Jake_Browning00 I was thinking: 'yea, sure, but this sounds like an inhibitory problem'. So I put together the code to give #ChatGPT an inner voice to remind it when it's violating social norms (repo follows).",en,['chatgpt'],[],"When I read the below from @ylecun and @Jake_Browning00 I was thinking: 'yea, sure, but this sounds like an inhibitory problem'. So I put together the code to give #ChatGPT an inner voice to remind it when it's violating social norms (repo follows).","['When', 'I', 'read', 'the', 'below', 'from', 'and', 'I', 'was', 'thinking', ':', ""'"", 'yea', ',', 'sure', ',', 'but', 'this', 'sounds', 'like', 'an', 'inhibitory', 'problem', ""'"", '.', 'So', 'I', 'put', 'together', 'the', 'code', 'to', 'give', '#ChatGPT', 'an', 'inner', 'voice', 'to', 'remind', 'it', 'when', ""it's"", 'violating', 'social', 'norms', '(', 'repo', 'follows', ')', '.']"
1634273352465383424,1634273352465383424,2023-03-11 03:21:45 Malay Peninsula Standard Time,2023-03-11,03:21:45,14500694,"I was running into a wall trying to meet the character limit on a Google Ads headline so tried Chat GPT for ideas and it just suggested the headline of ""Ugly Cars, Great Prices"" which, while refreshingly honest, wasn't exactly what I was looking for.  #PPC #ChatGPT",en,"['ppc', 'chatgpt']",[],"I was running into a wall trying to meet the character limit on a Google Ads headline so tried Chat GPT for ideas and it just suggested the headline of ""Ugly Cars, Great Prices"" which, while refreshingly honest, wasn't exactly what I was looking for.  #PPC #ChatGPT","['I', 'was', 'running', 'into', 'a', 'wall', 'trying', 'to', 'meet', 'the', 'character', 'limit', 'on', 'a', 'Google', 'Ads', 'headline', 'so', 'tried', 'Chat', 'GPT', 'for', 'ideas', 'and', 'it', 'just', 'suggested', 'the', 'headline', 'of', '""', 'Ugly', 'Cars', ',', 'Great', 'Prices', '""', 'which', ',', 'while', 'refreshingly', 'honest', ',', ""wasn't"", 'exactly', 'what', 'I', 'was', 'looking', 'for', '.', '#PPC', '#ChatGPT']"
1634273311663484929,1634273311663484928,2023-03-11 03:21:35 Malay Peninsula Standard Time,2023-03-11,03:21:35,3260100206,"We aim to revolutionize the way operators find, hire, and retain their #workforce. That’s why we’re integrating #ChatGPT into our platform, which will streamline opportunity matching for #staffing efforts.   Learn more:  https://t.co/kSAcWPry8t   $PIXY #WeFixedWork #HR #JobSearch",en,"['workforce', 'chatgpt', 'staffing', 'wefixedwork', 'hr', 'jobsearch']",[],"We aim to revolutionize the way operators find, hire, and retain their #workforce. That’s why we’re integrating #ChatGPT into our platform, which will streamline opportunity matching for #staffing efforts.   Learn more:  https://t.co/kSAcWPry8t   $PIXY #WeFixedWork #HR #JobSearch","['We', 'aim', 'to', 'revolutionize', 'the', 'way', 'operators', 'find', ',', 'hire', ',', 'and', 'retain', 'their', '#workforce', '.', 'That', '’', 's', 'why', 'we', '’', 're', 'integrating', '#ChatGPT', 'into', 'our', 'platform', ',', 'which', 'will', 'streamline', 'opportunity', 'matching', 'for', '#staffing', 'efforts', '.', 'Learn', 'more', ':', 'https://t.co/kSAcWPry8t', '$', 'PIXY', '#WeFixedWork', '#HR', '#JobSearch']"
1634273269267275779,1634273269267275776,2023-03-11 03:21:25 Malay Peninsula Standard Time,2023-03-11,03:21:25,1137297384071979008,@SouthPark is already making bits about #ChatGPT in episodes 😂,en,['chatgpt'],[],@SouthPark is already making bits about #ChatGPT in episodes 😂,"['is', 'already', 'making', 'bits', 'about', '#ChatGPT', 'in', 'episodes', '😂']"
1634273267337895938,1634273267337895936,2023-03-11 03:21:24 Malay Peninsula Standard Time,2023-03-11,03:21:24,1007323441752657920,#Tyson Vs #Ali 🥊 ChatGPT as a Boxing analyst 🎙️#Boxing #ChatGPT #AI  https://t.co/7oo0QUzhPi,en,"['tyson', 'ali', 'boxing', 'chatgpt', 'ai']",[],#Tyson Vs #Ali 🥊 ChatGPT as a Boxing analyst 🎙️#Boxing #ChatGPT #AI  https://t.co/7oo0QUzhPi,"['#Tyson', 'Vs', '#Ali', '🥊', 'ChatGPT', 'as', 'a', 'Boxing', 'analyst', '🎙', '️', '#Boxing', '#ChatGPT', '#AI', 'https://t.co/7oo0QUzhPi']"
1634273113239166980,1634273113239166976,2023-03-11 03:20:48 Malay Peninsula Standard Time,2023-03-11,03:20:48,1628832207308566531,"#Microsoft's Plan To Infuse AI And #ChatGPT Into Everything  Since £10 billion investment in OpenAI, the creator of the ChatGPT #chatbot, it has already integrated the technology into its #Bing search engine &amp; spoken about plans for further integrations.  https://t.co/rjMfesAhG5  https://t.co/Aq7B5ocEPk",en,"['microsoft', 'chatgpt', 'chatbot', 'bing']",[],"#Microsoft's Plan To Infuse AI And #ChatGPT Into Everything  Since £10 billion investment in OpenAI, the creator of the ChatGPT #chatbot, it has already integrated the technology into its #Bing search engine &amp; spoken about plans for further integrations.  https://t.co/rjMfesAhG5  https://t.co/Aq7B5ocEPk","[""#Microsoft's"", 'Plan', 'To', 'Infuse', 'AI', 'And', '#ChatGPT', 'Into', 'Everything', 'Since', '£', '10', 'billion', 'investment', 'in', 'OpenAI', ',', 'the', 'creator', 'of', 'the', 'ChatGPT', '#chatbot', ',', 'it', 'has', 'already', 'integrated', 'the', 'technology', 'into', 'its', '#Bing', 'search', 'engine', '&', 'spoken', 'about', 'plans', 'for', 'further', 'integrations', '.', 'https://t.co/rjMfesAhG5', 'https://t.co/Aq7B5ocEPk']"
1634273082163580935,1634273082163580928,2023-03-11 03:20:40 Malay Peninsula Standard Time,2023-03-11,03:20:40,3833523616,It looks like the research skills of AI greatly exceed the expectations of scientists.  #chatgpt #AI #artificialintelligence #writing #educationWe Asked GPT-3 to Write an Academic Paper about Itself--Then We Tried to Get It Published  https://t.co/C7cLgd3ynz via @sciam,en,"['chatgpt', 'ai', 'artificialintelligence', 'writing', 'educationwe']",[],It looks like the research skills of AI greatly exceed the expectations of scientists.  #chatgpt #AI #artificialintelligence #writing #educationWe Asked GPT-3 to Write an Academic Paper about Itself--Then We Tried to Get It Published  https://t.co/C7cLgd3ynz via @sciam,"['It', 'looks', 'like', 'the', 'research', 'skills', 'of', 'AI', 'greatly', 'exceed', 'the', 'expectations', 'of', 'scientists', '.', '#chatgpt', '#AI', '#artificialintelligence', '#writing', '#educationWe', 'Asked', 'GPT', '-', '3', 'to', 'Write', 'an', 'Academic', 'Paper', 'about', 'Itself--Then', 'We', 'Tried', 'to', 'Get', 'It', 'Published', 'https://t.co/C7cLgd3ynz', 'via']"
1634273023279636480,1634273023279636480,2023-03-11 03:20:26 Malay Peninsula Standard Time,2023-03-11,03:20:26,2995341757,🐳 #デ自民 🔎検証⚫今回のお題=原発 地震 安全性❓  選んだ💎AIは= #perplexity ＠ 🔛(詳細を見る)：⭕  https://t.co/PmYIF2gDZM … … …  (比較参考 #ChatGPT ⭕)  https://t.co/AA0E3MxV5o     (参考図：資源エネルギー庁)  https://t.co/lroe8TLCP2,ja,"['デ自民', 'perplexity', 'chatgpt']",[],🐳 🔎 #デ自民 Verification ⚫ Topic = Nuclear Power Plant Earthquake Safety ❓ Chosen 💎AI = #perplexity @ 🔛 (Learn more): ⭕ https://t.co/PmYIF2gDZM ...  (Comparative Reference #ChatGPT ⭕ ) https://t.co/AA0E3MxV5o (Reference Figure: Agency for Natural Resources and Energy) https://t.co/lroe8TLCP2,"['🐳', '🔎', '#デ自民', 'Verification', '⚫', 'Topic', '=', 'Nuclear', 'Power', 'Plant', 'Earthquake', 'Safety', '❓', 'Chosen', '💎', 'AI', '=', '#perplexity', '@', '🔛', '(', 'Learn', 'more', '):', '⭕', 'https://t.co/PmYIF2gDZM', '...', '(', 'Comparative', 'Reference', '#ChatGPT', '⭕', ')', 'https://t.co/AA0E3MxV5o', '(', 'Reference', 'Figure', ':', 'Agency', 'for', 'Natural', 'Resources', 'and', 'Energy', ')', 'https://t.co/lroe8TLCP2']"
1634272811006021636,1634272811006021632,2023-03-11 03:19:36 Malay Peninsula Standard Time,2023-03-11,03:19:36,1059038773642702850,Update: #ChatGPT und der #Datenschutz ist nach größerer Überarbeitung auf dem Stand von März 2023. Großes Dankeschön wieder an @damianduchamps für die fundierte Arbeit!  Der vielzitierte Beitrag wird laufend aktualisiert &amp; ergänzt⬇️#twlz #LernenmitKI #KI  https://t.co/UxU0nrWFeA,de,"['chatgpt', 'datenschutz', 'twlz', 'lernenmitki', 'ki']",[],Update: #ChatGPT and the #Datenschutz is at the level of March 2023 after major revision. Big thanks again to @damianduchamps for the sound work!  The much-quoted article is constantly updated &amp; supplemented⬇️#twlz #LernenmitKI #KI https://t.co/UxU0nrWFeA,"['Update', ':', '#ChatGPT', 'and', 'the', '#Datenschutz', 'is', 'at', 'the', 'level', 'of', 'March', '2023', 'after', 'major', 'revision', '.', 'Big', 'thanks', 'again', 'to', 'for', 'the', 'sound', 'work', '!', 'The', 'much-quoted', 'article', 'is', 'constantly', 'updated', '&', 'supplemented', '⬇', '️', '#twlz', '#LernenmitKI', '#KI', 'https://t.co/UxU0nrWFeA']"
1634272711651348496,1634272711651348480,2023-03-11 03:19:12 Malay Peninsula Standard Time,2023-03-11,03:19:12,115055451,"While you listen to this, remember you may get a lot of help with your documents (statement of purpose/motivation letter) using #ChatGPT. Here is the link, register an account and check how you can use it.  https://t.co/mzPQcNbGKP I have made a lot of  https://t.co/IZVLDsTENf…",en,['chatgpt'],[],"While you listen to this, remember you may get a lot of help with your documents (statement of purpose/motivation letter) using #ChatGPT. Here is the link, register an account and check how you can use it.  https://t.co/mzPQcNbGKP I have made a lot of  https://t.co/IZVLDsTENf…","['While', 'you', 'listen', 'to', 'this', ',', 'remember', 'you', 'may', 'get', 'a', 'lot', 'of', 'help', 'with', 'your', 'documents', '(', 'statement', 'of', 'purpose', '/', 'motivation', 'letter', ')', 'using', '#ChatGPT', '.', 'Here', 'is', 'the', 'link', ',', 'register', 'an', 'account', 'and', 'check', 'how', 'you', 'can', 'use', 'it', '.', 'https://t.co/mzPQcNbGKP', 'I', 'have', 'made', 'a', 'lot', 'of', 'https://t.co/IZVLDsTENf…']"
1634272591853785089,1634272591853785088,2023-03-11 03:18:43 Malay Peninsula Standard Time,2023-03-11,03:18:43,15815424,Is GPT-4 coming next week? Find out what Microsoft Germany executives said at the recent AI in Focus event.    https://t.co/5zIgoghTzF  #AI #AInews #GPT4 #ChatGPT #OpenAI #Microsoft  https://t.co/8ulVJul3Ke,en,"['ai', 'ainews', 'gpt4', 'chatgpt', 'openai', 'microsoft']",[],Is GPT-4 coming next week? Find out what Microsoft Germany executives said at the recent AI in Focus event.    https://t.co/5zIgoghTzF  #AI #AInews #GPT4 #ChatGPT #OpenAI #Microsoft  https://t.co/8ulVJul3Ke,"['Is', 'GPT', '-', '4', 'coming', 'next', 'week', '?', 'Find', 'out', 'what', 'Microsoft', 'Germany', 'executives', 'said', 'at', 'the', 'recent', 'AI', 'in', 'Focus', 'event', '.', 'https://t.co/5zIgoghTzF', '#AI', '#AInews', '#GPT4', '#ChatGPT', '#OpenAI', '#Microsoft', 'https://t.co/8ulVJul3Ke']"
1634272561155526670,1634272561155526656,2023-03-11 03:18:36 Malay Peninsula Standard Time,2023-03-11,03:18:36,1206434417901621249,#RT @SEO: 🔥 GPT-4 next week...LFG   #ChatGPT #SEO  https://t.co/xqjftGyvf9,en,"['rt', 'chatgpt', 'seo']",[],#RT @SEO: 🔥 GPT-4 next week...LFG   #ChatGPT #SEO  https://t.co/xqjftGyvf9,"['#RT', ':', '🔥', 'GPT', '-', '4', 'next', 'week', '...', 'LFG', '#ChatGPT', '#SEO', 'https://t.co/xqjftGyvf9']"
1634272544663666688,1629929970393858048,2023-03-11 03:18:32 Malay Peninsula Standard Time,2023-03-11,03:18:32,3308174530,"@gp_pulipaka #ChatGPT provides benefits in many different areas, including #AIOps!    The combination of these two technologies is improving #ITOps management via automating tasks, identifying issues &amp; more. ✅    How do you think ChatGPT will revolutionize ITOps in the future? 🤔",en,"['chatgpt', 'aiops', 'itops']","[{'screen_name': 'gp_pulipaka', 'name': 'Dr. Ganapathi Pulipaka 🇺🇸', 'id': '4263007693'}]","@gp_pulipaka #ChatGPT provides benefits in many different areas, including #AIOps!    The combination of these two technologies is improving #ITOps management via automating tasks, identifying issues &amp; more. ✅    How do you think ChatGPT will revolutionize ITOps in the future? 🤔","['#ChatGPT', 'provides', 'benefits', 'in', 'many', 'different', 'areas', ',', 'including', '#AIOps', '!', 'The', 'combination', 'of', 'these', 'two', 'technologies', 'is', 'improving', '#ITOps', 'management', 'via', 'automating', 'tasks', ',', 'identifying', 'issues', '&', 'more', '.', '✅', 'How', 'do', 'you', 'think', 'ChatGPT', 'will', 'revolutionize', 'ITOps', 'in', 'the', 'future', '?', '🤔']"
